{"componentChunkName":"component---src-templates-doc-template-js","path":"/libraries/standalone/artist-UI","result":{"data":{"mdx":{"frontmatter":{"title":"Artist UI","summary":null,"icon":"palette-fill"},"tableOfContents":{"items":[{"url":"#features","title":"Features"},{"url":"#installation","title":"Installation"},{"url":"#basic-example","title":"Basic example"},{"url":"#render","title":"Render"},{"url":"#oninit","title":"OnInit"},{"url":"#store","title":"Store"},{"url":"#timer","title":"Timer"},{"url":"#built-in-elements","title":"Built-in elements","items":[{"url":"#text","title":"Text"},{"url":"#props","title":"Props"},{"url":"#row-and-columns","title":"Row and columns"},{"url":"#box","title":"Box"},{"url":"#spinner","title":"Spinner"},{"url":"#progress-bar","title":"Progress bar"},{"url":"#div","title":"Div"},{"url":"#span","title":"Span"},{"url":"#newline","title":"Newline"},{"url":"#space","title":"Space"}]},{"url":"#custom-elements","title":"Custom elements","items":[{"url":"#register-new-element","title":"Register new element"},{"url":"#async-timer","title":"Async Timer"},{"url":"#context-and-props","title":"Context and props"}]},{"url":"#config","title":"Config"},{"url":"#templating","title":"Templating"},{"url":"#clear-timers","title":"Clear timers"},{"url":"#performance","title":"Performance","items":[{"url":"#donts","title":"Dont's"}]},{"url":"#know-more","title":"Know more"}]},"body":"function _extends() { _extends = Object.assign || function (target) { for (var i = 1; i < arguments.length; i++) { var source = arguments[i]; for (var key in source) { if (Object.prototype.hasOwnProperty.call(source, key)) { target[key] = source[key]; } } } return target; }; return _extends.apply(this, arguments); }\n\nfunction _objectWithoutProperties(source, excluded) { if (source == null) return {}; var target = _objectWithoutPropertiesLoose(source, excluded); var key, i; if (Object.getOwnPropertySymbols) { var sourceSymbolKeys = Object.getOwnPropertySymbols(source); for (i = 0; i < sourceSymbolKeys.length; i++) { key = sourceSymbolKeys[i]; if (excluded.indexOf(key) >= 0) continue; if (!Object.prototype.propertyIsEnumerable.call(source, key)) continue; target[key] = source[key]; } } return target; }\n\nfunction _objectWithoutPropertiesLoose(source, excluded) { if (source == null) return {}; var target = {}; var sourceKeys = Object.keys(source); var key, i; for (i = 0; i < sourceKeys.length; i++) { key = sourceKeys[i]; if (excluded.indexOf(key) >= 0) continue; target[key] = source[key]; } return target; }\n\n/* @jsxRuntime classic */\n\n/* @jsx mdx */\nvar _frontmatter = {\n  \"title\": \"Artist UI\",\n  \"icon\": \"palette-fill\"\n};\nvar layoutProps = {\n  _frontmatter: _frontmatter\n};\nvar MDXLayout = \"wrapper\";\nreturn function MDXContent(_ref) {\n  var components = _ref.components,\n      props = _objectWithoutProperties(_ref, [\"components\"]);\n\n  return mdx(MDXLayout, _extends({}, layoutProps, props, {\n    components: components,\n    mdxType: \"MDXLayout\"\n  }), mdx(\"p\", null, \"Artist UI is an independent standalone library of lesy, which allows us to re-render the content whenever there is a change in data. Not just that, but Arist also comes with lot of in-built interface elements like spinner, progress bar, column, box, colorful text and more.\"), mdx(\"p\", null, \"Best part is, Artist API is clean and the template resembels markup language, so that you dont need to learn new concepts.\"), mdx(\"h2\", {\n    \"id\": \"features\",\n    \"style\": {\n      \"position\": \"relative\"\n    }\n  }, mdx(\"a\", {\n    parentName: \"h2\",\n    \"href\": \"#features\",\n    \"aria-label\": \"features permalink\",\n    \"className\": \"anchor before\"\n  }, mdx(\"svg\", {\n    parentName: \"a\",\n    \"aria-hidden\": \"true\",\n    \"focusable\": \"false\",\n    \"height\": \"16\",\n    \"version\": \"1.1\",\n    \"viewBox\": \"0 0 16 16\",\n    \"width\": \"16\"\n  }, mdx(\"path\", {\n    parentName: \"svg\",\n    \"fillRule\": \"evenodd\",\n    \"d\": \"M4 9h1v1H4c-1.5 0-3-1.69-3-3.5S2.55 3 4 3h4c1.45 0 3 1.69 3 3.5 0 1.41-.91 2.72-2 3.25V8.59c.58-.45 1-1.27 1-2.09C10 5.22 8.98 4 8 4H4c-.98 0-2 1.22-2 2.5S3 9 4 9zm9-3h-1v1h1c1 0 2 1.22 2 2.5S13.98 12 13 12H9c-.98 0-2-1.22-2-2.5 0-.83.42-1.64 1-2.09V6.25c-1.09.53-2 1.84-2 3.25C6 11.31 7.55 13 9 13h4c1.45 0 3-1.69 3-3.5S14.5 6 13 6z\"\n  }))), \"Features\"), mdx(\"ul\", null, mdx(\"li\", {\n    parentName: \"ul\"\n  }, \"Simple API and Lightweight\"), mdx(\"li\", {\n    parentName: \"ul\"\n  }, \"Comparatively Faster\"), mdx(\"li\", {\n    parentName: \"ul\"\n  }, \"Built-in elements\"), mdx(\"li\", {\n    parentName: \"ul\"\n  }, \"Composable and Extensible with custom elements\"), mdx(\"li\", {\n    parentName: \"ul\"\n  }, \"Smart change detection\"), mdx(\"li\", {\n    parentName: \"ul\"\n  }, \"HMTL like markup code and template strings\"), mdx(\"li\", {\n    parentName: \"ul\"\n  }, \"Configurable\")), mdx(\"h2\", {\n    \"id\": \"installation\",\n    \"style\": {\n      \"position\": \"relative\"\n    }\n  }, mdx(\"a\", {\n    parentName: \"h2\",\n    \"href\": \"#installation\",\n    \"aria-label\": \"installation permalink\",\n    \"className\": \"anchor before\"\n  }, mdx(\"svg\", {\n    parentName: \"a\",\n    \"aria-hidden\": \"true\",\n    \"focusable\": \"false\",\n    \"height\": \"16\",\n    \"version\": \"1.1\",\n    \"viewBox\": \"0 0 16 16\",\n    \"width\": \"16\"\n  }, mdx(\"path\", {\n    parentName: \"svg\",\n    \"fillRule\": \"evenodd\",\n    \"d\": \"M4 9h1v1H4c-1.5 0-3-1.69-3-3.5S2.55 3 4 3h4c1.45 0 3 1.69 3 3.5 0 1.41-.91 2.72-2 3.25V8.59c.58-.45 1-1.27 1-2.09C10 5.22 8.98 4 8 4H4c-.98 0-2 1.22-2 2.5S3 9 4 9zm9-3h-1v1h1c1 0 2 1.22 2 2.5S13.98 12 13 12H9c-.98 0-2-1.22-2-2.5 0-.83.42-1.64 1-2.09V6.25c-1.09.53-2 1.84-2 3.25C6 11.31 7.55 13 9 13h4c1.45 0 3-1.69 3-3.5S14.5 6 13 6z\"\n  }))), \"Installation\"), mdx(\"div\", {\n    \"className\": \"gatsby-highlight\",\n    \"data-language\": \"shell\"\n  }, mdx(\"pre\", {\n    parentName: \"div\",\n    \"className\": \"language-shell\"\n  }, mdx(\"code\", {\n    parentName: \"pre\",\n    \"className\": \"language-shell\"\n  }, mdx(\"span\", {\n    parentName: \"code\",\n    \"className\": \"token function\"\n  }, \"npm\"), \" \", mdx(\"span\", {\n    parentName: \"code\",\n    \"className\": \"token function\"\n  }, \"install\"), \" @lesy/artist\\n\", mdx(\"span\", {\n    parentName: \"code\",\n    \"className\": \"token function\"\n  }, \"yarn\"), \" \", mdx(\"span\", {\n    parentName: \"code\",\n    \"className\": \"token function\"\n  }, \"add\"), \" @lesy/artist\"))), mdx(\"div\", {\n    \"className\": \"gatsby-highlight\",\n    \"data-language\": \"js\"\n  }, mdx(\"pre\", {\n    parentName: \"div\",\n    \"className\": \"language-js\"\n  }, mdx(\"code\", {\n    parentName: \"pre\",\n    \"className\": \"language-js\"\n  }, mdx(\"span\", {\n    parentName: \"code\",\n    \"className\": \"token keyword\"\n  }, \"import\"), \" Artist \", mdx(\"span\", {\n    parentName: \"code\",\n    \"className\": \"token keyword\"\n  }, \"from\"), \" \", mdx(\"span\", {\n    parentName: \"code\",\n    \"className\": \"token string\"\n  }, \"\\\"@lesy/artist\\\"\"), mdx(\"span\", {\n    parentName: \"code\",\n    \"className\": \"token punctuation\"\n  }, \";\"), \"\\n\", mdx(\"span\", {\n    parentName: \"code\",\n    \"className\": \"token keyword\"\n  }, \"const\"), \" Artist \", mdx(\"span\", {\n    parentName: \"code\",\n    \"className\": \"token operator\"\n  }, \"=\"), \" \", mdx(\"span\", {\n    parentName: \"code\",\n    \"className\": \"token function\"\n  }, \"require\"), mdx(\"span\", {\n    parentName: \"code\",\n    \"className\": \"token punctuation\"\n  }, \"(\"), mdx(\"span\", {\n    parentName: \"code\",\n    \"className\": \"token string\"\n  }, \"\\\"@lesy/artist\\\"\"), mdx(\"span\", {\n    parentName: \"code\",\n    \"className\": \"token punctuation\"\n  }, \")\"), mdx(\"span\", {\n    parentName: \"code\",\n    \"className\": \"token punctuation\"\n  }, \";\")))), mdx(\"h2\", {\n    \"id\": \"basic-example\",\n    \"style\": {\n      \"position\": \"relative\"\n    }\n  }, mdx(\"a\", {\n    parentName: \"h2\",\n    \"href\": \"#basic-example\",\n    \"aria-label\": \"basic example permalink\",\n    \"className\": \"anchor before\"\n  }, mdx(\"svg\", {\n    parentName: \"a\",\n    \"aria-hidden\": \"true\",\n    \"focusable\": \"false\",\n    \"height\": \"16\",\n    \"version\": \"1.1\",\n    \"viewBox\": \"0 0 16 16\",\n    \"width\": \"16\"\n  }, mdx(\"path\", {\n    parentName: \"svg\",\n    \"fillRule\": \"evenodd\",\n    \"d\": \"M4 9h1v1H4c-1.5 0-3-1.69-3-3.5S2.55 3 4 3h4c1.45 0 3 1.69 3 3.5 0 1.41-.91 2.72-2 3.25V8.59c.58-.45 1-1.27 1-2.09C10 5.22 8.98 4 8 4H4c-.98 0-2 1.22-2 2.5S3 9 4 9zm9-3h-1v1h1c1 0 2 1.22 2 2.5S13.98 12 13 12H9c-.98 0-2-1.22-2-2.5 0-.83.42-1.64 1-2.09V6.25c-1.09.53-2 1.84-2 3.25C6 11.31 7.55 13 9 13h4c1.45 0 3-1.69 3-3.5S14.5 6 13 6z\"\n  }))), \"Basic example\"), mdx(\"p\", null, \"Once installed, instantanize the Artist class. To print the content in the terminal, call \", mdx(\"code\", {\n    parentName: \"p\",\n    \"className\": \"language-text\"\n  }, \"render\"), \" method and pass a function which returns a plain string or element string.\"), mdx(\"div\", {\n    \"className\": \"gatsby-highlight\",\n    \"data-language\": \"js\"\n  }, mdx(\"pre\", {\n    parentName: \"div\",\n    \"className\": \"language-js\"\n  }, mdx(\"code\", {\n    parentName: \"pre\",\n    \"className\": \"language-js\"\n  }, mdx(\"span\", {\n    parentName: \"code\",\n    \"className\": \"token keyword\"\n  }, \"import\"), \" Artist \", mdx(\"span\", {\n    parentName: \"code\",\n    \"className\": \"token keyword\"\n  }, \"from\"), \" \", mdx(\"span\", {\n    parentName: \"code\",\n    \"className\": \"token string\"\n  }, \"\\\"@lesy/artist\\\"\"), mdx(\"span\", {\n    parentName: \"code\",\n    \"className\": \"token punctuation\"\n  }, \";\"), \"\\n\", mdx(\"span\", {\n    parentName: \"code\",\n    \"className\": \"token keyword\"\n  }, \"const\"), \" \", mdx(\"span\", {\n    parentName: \"code\",\n    \"className\": \"token constant\"\n  }, \"UI\"), \" \", mdx(\"span\", {\n    parentName: \"code\",\n    \"className\": \"token operator\"\n  }, \"=\"), \" \", mdx(\"span\", {\n    parentName: \"code\",\n    \"className\": \"token keyword\"\n  }, \"new\"), \" \", mdx(\"span\", {\n    parentName: \"code\",\n    \"className\": \"token class-name\"\n  }, \"Artist\"), mdx(\"span\", {\n    parentName: \"code\",\n    \"className\": \"token punctuation\"\n  }, \"(\"), mdx(\"span\", {\n    parentName: \"code\",\n    \"className\": \"token punctuation\"\n  }, \")\"), mdx(\"span\", {\n    parentName: \"code\",\n    \"className\": \"token punctuation\"\n  }, \";\"), \"\\n\\n\", mdx(\"span\", {\n    parentName: \"code\",\n    \"className\": \"token constant\"\n  }, \"UI\"), mdx(\"span\", {\n    parentName: \"code\",\n    \"className\": \"token punctuation\"\n  }, \".\"), mdx(\"span\", {\n    parentName: \"code\",\n    \"className\": \"token function\"\n  }, \"render\"), mdx(\"span\", {\n    parentName: \"code\",\n    \"className\": \"token punctuation\"\n  }, \"(\"), mdx(\"span\", {\n    parentName: \"code\",\n    \"className\": \"token punctuation\"\n  }, \"(\"), mdx(\"span\", {\n    parentName: \"code\",\n    \"className\": \"token punctuation\"\n  }, \")\"), \" \", mdx(\"span\", {\n    parentName: \"code\",\n    \"className\": \"token operator\"\n  }, \"=>\"), \" \", mdx(\"span\", {\n    parentName: \"code\",\n    \"className\": \"token template-string\"\n  }, mdx(\"span\", {\n    parentName: \"span\",\n    \"className\": \"token template-punctuation string\"\n  }, \"`\"), mdx(\"span\", {\n    parentName: \"span\",\n    \"className\": \"token string\"\n  }, \"<div>you are <text color=\\\"red\\\">awesome</text>!</div>\"), mdx(\"span\", {\n    parentName: \"span\",\n    \"className\": \"token template-punctuation string\"\n  }, \"`\")), mdx(\"span\", {\n    parentName: \"code\",\n    \"className\": \"token punctuation\"\n  }, \")\"), mdx(\"span\", {\n    parentName: \"code\",\n    \"className\": \"token punctuation\"\n  }, \";\")))), mdx(\"h2\", {\n    \"id\": \"render\",\n    \"style\": {\n      \"position\": \"relative\"\n    }\n  }, mdx(\"a\", {\n    parentName: \"h2\",\n    \"href\": \"#render\",\n    \"aria-label\": \"render permalink\",\n    \"className\": \"anchor before\"\n  }, mdx(\"svg\", {\n    parentName: \"a\",\n    \"aria-hidden\": \"true\",\n    \"focusable\": \"false\",\n    \"height\": \"16\",\n    \"version\": \"1.1\",\n    \"viewBox\": \"0 0 16 16\",\n    \"width\": \"16\"\n  }, mdx(\"path\", {\n    parentName: \"svg\",\n    \"fillRule\": \"evenodd\",\n    \"d\": \"M4 9h1v1H4c-1.5 0-3-1.69-3-3.5S2.55 3 4 3h4c1.45 0 3 1.69 3 3.5 0 1.41-.91 2.72-2 3.25V8.59c.58-.45 1-1.27 1-2.09C10 5.22 8.98 4 8 4H4c-.98 0-2 1.22-2 2.5S3 9 4 9zm9-3h-1v1h1c1 0 2 1.22 2 2.5S13.98 12 13 12H9c-.98 0-2-1.22-2-2.5 0-.83.42-1.64 1-2.09V6.25c-1.09.53-2 1.84-2 3.25C6 11.31 7.55 13 9 13h4c1.45 0 3-1.69 3-3.5S14.5 6 13 6z\"\n  }))), \"Render\"), mdx(\"p\", null, \"Artist calls the \", mdx(\"code\", {\n    parentName: \"p\",\n    \"className\": \"language-text\"\n  }, \"render\"), \" method only once during the runtime, but however the function passed to render may be called multiple times, based on the change in content.\"), mdx(\"div\", {\n    \"className\": \"gatsby-highlight\",\n    \"data-language\": \"js\"\n  }, mdx(\"pre\", {\n    parentName: \"div\",\n    \"className\": \"language-js\"\n  }, mdx(\"code\", {\n    parentName: \"pre\",\n    \"className\": \"language-js\"\n  }, mdx(\"span\", {\n    parentName: \"code\",\n    \"className\": \"token keyword\"\n  }, \"import\"), \" Artist \", mdx(\"span\", {\n    parentName: \"code\",\n    \"className\": \"token keyword\"\n  }, \"from\"), \" \", mdx(\"span\", {\n    parentName: \"code\",\n    \"className\": \"token string\"\n  }, \"\\\"@lesy/artist\\\"\"), mdx(\"span\", {\n    parentName: \"code\",\n    \"className\": \"token punctuation\"\n  }, \";\"), \"\\n\", mdx(\"span\", {\n    parentName: \"code\",\n    \"className\": \"token keyword\"\n  }, \"const\"), \" \", mdx(\"span\", {\n    parentName: \"code\",\n    \"className\": \"token constant\"\n  }, \"UI\"), \" \", mdx(\"span\", {\n    parentName: \"code\",\n    \"className\": \"token operator\"\n  }, \"=\"), \" \", mdx(\"span\", {\n    parentName: \"code\",\n    \"className\": \"token keyword\"\n  }, \"new\"), \" \", mdx(\"span\", {\n    parentName: \"code\",\n    \"className\": \"token class-name\"\n  }, \"Artist\"), mdx(\"span\", {\n    parentName: \"code\",\n    \"className\": \"token punctuation\"\n  }, \"(\"), mdx(\"span\", {\n    parentName: \"code\",\n    \"className\": \"token punctuation\"\n  }, \")\"), mdx(\"span\", {\n    parentName: \"code\",\n    \"className\": \"token punctuation\"\n  }, \";\"), \"\\n\\n\", mdx(\"span\", {\n    parentName: \"code\",\n    \"className\": \"token constant\"\n  }, \"UI\"), mdx(\"span\", {\n    parentName: \"code\",\n    \"className\": \"token punctuation\"\n  }, \".\"), mdx(\"span\", {\n    parentName: \"code\",\n    \"className\": \"token function\"\n  }, \"render\"), mdx(\"span\", {\n    parentName: \"code\",\n    \"className\": \"token punctuation\"\n  }, \"(\"), mdx(\"span\", {\n    parentName: \"code\",\n    \"className\": \"token punctuation\"\n  }, \"(\"), mdx(\"span\", {\n    parentName: \"code\",\n    \"className\": \"token punctuation\"\n  }, \")\"), \" \", mdx(\"span\", {\n    parentName: \"code\",\n    \"className\": \"token operator\"\n  }, \"=>\"), \" \", mdx(\"span\", {\n    parentName: \"code\",\n    \"className\": \"token string\"\n  }, \"\\\"It's a simple text output\\\"\"), mdx(\"span\", {\n    parentName: \"code\",\n    \"className\": \"token punctuation\"\n  }, \")\"), mdx(\"span\", {\n    parentName: \"code\",\n    \"className\": \"token punctuation\"\n  }, \";\")))), mdx(\"h2\", {\n    \"id\": \"oninit\",\n    \"style\": {\n      \"position\": \"relative\"\n    }\n  }, mdx(\"a\", {\n    parentName: \"h2\",\n    \"href\": \"#oninit\",\n    \"aria-label\": \"oninit permalink\",\n    \"className\": \"anchor before\"\n  }, mdx(\"svg\", {\n    parentName: \"a\",\n    \"aria-hidden\": \"true\",\n    \"focusable\": \"false\",\n    \"height\": \"16\",\n    \"version\": \"1.1\",\n    \"viewBox\": \"0 0 16 16\",\n    \"width\": \"16\"\n  }, mdx(\"path\", {\n    parentName: \"svg\",\n    \"fillRule\": \"evenodd\",\n    \"d\": \"M4 9h1v1H4c-1.5 0-3-1.69-3-3.5S2.55 3 4 3h4c1.45 0 3 1.69 3 3.5 0 1.41-.91 2.72-2 3.25V8.59c.58-.45 1-1.27 1-2.09C10 5.22 8.98 4 8 4H4c-.98 0-2 1.22-2 2.5S3 9 4 9zm9-3h-1v1h1c1 0 2 1.22 2 2.5S13.98 12 13 12H9c-.98 0-2-1.22-2-2.5 0-.83.42-1.64 1-2.09V6.25c-1.09.53-2 1.84-2 3.25C6 11.31 7.55 13 9 13h4c1.45 0 3-1.69 3-3.5S14.5 6 13 6z\"\n  }))), \"OnInit\"), mdx(\"p\", null, \"If you wanted to do any async calls, you can use \", mdx(\"code\", {\n    parentName: \"p\",\n    \"className\": \"language-text\"\n  }, \"onInit\"), \" method, which will be called only once before \", mdx(\"code\", {\n    parentName: \"p\",\n    \"className\": \"language-text\"\n  }, \"render\"), \".\"), mdx(\"div\", {\n    \"className\": \"gatsby-highlight\",\n    \"data-language\": \"js\"\n  }, mdx(\"pre\", {\n    parentName: \"div\",\n    \"className\": \"language-js\"\n  }, mdx(\"code\", {\n    parentName: \"pre\",\n    \"className\": \"language-js\"\n  }, mdx(\"span\", {\n    parentName: \"code\",\n    \"className\": \"token keyword\"\n  }, \"import\"), \" Artist \", mdx(\"span\", {\n    parentName: \"code\",\n    \"className\": \"token keyword\"\n  }, \"from\"), \" \", mdx(\"span\", {\n    parentName: \"code\",\n    \"className\": \"token string\"\n  }, \"\\\"@lesy/artist\\\"\"), mdx(\"span\", {\n    parentName: \"code\",\n    \"className\": \"token punctuation\"\n  }, \";\"), \"\\n\", mdx(\"span\", {\n    parentName: \"code\",\n    \"className\": \"token keyword\"\n  }, \"const\"), \" \", mdx(\"span\", {\n    parentName: \"code\",\n    \"className\": \"token constant\"\n  }, \"UI\"), \" \", mdx(\"span\", {\n    parentName: \"code\",\n    \"className\": \"token operator\"\n  }, \"=\"), \" \", mdx(\"span\", {\n    parentName: \"code\",\n    \"className\": \"token keyword\"\n  }, \"new\"), \" \", mdx(\"span\", {\n    parentName: \"code\",\n    \"className\": \"token class-name\"\n  }, \"Artist\"), mdx(\"span\", {\n    parentName: \"code\",\n    \"className\": \"token punctuation\"\n  }, \"(\"), mdx(\"span\", {\n    parentName: \"code\",\n    \"className\": \"token punctuation\"\n  }, \")\"), mdx(\"span\", {\n    parentName: \"code\",\n    \"className\": \"token punctuation\"\n  }, \";\"), \"\\n\\n\", mdx(\"span\", {\n    parentName: \"code\",\n    \"className\": \"token constant\"\n  }, \"UI\"), mdx(\"span\", {\n    parentName: \"code\",\n    \"className\": \"token punctuation\"\n  }, \".\"), mdx(\"span\", {\n    parentName: \"code\",\n    \"className\": \"token function\"\n  }, \"onInit\"), mdx(\"span\", {\n    parentName: \"code\",\n    \"className\": \"token punctuation\"\n  }, \"(\"), mdx(\"span\", {\n    parentName: \"code\",\n    \"className\": \"token punctuation\"\n  }, \"(\"), mdx(\"span\", {\n    parentName: \"code\",\n    \"className\": \"token punctuation\"\n  }, \")\"), \" \", mdx(\"span\", {\n    parentName: \"code\",\n    \"className\": \"token operator\"\n  }, \"=>\"), \" \", mdx(\"span\", {\n    parentName: \"code\",\n    \"className\": \"token punctuation\"\n  }, \"{\"), \"\\n  \", mdx(\"span\", {\n    parentName: \"code\",\n    \"className\": \"token function\"\n  }, \"setTimeout\"), mdx(\"span\", {\n    parentName: \"code\",\n    \"className\": \"token punctuation\"\n  }, \"(\"), mdx(\"span\", {\n    parentName: \"code\",\n    \"className\": \"token punctuation\"\n  }, \"(\"), mdx(\"span\", {\n    parentName: \"code\",\n    \"className\": \"token punctuation\"\n  }, \")\"), \" \", mdx(\"span\", {\n    parentName: \"code\",\n    \"className\": \"token operator\"\n  }, \"=>\"), \" \", mdx(\"span\", {\n    parentName: \"code\",\n    \"className\": \"token punctuation\"\n  }, \"{\"), \"\\n    \", mdx(\"span\", {\n    parentName: \"code\",\n    \"className\": \"token comment\"\n  }, \"// do something on loading the element\"), \"\\n  \", mdx(\"span\", {\n    parentName: \"code\",\n    \"className\": \"token punctuation\"\n  }, \"}\"), mdx(\"span\", {\n    parentName: \"code\",\n    \"className\": \"token punctuation\"\n  }, \",\"), \" \", mdx(\"span\", {\n    parentName: \"code\",\n    \"className\": \"token number\"\n  }, \"500\"), mdx(\"span\", {\n    parentName: \"code\",\n    \"className\": \"token punctuation\"\n  }, \")\"), mdx(\"span\", {\n    parentName: \"code\",\n    \"className\": \"token punctuation\"\n  }, \";\"), \"\\n\", mdx(\"span\", {\n    parentName: \"code\",\n    \"className\": \"token punctuation\"\n  }, \"}\"), mdx(\"span\", {\n    parentName: \"code\",\n    \"className\": \"token punctuation\"\n  }, \")\"), mdx(\"span\", {\n    parentName: \"code\",\n    \"className\": \"token punctuation\"\n  }, \";\"), \"\\n\\n\", mdx(\"span\", {\n    parentName: \"code\",\n    \"className\": \"token constant\"\n  }, \"UI\"), mdx(\"span\", {\n    parentName: \"code\",\n    \"className\": \"token punctuation\"\n  }, \".\"), mdx(\"span\", {\n    parentName: \"code\",\n    \"className\": \"token function\"\n  }, \"render\"), mdx(\"span\", {\n    parentName: \"code\",\n    \"className\": \"token punctuation\"\n  }, \"(\"), mdx(\"span\", {\n    parentName: \"code\",\n    \"className\": \"token punctuation\"\n  }, \"(\"), mdx(\"span\", {\n    parentName: \"code\",\n    \"className\": \"token punctuation\"\n  }, \")\"), \" \", mdx(\"span\", {\n    parentName: \"code\",\n    \"className\": \"token operator\"\n  }, \"=>\"), \" \", mdx(\"span\", {\n    parentName: \"code\",\n    \"className\": \"token template-string\"\n  }, mdx(\"span\", {\n    parentName: \"span\",\n    \"className\": \"token template-punctuation string\"\n  }, \"`\"), mdx(\"span\", {\n    parentName: \"span\",\n    \"className\": \"token string\"\n  }, \"<div>hello</div>\"), mdx(\"span\", {\n    parentName: \"span\",\n    \"className\": \"token template-punctuation string\"\n  }, \"`\")), mdx(\"span\", {\n    parentName: \"code\",\n    \"className\": \"token punctuation\"\n  }, \")\"), mdx(\"span\", {\n    parentName: \"code\",\n    \"className\": \"token punctuation\"\n  }, \";\")))), mdx(\"h2\", {\n    \"id\": \"store\",\n    \"style\": {\n      \"position\": \"relative\"\n    }\n  }, mdx(\"a\", {\n    parentName: \"h2\",\n    \"href\": \"#store\",\n    \"aria-label\": \"store permalink\",\n    \"className\": \"anchor before\"\n  }, mdx(\"svg\", {\n    parentName: \"a\",\n    \"aria-hidden\": \"true\",\n    \"focusable\": \"false\",\n    \"height\": \"16\",\n    \"version\": \"1.1\",\n    \"viewBox\": \"0 0 16 16\",\n    \"width\": \"16\"\n  }, mdx(\"path\", {\n    parentName: \"svg\",\n    \"fillRule\": \"evenodd\",\n    \"d\": \"M4 9h1v1H4c-1.5 0-3-1.69-3-3.5S2.55 3 4 3h4c1.45 0 3 1.69 3 3.5 0 1.41-.91 2.72-2 3.25V8.59c.58-.45 1-1.27 1-2.09C10 5.22 8.98 4 8 4H4c-.98 0-2 1.22-2 2.5S3 9 4 9zm9-3h-1v1h1c1 0 2 1.22 2 2.5S13.98 12 13 12H9c-.98 0-2-1.22-2-2.5 0-.83.42-1.64 1-2.09V6.25c-1.09.53-2 1.84-2 3.25C6 11.31 7.55 13 9 13h4c1.45 0 3-1.69 3-3.5S14.5 6 13 6z\"\n  }))), \"Store\"), mdx(\"p\", null, \"Artist's store is a proxy object with a change notifier. Whenever there is a change in the store object, the function passedto \", mdx(\"code\", {\n    parentName: \"p\",\n    \"className\": \"language-text\"\n  }, \"render\"), \" will be called and update the content. The best place to set a initial value or change the store is \", mdx(\"code\", {\n    parentName: \"p\",\n    \"className\": \"language-text\"\n  }, \"onInit\"), \" method.\"), mdx(\"div\", {\n    \"className\": \"gatsby-highlight\",\n    \"data-language\": \"js\"\n  }, mdx(\"pre\", {\n    parentName: \"div\",\n    \"className\": \"language-js\"\n  }, mdx(\"code\", {\n    parentName: \"pre\",\n    \"className\": \"language-js\"\n  }, mdx(\"span\", {\n    parentName: \"code\",\n    \"className\": \"token keyword\"\n  }, \"import\"), \" Artist \", mdx(\"span\", {\n    parentName: \"code\",\n    \"className\": \"token keyword\"\n  }, \"from\"), \" \", mdx(\"span\", {\n    parentName: \"code\",\n    \"className\": \"token string\"\n  }, \"\\\"@lesy/artist\\\"\"), mdx(\"span\", {\n    parentName: \"code\",\n    \"className\": \"token punctuation\"\n  }, \";\"), \"\\n\", mdx(\"span\", {\n    parentName: \"code\",\n    \"className\": \"token keyword\"\n  }, \"const\"), \" \", mdx(\"span\", {\n    parentName: \"code\",\n    \"className\": \"token constant\"\n  }, \"UI\"), \" \", mdx(\"span\", {\n    parentName: \"code\",\n    \"className\": \"token operator\"\n  }, \"=\"), \" \", mdx(\"span\", {\n    parentName: \"code\",\n    \"className\": \"token keyword\"\n  }, \"new\"), \" \", mdx(\"span\", {\n    parentName: \"code\",\n    \"className\": \"token class-name\"\n  }, \"Artist\"), mdx(\"span\", {\n    parentName: \"code\",\n    \"className\": \"token punctuation\"\n  }, \"(\"), mdx(\"span\", {\n    parentName: \"code\",\n    \"className\": \"token punctuation\"\n  }, \")\"), mdx(\"span\", {\n    parentName: \"code\",\n    \"className\": \"token punctuation\"\n  }, \";\"), \"\\n\\n\", mdx(\"span\", {\n    parentName: \"code\",\n    \"className\": \"token constant\"\n  }, \"UI\"), mdx(\"span\", {\n    parentName: \"code\",\n    \"className\": \"token punctuation\"\n  }, \".\"), mdx(\"span\", {\n    parentName: \"code\",\n    \"className\": \"token function\"\n  }, \"onInit\"), mdx(\"span\", {\n    parentName: \"code\",\n    \"className\": \"token punctuation\"\n  }, \"(\"), mdx(\"span\", {\n    parentName: \"code\",\n    \"className\": \"token parameter\"\n  }, \"store\"), \" \", mdx(\"span\", {\n    parentName: \"code\",\n    \"className\": \"token operator\"\n  }, \"=>\"), \" \", mdx(\"span\", {\n    parentName: \"code\",\n    \"className\": \"token punctuation\"\n  }, \"{\"), \"\\n  \", mdx(\"span\", {\n    parentName: \"code\",\n    \"className\": \"token keyword\"\n  }, \"if\"), \" \", mdx(\"span\", {\n    parentName: \"code\",\n    \"className\": \"token punctuation\"\n  }, \"(\"), mdx(\"span\", {\n    parentName: \"code\",\n    \"className\": \"token operator\"\n  }, \"!\"), \"store\", mdx(\"span\", {\n    parentName: \"code\",\n    \"className\": \"token punctuation\"\n  }, \".\"), \"name\", mdx(\"span\", {\n    parentName: \"code\",\n    \"className\": \"token punctuation\"\n  }, \")\"), \" store\", mdx(\"span\", {\n    parentName: \"code\",\n    \"className\": \"token punctuation\"\n  }, \".\"), \"name \", mdx(\"span\", {\n    parentName: \"code\",\n    \"className\": \"token operator\"\n  }, \"=\"), \" \", mdx(\"span\", {\n    parentName: \"code\",\n    \"className\": \"token string\"\n  }, \"\\\"John\\\"\"), mdx(\"span\", {\n    parentName: \"code\",\n    \"className\": \"token punctuation\"\n  }, \";\"), \"\\n  \", mdx(\"span\", {\n    parentName: \"code\",\n    \"className\": \"token function\"\n  }, \"setTimeout\"), mdx(\"span\", {\n    parentName: \"code\",\n    \"className\": \"token punctuation\"\n  }, \"(\"), mdx(\"span\", {\n    parentName: \"code\",\n    \"className\": \"token punctuation\"\n  }, \"(\"), mdx(\"span\", {\n    parentName: \"code\",\n    \"className\": \"token punctuation\"\n  }, \")\"), \" \", mdx(\"span\", {\n    parentName: \"code\",\n    \"className\": \"token operator\"\n  }, \"=>\"), \" \", mdx(\"span\", {\n    parentName: \"code\",\n    \"className\": \"token punctuation\"\n  }, \"(\"), \"store\", mdx(\"span\", {\n    parentName: \"code\",\n    \"className\": \"token punctuation\"\n  }, \".\"), \"name \", mdx(\"span\", {\n    parentName: \"code\",\n    \"className\": \"token operator\"\n  }, \"=\"), \" \", mdx(\"span\", {\n    parentName: \"code\",\n    \"className\": \"token string\"\n  }, \"\\\"Jane\\\"\"), mdx(\"span\", {\n    parentName: \"code\",\n    \"className\": \"token punctuation\"\n  }, \")\"), mdx(\"span\", {\n    parentName: \"code\",\n    \"className\": \"token punctuation\"\n  }, \",\"), \" \", mdx(\"span\", {\n    parentName: \"code\",\n    \"className\": \"token number\"\n  }, \"1000\"), mdx(\"span\", {\n    parentName: \"code\",\n    \"className\": \"token punctuation\"\n  }, \")\"), mdx(\"span\", {\n    parentName: \"code\",\n    \"className\": \"token punctuation\"\n  }, \";\"), \"\\n\", mdx(\"span\", {\n    parentName: \"code\",\n    \"className\": \"token punctuation\"\n  }, \"}\"), mdx(\"span\", {\n    parentName: \"code\",\n    \"className\": \"token punctuation\"\n  }, \")\"), mdx(\"span\", {\n    parentName: \"code\",\n    \"className\": \"token punctuation\"\n  }, \";\"), \"\\n\\n\", mdx(\"span\", {\n    parentName: \"code\",\n    \"className\": \"token constant\"\n  }, \"UI\"), mdx(\"span\", {\n    parentName: \"code\",\n    \"className\": \"token punctuation\"\n  }, \".\"), mdx(\"span\", {\n    parentName: \"code\",\n    \"className\": \"token function\"\n  }, \"render\"), mdx(\"span\", {\n    parentName: \"code\",\n    \"className\": \"token punctuation\"\n  }, \"(\"), mdx(\"span\", {\n    parentName: \"code\",\n    \"className\": \"token parameter\"\n  }, \"store\"), \" \", mdx(\"span\", {\n    parentName: \"code\",\n    \"className\": \"token operator\"\n  }, \"=>\"), \" \", mdx(\"span\", {\n    parentName: \"code\",\n    \"className\": \"token punctuation\"\n  }, \"{\"), \"\\n  \", mdx(\"span\", {\n    parentName: \"code\",\n    \"className\": \"token keyword\"\n  }, \"return\"), \" \", mdx(\"span\", {\n    parentName: \"code\",\n    \"className\": \"token template-string\"\n  }, mdx(\"span\", {\n    parentName: \"span\",\n    \"className\": \"token template-punctuation string\"\n  }, \"`\"), mdx(\"span\", {\n    parentName: \"span\",\n    \"className\": \"token string\"\n  }, \"<div>hello <text color=\\\"red\\\">\"), mdx(\"span\", {\n    parentName: \"span\",\n    \"className\": \"token interpolation\"\n  }, mdx(\"span\", {\n    parentName: \"span\",\n    \"className\": \"token interpolation-punctuation punctuation\"\n  }, \"${\"), \"store\", mdx(\"span\", {\n    parentName: \"span\",\n    \"className\": \"token punctuation\"\n  }, \".\"), \"name\", mdx(\"span\", {\n    parentName: \"span\",\n    \"className\": \"token interpolation-punctuation punctuation\"\n  }, \"}\")), mdx(\"span\", {\n    parentName: \"span\",\n    \"className\": \"token string\"\n  }, \"</text>!</div>\"), mdx(\"span\", {\n    parentName: \"span\",\n    \"className\": \"token template-punctuation string\"\n  }, \"`\")), mdx(\"span\", {\n    parentName: \"code\",\n    \"className\": \"token punctuation\"\n  }, \";\"), \"\\n\", mdx(\"span\", {\n    parentName: \"code\",\n    \"className\": \"token punctuation\"\n  }, \"}\"), mdx(\"span\", {\n    parentName: \"code\",\n    \"className\": \"token punctuation\"\n  }, \")\"), mdx(\"span\", {\n    parentName: \"code\",\n    \"className\": \"token punctuation\"\n  }, \";\")))), mdx(\"h2\", {\n    \"id\": \"timer\",\n    \"style\": {\n      \"position\": \"relative\"\n    }\n  }, mdx(\"a\", {\n    parentName: \"h2\",\n    \"href\": \"#timer\",\n    \"aria-label\": \"timer permalink\",\n    \"className\": \"anchor before\"\n  }, mdx(\"svg\", {\n    parentName: \"a\",\n    \"aria-hidden\": \"true\",\n    \"focusable\": \"false\",\n    \"height\": \"16\",\n    \"version\": \"1.1\",\n    \"viewBox\": \"0 0 16 16\",\n    \"width\": \"16\"\n  }, mdx(\"path\", {\n    parentName: \"svg\",\n    \"fillRule\": \"evenodd\",\n    \"d\": \"M4 9h1v1H4c-1.5 0-3-1.69-3-3.5S2.55 3 4 3h4c1.45 0 3 1.69 3 3.5 0 1.41-.91 2.72-2 3.25V8.59c.58-.45 1-1.27 1-2.09C10 5.22 8.98 4 8 4H4c-.98 0-2 1.22-2 2.5S3 9 4 9zm9-3h-1v1h1c1 0 2 1.22 2 2.5S13.98 12 13 12H9c-.98 0-2-1.22-2-2.5 0-.83.42-1.64 1-2.09V6.25c-1.09.53-2 1.84-2 3.25C6 11.31 7.55 13 9 13h4c1.45 0 3-1.69 3-3.5S14.5 6 13 6z\"\n  }))), \"Timer\"), mdx(\"p\", null, \"If you wanted to run a \", mdx(\"code\", {\n    parentName: \"p\",\n    \"className\": \"language-text\"\n  }, \"setInterval\"), \" timer, you can make use of \", mdx(\"code\", {\n    parentName: \"p\",\n    \"className\": \"language-text\"\n  }, \"timer\"), \" function that is passed as a second parameter in the \", mdx(\"code\", {\n    parentName: \"p\",\n    \"className\": \"language-text\"\n  }, \"onInit\"), \". \", mdx(\"em\", {\n    parentName: \"p\"\n  }, \"timer\"), \" is same as \", mdx(\"em\", {\n    parentName: \"p\"\n  }, \"setInterval\"), \", only the difference is it will be gacefully disposed whenever manually or progamatically by having the full controll.\"), mdx(\"div\", {\n    \"className\": \"gatsby-highlight\",\n    \"data-language\": \"js\"\n  }, mdx(\"pre\", {\n    parentName: \"div\",\n    \"className\": \"language-js\"\n  }, mdx(\"code\", {\n    parentName: \"pre\",\n    \"className\": \"language-js\"\n  }, mdx(\"span\", {\n    parentName: \"code\",\n    \"className\": \"token keyword\"\n  }, \"import\"), \" Artist \", mdx(\"span\", {\n    parentName: \"code\",\n    \"className\": \"token keyword\"\n  }, \"from\"), \" \", mdx(\"span\", {\n    parentName: \"code\",\n    \"className\": \"token string\"\n  }, \"\\\"@lesy/artist\\\"\"), mdx(\"span\", {\n    parentName: \"code\",\n    \"className\": \"token punctuation\"\n  }, \";\"), \"\\n\", mdx(\"span\", {\n    parentName: \"code\",\n    \"className\": \"token keyword\"\n  }, \"const\"), \" \", mdx(\"span\", {\n    parentName: \"code\",\n    \"className\": \"token constant\"\n  }, \"UI\"), \" \", mdx(\"span\", {\n    parentName: \"code\",\n    \"className\": \"token operator\"\n  }, \"=\"), \" \", mdx(\"span\", {\n    parentName: \"code\",\n    \"className\": \"token keyword\"\n  }, \"new\"), \" \", mdx(\"span\", {\n    parentName: \"code\",\n    \"className\": \"token class-name\"\n  }, \"Artist\"), mdx(\"span\", {\n    parentName: \"code\",\n    \"className\": \"token punctuation\"\n  }, \"(\"), mdx(\"span\", {\n    parentName: \"code\",\n    \"className\": \"token punctuation\"\n  }, \")\"), mdx(\"span\", {\n    parentName: \"code\",\n    \"className\": \"token punctuation\"\n  }, \";\"), \"\\n\\n\", mdx(\"span\", {\n    parentName: \"code\",\n    \"className\": \"token constant\"\n  }, \"UI\"), mdx(\"span\", {\n    parentName: \"code\",\n    \"className\": \"token punctuation\"\n  }, \".\"), mdx(\"span\", {\n    parentName: \"code\",\n    \"className\": \"token function\"\n  }, \"onInit\"), mdx(\"span\", {\n    parentName: \"code\",\n    \"className\": \"token punctuation\"\n  }, \"(\"), mdx(\"span\", {\n    parentName: \"code\",\n    \"className\": \"token punctuation\"\n  }, \"(\"), mdx(\"span\", {\n    parentName: \"code\",\n    \"className\": \"token parameter\"\n  }, \"store\", mdx(\"span\", {\n    parentName: \"span\",\n    \"className\": \"token punctuation\"\n  }, \",\"), \" timer\"), mdx(\"span\", {\n    parentName: \"code\",\n    \"className\": \"token punctuation\"\n  }, \")\"), \" \", mdx(\"span\", {\n    parentName: \"code\",\n    \"className\": \"token operator\"\n  }, \"=>\"), \" \", mdx(\"span\", {\n    parentName: \"code\",\n    \"className\": \"token punctuation\"\n  }, \"{\"), \"\\n  \", mdx(\"span\", {\n    parentName: \"code\",\n    \"className\": \"token keyword\"\n  }, \"if\"), \" \", mdx(\"span\", {\n    parentName: \"code\",\n    \"className\": \"token punctuation\"\n  }, \"(\"), mdx(\"span\", {\n    parentName: \"code\",\n    \"className\": \"token operator\"\n  }, \"!\"), \"store\", mdx(\"span\", {\n    parentName: \"code\",\n    \"className\": \"token punctuation\"\n  }, \".\"), \"count\", mdx(\"span\", {\n    parentName: \"code\",\n    \"className\": \"token punctuation\"\n  }, \")\"), \" store\", mdx(\"span\", {\n    parentName: \"code\",\n    \"className\": \"token punctuation\"\n  }, \".\"), \"count \", mdx(\"span\", {\n    parentName: \"code\",\n    \"className\": \"token operator\"\n  }, \"=\"), \" \", mdx(\"span\", {\n    parentName: \"code\",\n    \"className\": \"token number\"\n  }, \"0\"), mdx(\"span\", {\n    parentName: \"code\",\n    \"className\": \"token punctuation\"\n  }, \";\"), \"\\n  \", mdx(\"span\", {\n    parentName: \"code\",\n    \"className\": \"token function\"\n  }, \"timer\"), mdx(\"span\", {\n    parentName: \"code\",\n    \"className\": \"token punctuation\"\n  }, \"(\"), mdx(\"span\", {\n    parentName: \"code\",\n    \"className\": \"token punctuation\"\n  }, \"(\"), mdx(\"span\", {\n    parentName: \"code\",\n    \"className\": \"token punctuation\"\n  }, \")\"), \" \", mdx(\"span\", {\n    parentName: \"code\",\n    \"className\": \"token operator\"\n  }, \"=>\"), \" \", mdx(\"span\", {\n    parentName: \"code\",\n    \"className\": \"token punctuation\"\n  }, \"(\"), \"store\", mdx(\"span\", {\n    parentName: \"code\",\n    \"className\": \"token punctuation\"\n  }, \".\"), \"count \", mdx(\"span\", {\n    parentName: \"code\",\n    \"className\": \"token operator\"\n  }, \"+=\"), \" \", mdx(\"span\", {\n    parentName: \"code\",\n    \"className\": \"token number\"\n  }, \"1\"), mdx(\"span\", {\n    parentName: \"code\",\n    \"className\": \"token punctuation\"\n  }, \")\"), mdx(\"span\", {\n    parentName: \"code\",\n    \"className\": \"token punctuation\"\n  }, \",\"), \" \", mdx(\"span\", {\n    parentName: \"code\",\n    \"className\": \"token number\"\n  }, \"1000\"), mdx(\"span\", {\n    parentName: \"code\",\n    \"className\": \"token punctuation\"\n  }, \",\"), \" \", mdx(\"span\", {\n    parentName: \"code\",\n    \"className\": \"token string\"\n  }, \"\\\"my-key\\\"\"), mdx(\"span\", {\n    parentName: \"code\",\n    \"className\": \"token punctuation\"\n  }, \")\"), mdx(\"span\", {\n    parentName: \"code\",\n    \"className\": \"token punctuation\"\n  }, \";\"), \"\\n\", mdx(\"span\", {\n    parentName: \"code\",\n    \"className\": \"token punctuation\"\n  }, \"}\"), mdx(\"span\", {\n    parentName: \"code\",\n    \"className\": \"token punctuation\"\n  }, \")\"), mdx(\"span\", {\n    parentName: \"code\",\n    \"className\": \"token punctuation\"\n  }, \";\"), \"\\n\\n\", mdx(\"span\", {\n    parentName: \"code\",\n    \"className\": \"token constant\"\n  }, \"UI\"), mdx(\"span\", {\n    parentName: \"code\",\n    \"className\": \"token punctuation\"\n  }, \".\"), mdx(\"span\", {\n    parentName: \"code\",\n    \"className\": \"token function\"\n  }, \"render\"), mdx(\"span\", {\n    parentName: \"code\",\n    \"className\": \"token punctuation\"\n  }, \"(\"), mdx(\"span\", {\n    parentName: \"code\",\n    \"className\": \"token parameter\"\n  }, \"store\"), \" \", mdx(\"span\", {\n    parentName: \"code\",\n    \"className\": \"token operator\"\n  }, \"=>\"), \" \", mdx(\"span\", {\n    parentName: \"code\",\n    \"className\": \"token punctuation\"\n  }, \"{\"), \"\\n  \", mdx(\"span\", {\n    parentName: \"code\",\n    \"className\": \"token keyword\"\n  }, \"return\"), \" \", mdx(\"span\", {\n    parentName: \"code\",\n    \"className\": \"token template-string\"\n  }, mdx(\"span\", {\n    parentName: \"span\",\n    \"className\": \"token template-punctuation string\"\n  }, \"`\"), mdx(\"span\", {\n    parentName: \"span\",\n    \"className\": \"token string\"\n  }, \"counting: <text color=\\\"red\\\">\"), mdx(\"span\", {\n    parentName: \"span\",\n    \"className\": \"token interpolation\"\n  }, mdx(\"span\", {\n    parentName: \"span\",\n    \"className\": \"token interpolation-punctuation punctuation\"\n  }, \"${\"), \"store\", mdx(\"span\", {\n    parentName: \"span\",\n    \"className\": \"token punctuation\"\n  }, \".\"), \"count\", mdx(\"span\", {\n    parentName: \"span\",\n    \"className\": \"token interpolation-punctuation punctuation\"\n  }, \"}\")), mdx(\"span\", {\n    parentName: \"span\",\n    \"className\": \"token string\"\n  }, \"</text>\"), mdx(\"span\", {\n    parentName: \"span\",\n    \"className\": \"token template-punctuation string\"\n  }, \"`\")), mdx(\"span\", {\n    parentName: \"code\",\n    \"className\": \"token punctuation\"\n  }, \";\"), \"\\n\", mdx(\"span\", {\n    parentName: \"code\",\n    \"className\": \"token punctuation\"\n  }, \"}\"), mdx(\"span\", {\n    parentName: \"code\",\n    \"className\": \"token punctuation\"\n  }, \")\"), mdx(\"span\", {\n    parentName: \"code\",\n    \"className\": \"token punctuation\"\n  }, \";\")))), mdx(\"p\", null, mdx(\"code\", {\n    parentName: \"p\",\n    \"className\": \"language-text\"\n  }, \"timer\"), \" accepts three parameters.\"), mdx(\"ul\", null, mdx(\"li\", {\n    parentName: \"ul\"\n  }, mdx(\"strong\", {\n    parentName: \"li\"\n  }, \"callback\"), \" - a function that will be called at specified intervals.\"), mdx(\"li\", {\n    parentName: \"ul\"\n  }, mdx(\"strong\", {\n    parentName: \"li\"\n  }, \"interval\"), \" - in milliseconds\"), mdx(\"li\", {\n    parentName: \"ul\"\n  }, mdx(\"strong\", {\n    parentName: \"li\"\n  }, \"unique ID\"), \" - Unique string or number to identify the timer.\")), mdx(\"h2\", {\n    \"id\": \"built-in-elements\",\n    \"style\": {\n      \"position\": \"relative\"\n    }\n  }, mdx(\"a\", {\n    parentName: \"h2\",\n    \"href\": \"#built-in-elements\",\n    \"aria-label\": \"built in elements permalink\",\n    \"className\": \"anchor before\"\n  }, mdx(\"svg\", {\n    parentName: \"a\",\n    \"aria-hidden\": \"true\",\n    \"focusable\": \"false\",\n    \"height\": \"16\",\n    \"version\": \"1.1\",\n    \"viewBox\": \"0 0 16 16\",\n    \"width\": \"16\"\n  }, mdx(\"path\", {\n    parentName: \"svg\",\n    \"fillRule\": \"evenodd\",\n    \"d\": \"M4 9h1v1H4c-1.5 0-3-1.69-3-3.5S2.55 3 4 3h4c1.45 0 3 1.69 3 3.5 0 1.41-.91 2.72-2 3.25V8.59c.58-.45 1-1.27 1-2.09C10 5.22 8.98 4 8 4H4c-.98 0-2 1.22-2 2.5S3 9 4 9zm9-3h-1v1h1c1 0 2 1.22 2 2.5S13.98 12 13 12H9c-.98 0-2-1.22-2-2.5 0-.83.42-1.64 1-2.09V6.25c-1.09.53-2 1.84-2 3.25C6 11.31 7.55 13 9 13h4c1.45 0 3-1.69 3-3.5S14.5 6 13 6z\"\n  }))), \"Built-in elements\"), mdx(\"p\", null, \"Artist comes with bunch of widely used terminal elements.\"), mdx(\"h3\", {\n    \"id\": \"text\",\n    \"style\": {\n      \"position\": \"relative\"\n    }\n  }, mdx(\"a\", {\n    parentName: \"h3\",\n    \"href\": \"#text\",\n    \"aria-label\": \"text permalink\",\n    \"className\": \"anchor before\"\n  }, mdx(\"svg\", {\n    parentName: \"a\",\n    \"aria-hidden\": \"true\",\n    \"focusable\": \"false\",\n    \"height\": \"16\",\n    \"version\": \"1.1\",\n    \"viewBox\": \"0 0 16 16\",\n    \"width\": \"16\"\n  }, mdx(\"path\", {\n    parentName: \"svg\",\n    \"fillRule\": \"evenodd\",\n    \"d\": \"M4 9h1v1H4c-1.5 0-3-1.69-3-3.5S2.55 3 4 3h4c1.45 0 3 1.69 3 3.5 0 1.41-.91 2.72-2 3.25V8.59c.58-.45 1-1.27 1-2.09C10 5.22 8.98 4 8 4H4c-.98 0-2 1.22-2 2.5S3 9 4 9zm9-3h-1v1h1c1 0 2 1.22 2 2.5S13.98 12 13 12H9c-.98 0-2-1.22-2-2.5 0-.83.42-1.64 1-2.09V6.25c-1.09.53-2 1.84-2 3.25C6 11.31 7.55 13 9 13h4c1.45 0 3-1.69 3-3.5S14.5 6 13 6z\"\n  }))), \"Text\"), mdx(\"div\", {\n    \"className\": \"gatsby-highlight\",\n    \"data-language\": \"js\"\n  }, mdx(\"pre\", {\n    parentName: \"div\",\n    \"className\": \"language-js\"\n  }, mdx(\"code\", {\n    parentName: \"pre\",\n    \"className\": \"language-js\"\n  }, mdx(\"span\", {\n    parentName: \"code\",\n    \"className\": \"token keyword\"\n  }, \"import\"), \" Artist \", mdx(\"span\", {\n    parentName: \"code\",\n    \"className\": \"token keyword\"\n  }, \"from\"), \" \", mdx(\"span\", {\n    parentName: \"code\",\n    \"className\": \"token string\"\n  }, \"\\\"@lesy/artist\\\"\"), mdx(\"span\", {\n    parentName: \"code\",\n    \"className\": \"token punctuation\"\n  }, \";\"), \"\\n\", mdx(\"span\", {\n    parentName: \"code\",\n    \"className\": \"token keyword\"\n  }, \"const\"), \" \", mdx(\"span\", {\n    parentName: \"code\",\n    \"className\": \"token constant\"\n  }, \"UI\"), \" \", mdx(\"span\", {\n    parentName: \"code\",\n    \"className\": \"token operator\"\n  }, \"=\"), \" \", mdx(\"span\", {\n    parentName: \"code\",\n    \"className\": \"token keyword\"\n  }, \"new\"), \" \", mdx(\"span\", {\n    parentName: \"code\",\n    \"className\": \"token class-name\"\n  }, \"Artist\"), mdx(\"span\", {\n    parentName: \"code\",\n    \"className\": \"token punctuation\"\n  }, \"(\"), mdx(\"span\", {\n    parentName: \"code\",\n    \"className\": \"token punctuation\"\n  }, \")\"), mdx(\"span\", {\n    parentName: \"code\",\n    \"className\": \"token punctuation\"\n  }, \";\"), \"\\n\\n\", mdx(\"span\", {\n    parentName: \"code\",\n    \"className\": \"token constant\"\n  }, \"UI\"), mdx(\"span\", {\n    parentName: \"code\",\n    \"className\": \"token punctuation\"\n  }, \".\"), mdx(\"span\", {\n    parentName: \"code\",\n    \"className\": \"token function\"\n  }, \"render\"), mdx(\"span\", {\n    parentName: \"code\",\n    \"className\": \"token punctuation\"\n  }, \"(\"), mdx(\"span\", {\n    parentName: \"code\",\n    \"className\": \"token punctuation\"\n  }, \"(\"), mdx(\"span\", {\n    parentName: \"code\",\n    \"className\": \"token punctuation\"\n  }, \")\"), \" \", mdx(\"span\", {\n    parentName: \"code\",\n    \"className\": \"token operator\"\n  }, \"=>\"), \" \", mdx(\"span\", {\n    parentName: \"code\",\n    \"className\": \"token punctuation\"\n  }, \"{\"), \"\\n  \", mdx(\"span\", {\n    parentName: \"code\",\n    \"className\": \"token keyword\"\n  }, \"return\"), \" \", mdx(\"span\", {\n    parentName: \"code\",\n    \"className\": \"token template-string\"\n  }, mdx(\"span\", {\n    parentName: \"span\",\n    \"className\": \"token template-punctuation string\"\n  }, \"`\"), mdx(\"span\", {\n    parentName: \"span\",\n    \"className\": \"token string\"\n  }, \"<text color=\\\"red\\\" bg=\\\"gray\\\" bold>some text</text>\"), mdx(\"span\", {\n    parentName: \"span\",\n    \"className\": \"token template-punctuation string\"\n  }, \"`\")), mdx(\"span\", {\n    parentName: \"code\",\n    \"className\": \"token punctuation\"\n  }, \";\"), \"\\n\", mdx(\"span\", {\n    parentName: \"code\",\n    \"className\": \"token punctuation\"\n  }, \"}\"), mdx(\"span\", {\n    parentName: \"code\",\n    \"className\": \"token punctuation\"\n  }, \")\"), mdx(\"span\", {\n    parentName: \"code\",\n    \"className\": \"token punctuation\"\n  }, \";\")))), mdx(\"p\", null, mdx(\"code\", {\n    parentName: \"p\",\n    \"className\": \"language-text\"\n  }, \"<text/>\"), \" and simple string both are same, unless you wanted to style the string.\"), mdx(\"h3\", {\n    \"id\": \"props\",\n    \"style\": {\n      \"position\": \"relative\"\n    }\n  }, mdx(\"a\", {\n    parentName: \"h3\",\n    \"href\": \"#props\",\n    \"aria-label\": \"props permalink\",\n    \"className\": \"anchor before\"\n  }, mdx(\"svg\", {\n    parentName: \"a\",\n    \"aria-hidden\": \"true\",\n    \"focusable\": \"false\",\n    \"height\": \"16\",\n    \"version\": \"1.1\",\n    \"viewBox\": \"0 0 16 16\",\n    \"width\": \"16\"\n  }, mdx(\"path\", {\n    parentName: \"svg\",\n    \"fillRule\": \"evenodd\",\n    \"d\": \"M4 9h1v1H4c-1.5 0-3-1.69-3-3.5S2.55 3 4 3h4c1.45 0 3 1.69 3 3.5 0 1.41-.91 2.72-2 3.25V8.59c.58-.45 1-1.27 1-2.09C10 5.22 8.98 4 8 4H4c-.98 0-2 1.22-2 2.5S3 9 4 9zm9-3h-1v1h1c1 0 2 1.22 2 2.5S13.98 12 13 12H9c-.98 0-2-1.22-2-2.5 0-.83.42-1.64 1-2.09V6.25c-1.09.53-2 1.84-2 3.25C6 11.31 7.55 13 9 13h4c1.45 0 3-1.69 3-3.5S14.5 6 13 6z\"\n  }))), \"Props\"), mdx(\"ul\", null, mdx(\"li\", {\n    parentName: \"ul\"\n  }, mdx(\"code\", {\n    parentName: \"li\",\n    \"className\": \"language-text\"\n  }, \"color\")), mdx(\"li\", {\n    parentName: \"ul\"\n  }, mdx(\"code\", {\n    parentName: \"li\",\n    \"className\": \"language-text\"\n  }, \"bg\")), mdx(\"li\", {\n    parentName: \"ul\"\n  }, mdx(\"code\", {\n    parentName: \"li\",\n    \"className\": \"language-text\"\n  }, \"bold\")), mdx(\"li\", {\n    parentName: \"ul\"\n  }, mdx(\"code\", {\n    parentName: \"li\",\n    \"className\": \"language-text\"\n  }, \"underline\")), mdx(\"li\", {\n    parentName: \"ul\"\n  }, mdx(\"code\", {\n    parentName: \"li\",\n    \"className\": \"language-text\"\n  }, \"italic\")), mdx(\"li\", {\n    parentName: \"ul\"\n  }, mdx(\"code\", {\n    parentName: \"li\",\n    \"className\": \"language-text\"\n  }, \"strikethrough\"))), mdx(\"p\", null, \"All these stylings are handled by awesome \", mdx(\"code\", {\n    parentName: \"p\",\n    \"className\": \"language-text\"\n  }, \"chalk\"), \" library bundled inside the Artist.\"), mdx(\"h3\", {\n    \"id\": \"row-and-columns\",\n    \"style\": {\n      \"position\": \"relative\"\n    }\n  }, mdx(\"a\", {\n    parentName: \"h3\",\n    \"href\": \"#row-and-columns\",\n    \"aria-label\": \"row and columns permalink\",\n    \"className\": \"anchor before\"\n  }, mdx(\"svg\", {\n    parentName: \"a\",\n    \"aria-hidden\": \"true\",\n    \"focusable\": \"false\",\n    \"height\": \"16\",\n    \"version\": \"1.1\",\n    \"viewBox\": \"0 0 16 16\",\n    \"width\": \"16\"\n  }, mdx(\"path\", {\n    parentName: \"svg\",\n    \"fillRule\": \"evenodd\",\n    \"d\": \"M4 9h1v1H4c-1.5 0-3-1.69-3-3.5S2.55 3 4 3h4c1.45 0 3 1.69 3 3.5 0 1.41-.91 2.72-2 3.25V8.59c.58-.45 1-1.27 1-2.09C10 5.22 8.98 4 8 4H4c-.98 0-2 1.22-2 2.5S3 9 4 9zm9-3h-1v1h1c1 0 2 1.22 2 2.5S13.98 12 13 12H9c-.98 0-2-1.22-2-2.5 0-.83.42-1.64 1-2.09V6.25c-1.09.53-2 1.84-2 3.25C6 11.31 7.55 13 9 13h4c1.45 0 3-1.69 3-3.5S14.5 6 13 6z\"\n  }))), \"Row and columns\"), mdx(\"p\", null, \"For a column layout you can use \", mdx(\"code\", {\n    parentName: \"p\",\n    \"className\": \"language-text\"\n  }, \"<row/>\"), \" and \", mdx(\"code\", {\n    parentName: \"p\",\n    \"className\": \"language-text\"\n  }, \"<column/>\"), \" elements. Columns are automatically set the width based on number of items inside the row.\"), mdx(\"div\", {\n    \"className\": \"gatsby-highlight\",\n    \"data-language\": \"js\"\n  }, mdx(\"pre\", {\n    parentName: \"div\",\n    \"className\": \"language-js\"\n  }, mdx(\"code\", {\n    parentName: \"pre\",\n    \"className\": \"language-js\"\n  }, mdx(\"span\", {\n    parentName: \"code\",\n    \"className\": \"token keyword\"\n  }, \"import\"), \" Artist \", mdx(\"span\", {\n    parentName: \"code\",\n    \"className\": \"token keyword\"\n  }, \"from\"), \" \", mdx(\"span\", {\n    parentName: \"code\",\n    \"className\": \"token string\"\n  }, \"\\\"@lesy/artist\\\"\"), mdx(\"span\", {\n    parentName: \"code\",\n    \"className\": \"token punctuation\"\n  }, \";\"), \"\\n\", mdx(\"span\", {\n    parentName: \"code\",\n    \"className\": \"token keyword\"\n  }, \"const\"), \" \", mdx(\"span\", {\n    parentName: \"code\",\n    \"className\": \"token constant\"\n  }, \"UI\"), \" \", mdx(\"span\", {\n    parentName: \"code\",\n    \"className\": \"token operator\"\n  }, \"=\"), \" \", mdx(\"span\", {\n    parentName: \"code\",\n    \"className\": \"token keyword\"\n  }, \"new\"), \" \", mdx(\"span\", {\n    parentName: \"code\",\n    \"className\": \"token class-name\"\n  }, \"Artist\"), mdx(\"span\", {\n    parentName: \"code\",\n    \"className\": \"token punctuation\"\n  }, \"(\"), mdx(\"span\", {\n    parentName: \"code\",\n    \"className\": \"token punctuation\"\n  }, \")\"), mdx(\"span\", {\n    parentName: \"code\",\n    \"className\": \"token punctuation\"\n  }, \";\"), \"\\n\\n\", mdx(\"span\", {\n    parentName: \"code\",\n    \"className\": \"token constant\"\n  }, \"UI\"), mdx(\"span\", {\n    parentName: \"code\",\n    \"className\": \"token punctuation\"\n  }, \".\"), mdx(\"span\", {\n    parentName: \"code\",\n    \"className\": \"token function\"\n  }, \"render\"), mdx(\"span\", {\n    parentName: \"code\",\n    \"className\": \"token punctuation\"\n  }, \"(\"), mdx(\"span\", {\n    parentName: \"code\",\n    \"className\": \"token punctuation\"\n  }, \"(\"), mdx(\"span\", {\n    parentName: \"code\",\n    \"className\": \"token punctuation\"\n  }, \")\"), \" \", mdx(\"span\", {\n    parentName: \"code\",\n    \"className\": \"token operator\"\n  }, \"=>\"), \" \", mdx(\"span\", {\n    parentName: \"code\",\n    \"className\": \"token punctuation\"\n  }, \"{\"), \"\\n  \", mdx(\"span\", {\n    parentName: \"code\",\n    \"className\": \"token keyword\"\n  }, \"return\"), \" \", mdx(\"span\", {\n    parentName: \"code\",\n    \"className\": \"token template-string\"\n  }, mdx(\"span\", {\n    parentName: \"span\",\n    \"className\": \"token template-punctuation string\"\n  }, \"`\"), mdx(\"span\", {\n    parentName: \"span\",\n    \"className\": \"token string\"\n  }, \"<row border>\\n     <column>one</column>\\n     <column>two</column>\\n     <column>three</column>\\n</row>\"), mdx(\"span\", {\n    parentName: \"span\",\n    \"className\": \"token template-punctuation string\"\n  }, \"`\")), mdx(\"span\", {\n    parentName: \"code\",\n    \"className\": \"token punctuation\"\n  }, \";\"), \"\\n\", mdx(\"span\", {\n    parentName: \"code\",\n    \"className\": \"token punctuation\"\n  }, \"}\"), mdx(\"span\", {\n    parentName: \"code\",\n    \"className\": \"token punctuation\"\n  }, \")\"), mdx(\"span\", {\n    parentName: \"code\",\n    \"className\": \"token punctuation\"\n  }, \";\")))), mdx(\"blockquote\", null, mdx(\"p\", {\n    parentName: \"blockquote\"\n  }, mdx(\"code\", {\n    parentName: \"p\",\n    \"className\": \"language-text\"\n  }, \"<column/>\"), \" element must be placed inside the \", mdx(\"code\", {\n    parentName: \"p\",\n    \"className\": \"language-text\"\n  }, \"<row/>\"), \" else it will be considered just as a text. Also within row, you should only place column elements as a direct children. But can have any elements inside columns.\")), mdx(\"h3\", {\n    \"id\": \"box\",\n    \"style\": {\n      \"position\": \"relative\"\n    }\n  }, mdx(\"a\", {\n    parentName: \"h3\",\n    \"href\": \"#box\",\n    \"aria-label\": \"box permalink\",\n    \"className\": \"anchor before\"\n  }, mdx(\"svg\", {\n    parentName: \"a\",\n    \"aria-hidden\": \"true\",\n    \"focusable\": \"false\",\n    \"height\": \"16\",\n    \"version\": \"1.1\",\n    \"viewBox\": \"0 0 16 16\",\n    \"width\": \"16\"\n  }, mdx(\"path\", {\n    parentName: \"svg\",\n    \"fillRule\": \"evenodd\",\n    \"d\": \"M4 9h1v1H4c-1.5 0-3-1.69-3-3.5S2.55 3 4 3h4c1.45 0 3 1.69 3 3.5 0 1.41-.91 2.72-2 3.25V8.59c.58-.45 1-1.27 1-2.09C10 5.22 8.98 4 8 4H4c-.98 0-2 1.22-2 2.5S3 9 4 9zm9-3h-1v1h1c1 0 2 1.22 2 2.5S13.98 12 13 12H9c-.98 0-2-1.22-2-2.5 0-.83.42-1.64 1-2.09V6.25c-1.09.53-2 1.84-2 3.25C6 11.31 7.55 13 9 13h4c1.45 0 3-1.69 3-3.5S14.5 6 13 6z\"\n  }))), \"Box\"), mdx(\"p\", null, \"To draw a simple surrounding box use \", mdx(\"code\", {\n    parentName: \"p\",\n    \"className\": \"language-text\"\n  }, \"<box/>\")), mdx(\"div\", {\n    \"className\": \"gatsby-highlight\",\n    \"data-language\": \"js\"\n  }, mdx(\"pre\", {\n    parentName: \"div\",\n    \"className\": \"language-js\"\n  }, mdx(\"code\", {\n    parentName: \"pre\",\n    \"className\": \"language-js\"\n  }, mdx(\"span\", {\n    parentName: \"code\",\n    \"className\": \"token keyword\"\n  }, \"import\"), \" Artist \", mdx(\"span\", {\n    parentName: \"code\",\n    \"className\": \"token keyword\"\n  }, \"from\"), \" \", mdx(\"span\", {\n    parentName: \"code\",\n    \"className\": \"token string\"\n  }, \"\\\"@lesy/artist\\\"\"), mdx(\"span\", {\n    parentName: \"code\",\n    \"className\": \"token punctuation\"\n  }, \";\"), \"\\n\", mdx(\"span\", {\n    parentName: \"code\",\n    \"className\": \"token keyword\"\n  }, \"const\"), \" \", mdx(\"span\", {\n    parentName: \"code\",\n    \"className\": \"token constant\"\n  }, \"UI\"), \" \", mdx(\"span\", {\n    parentName: \"code\",\n    \"className\": \"token operator\"\n  }, \"=\"), \" \", mdx(\"span\", {\n    parentName: \"code\",\n    \"className\": \"token keyword\"\n  }, \"new\"), \" \", mdx(\"span\", {\n    parentName: \"code\",\n    \"className\": \"token class-name\"\n  }, \"Artist\"), mdx(\"span\", {\n    parentName: \"code\",\n    \"className\": \"token punctuation\"\n  }, \"(\"), mdx(\"span\", {\n    parentName: \"code\",\n    \"className\": \"token punctuation\"\n  }, \")\"), mdx(\"span\", {\n    parentName: \"code\",\n    \"className\": \"token punctuation\"\n  }, \";\"), \"\\n\\n\", mdx(\"span\", {\n    parentName: \"code\",\n    \"className\": \"token constant\"\n  }, \"UI\"), mdx(\"span\", {\n    parentName: \"code\",\n    \"className\": \"token punctuation\"\n  }, \".\"), mdx(\"span\", {\n    parentName: \"code\",\n    \"className\": \"token function\"\n  }, \"render\"), mdx(\"span\", {\n    parentName: \"code\",\n    \"className\": \"token punctuation\"\n  }, \"(\"), mdx(\"span\", {\n    parentName: \"code\",\n    \"className\": \"token punctuation\"\n  }, \"(\"), mdx(\"span\", {\n    parentName: \"code\",\n    \"className\": \"token punctuation\"\n  }, \")\"), \" \", mdx(\"span\", {\n    parentName: \"code\",\n    \"className\": \"token operator\"\n  }, \"=>\"), \" \", mdx(\"span\", {\n    parentName: \"code\",\n    \"className\": \"token punctuation\"\n  }, \"{\"), \"\\n  \", mdx(\"span\", {\n    parentName: \"code\",\n    \"className\": \"token keyword\"\n  }, \"return\"), \" \", mdx(\"span\", {\n    parentName: \"code\",\n    \"className\": \"token template-string\"\n  }, mdx(\"span\", {\n    parentName: \"span\",\n    \"className\": \"token template-punctuation string\"\n  }, \"`\"), mdx(\"span\", {\n    parentName: \"span\",\n    \"className\": \"token string\"\n  }, \"<box>\\n    <text> I am a simple text inside a box </text>\\n</box>\"), mdx(\"span\", {\n    parentName: \"span\",\n    \"className\": \"token template-punctuation string\"\n  }, \"`\")), mdx(\"span\", {\n    parentName: \"code\",\n    \"className\": \"token punctuation\"\n  }, \";\"), \"\\n\", mdx(\"span\", {\n    parentName: \"code\",\n    \"className\": \"token punctuation\"\n  }, \"}\"), mdx(\"span\", {\n    parentName: \"code\",\n    \"className\": \"token punctuation\"\n  }, \")\"), mdx(\"span\", {\n    parentName: \"code\",\n    \"className\": \"token punctuation\"\n  }, \";\")))), mdx(\"h3\", {\n    \"id\": \"spinner\",\n    \"style\": {\n      \"position\": \"relative\"\n    }\n  }, mdx(\"a\", {\n    parentName: \"h3\",\n    \"href\": \"#spinner\",\n    \"aria-label\": \"spinner permalink\",\n    \"className\": \"anchor before\"\n  }, mdx(\"svg\", {\n    parentName: \"a\",\n    \"aria-hidden\": \"true\",\n    \"focusable\": \"false\",\n    \"height\": \"16\",\n    \"version\": \"1.1\",\n    \"viewBox\": \"0 0 16 16\",\n    \"width\": \"16\"\n  }, mdx(\"path\", {\n    parentName: \"svg\",\n    \"fillRule\": \"evenodd\",\n    \"d\": \"M4 9h1v1H4c-1.5 0-3-1.69-3-3.5S2.55 3 4 3h4c1.45 0 3 1.69 3 3.5 0 1.41-.91 2.72-2 3.25V8.59c.58-.45 1-1.27 1-2.09C10 5.22 8.98 4 8 4H4c-.98 0-2 1.22-2 2.5S3 9 4 9zm9-3h-1v1h1c1 0 2 1.22 2 2.5S13.98 12 13 12H9c-.98 0-2-1.22-2-2.5 0-.83.42-1.64 1-2.09V6.25c-1.09.53-2 1.84-2 3.25C6 11.31 7.55 13 9 13h4c1.45 0 3-1.69 3-3.5S14.5 6 13 6z\"\n  }))), \"Spinner\"), mdx(\"p\", null, \"To display a spinner, use \", mdx(\"code\", {\n    parentName: \"p\",\n    \"className\": \"language-text\"\n  }, \"<spinner/>\"), \" and it accepts \", mdx(\"code\", {\n    parentName: \"p\",\n    \"className\": \"language-text\"\n  }, \"type\"), \" and \", mdx(\"code\", {\n    parentName: \"p\",\n    \"className\": \"language-text\"\n  }, \"id\"), \" props. If you have multiple spinner, set unique id/string in the id prop.\"), mdx(\"div\", {\n    \"className\": \"gatsby-highlight\",\n    \"data-language\": \"js\"\n  }, mdx(\"pre\", {\n    parentName: \"div\",\n    \"className\": \"language-js\"\n  }, mdx(\"code\", {\n    parentName: \"pre\",\n    \"className\": \"language-js\"\n  }, mdx(\"span\", {\n    parentName: \"code\",\n    \"className\": \"token keyword\"\n  }, \"import\"), \" Artist \", mdx(\"span\", {\n    parentName: \"code\",\n    \"className\": \"token keyword\"\n  }, \"from\"), \" \", mdx(\"span\", {\n    parentName: \"code\",\n    \"className\": \"token string\"\n  }, \"\\\"@lesy/artist\\\"\"), mdx(\"span\", {\n    parentName: \"code\",\n    \"className\": \"token punctuation\"\n  }, \";\"), \"\\n\", mdx(\"span\", {\n    parentName: \"code\",\n    \"className\": \"token keyword\"\n  }, \"const\"), \" \", mdx(\"span\", {\n    parentName: \"code\",\n    \"className\": \"token constant\"\n  }, \"UI\"), \" \", mdx(\"span\", {\n    parentName: \"code\",\n    \"className\": \"token operator\"\n  }, \"=\"), \" \", mdx(\"span\", {\n    parentName: \"code\",\n    \"className\": \"token keyword\"\n  }, \"new\"), \" \", mdx(\"span\", {\n    parentName: \"code\",\n    \"className\": \"token class-name\"\n  }, \"Artist\"), mdx(\"span\", {\n    parentName: \"code\",\n    \"className\": \"token punctuation\"\n  }, \"(\"), mdx(\"span\", {\n    parentName: \"code\",\n    \"className\": \"token punctuation\"\n  }, \")\"), mdx(\"span\", {\n    parentName: \"code\",\n    \"className\": \"token punctuation\"\n  }, \";\"), \"\\n\\n\", mdx(\"span\", {\n    parentName: \"code\",\n    \"className\": \"token constant\"\n  }, \"UI\"), mdx(\"span\", {\n    parentName: \"code\",\n    \"className\": \"token punctuation\"\n  }, \".\"), mdx(\"span\", {\n    parentName: \"code\",\n    \"className\": \"token function\"\n  }, \"render\"), mdx(\"span\", {\n    parentName: \"code\",\n    \"className\": \"token punctuation\"\n  }, \"(\"), mdx(\"span\", {\n    parentName: \"code\",\n    \"className\": \"token punctuation\"\n  }, \"(\"), mdx(\"span\", {\n    parentName: \"code\",\n    \"className\": \"token punctuation\"\n  }, \")\"), \" \", mdx(\"span\", {\n    parentName: \"code\",\n    \"className\": \"token operator\"\n  }, \"=>\"), \" \", mdx(\"span\", {\n    parentName: \"code\",\n    \"className\": \"token punctuation\"\n  }, \"{\"), \"\\n  \", mdx(\"span\", {\n    parentName: \"code\",\n    \"className\": \"token keyword\"\n  }, \"return\"), \" \", mdx(\"span\", {\n    parentName: \"code\",\n    \"className\": \"token template-string\"\n  }, mdx(\"span\", {\n    parentName: \"span\",\n    \"className\": \"token template-punctuation string\"\n  }, \"`\"), mdx(\"span\", {\n    parentName: \"span\",\n    \"className\": \"token string\"\n  }, \"<spinner type=\\\"dots\\\"/> Loading...\"), mdx(\"span\", {\n    parentName: \"span\",\n    \"className\": \"token template-punctuation string\"\n  }, \"`\")), mdx(\"span\", {\n    parentName: \"code\",\n    \"className\": \"token punctuation\"\n  }, \";\"), \"\\n\", mdx(\"span\", {\n    parentName: \"code\",\n    \"className\": \"token punctuation\"\n  }, \"}\"), mdx(\"span\", {\n    parentName: \"code\",\n    \"className\": \"token punctuation\"\n  }, \")\"), mdx(\"span\", {\n    parentName: \"code\",\n    \"className\": \"token punctuation\"\n  }, \";\")))), mdx(\"p\", null, \"More spinner types refer cliSpinners\"), mdx(\"h3\", {\n    \"id\": \"progress-bar\",\n    \"style\": {\n      \"position\": \"relative\"\n    }\n  }, mdx(\"a\", {\n    parentName: \"h3\",\n    \"href\": \"#progress-bar\",\n    \"aria-label\": \"progress bar permalink\",\n    \"className\": \"anchor before\"\n  }, mdx(\"svg\", {\n    parentName: \"a\",\n    \"aria-hidden\": \"true\",\n    \"focusable\": \"false\",\n    \"height\": \"16\",\n    \"version\": \"1.1\",\n    \"viewBox\": \"0 0 16 16\",\n    \"width\": \"16\"\n  }, mdx(\"path\", {\n    parentName: \"svg\",\n    \"fillRule\": \"evenodd\",\n    \"d\": \"M4 9h1v1H4c-1.5 0-3-1.69-3-3.5S2.55 3 4 3h4c1.45 0 3 1.69 3 3.5 0 1.41-.91 2.72-2 3.25V8.59c.58-.45 1-1.27 1-2.09C10 5.22 8.98 4 8 4H4c-.98 0-2 1.22-2 2.5S3 9 4 9zm9-3h-1v1h1c1 0 2 1.22 2 2.5S13.98 12 13 12H9c-.98 0-2-1.22-2-2.5 0-.83.42-1.64 1-2.09V6.25c-1.09.53-2 1.84-2 3.25C6 11.31 7.55 13 9 13h4c1.45 0 3-1.69 3-3.5S14.5 6 13 6z\"\n  }))), \"Progress bar\"), mdx(\"p\", null, \"For a progress bar use \", mdx(\"code\", {\n    parentName: \"p\",\n    \"className\": \"language-text\"\n  }, \"<progress/>\"), \". You can pass \", mdx(\"code\", {\n    parentName: \"p\",\n    \"className\": \"language-text\"\n  }, \"score\"), \" prop to set the value between 0-100.\"), mdx(\"div\", {\n    \"className\": \"gatsby-highlight\",\n    \"data-language\": \"js\"\n  }, mdx(\"pre\", {\n    parentName: \"div\",\n    \"className\": \"language-js\"\n  }, mdx(\"code\", {\n    parentName: \"pre\",\n    \"className\": \"language-js\"\n  }, mdx(\"span\", {\n    parentName: \"code\",\n    \"className\": \"token keyword\"\n  }, \"import\"), \" Artist \", mdx(\"span\", {\n    parentName: \"code\",\n    \"className\": \"token keyword\"\n  }, \"from\"), \" \", mdx(\"span\", {\n    parentName: \"code\",\n    \"className\": \"token string\"\n  }, \"\\\"@lesy/artist\\\"\"), mdx(\"span\", {\n    parentName: \"code\",\n    \"className\": \"token punctuation\"\n  }, \";\"), \"\\n\", mdx(\"span\", {\n    parentName: \"code\",\n    \"className\": \"token keyword\"\n  }, \"const\"), \" \", mdx(\"span\", {\n    parentName: \"code\",\n    \"className\": \"token constant\"\n  }, \"UI\"), \" \", mdx(\"span\", {\n    parentName: \"code\",\n    \"className\": \"token operator\"\n  }, \"=\"), \" \", mdx(\"span\", {\n    parentName: \"code\",\n    \"className\": \"token keyword\"\n  }, \"new\"), \" \", mdx(\"span\", {\n    parentName: \"code\",\n    \"className\": \"token class-name\"\n  }, \"Artist\"), mdx(\"span\", {\n    parentName: \"code\",\n    \"className\": \"token punctuation\"\n  }, \"(\"), mdx(\"span\", {\n    parentName: \"code\",\n    \"className\": \"token punctuation\"\n  }, \")\"), mdx(\"span\", {\n    parentName: \"code\",\n    \"className\": \"token punctuation\"\n  }, \";\"), \"\\n\\n\", mdx(\"span\", {\n    parentName: \"code\",\n    \"className\": \"token constant\"\n  }, \"UI\"), mdx(\"span\", {\n    parentName: \"code\",\n    \"className\": \"token punctuation\"\n  }, \".\"), mdx(\"span\", {\n    parentName: \"code\",\n    \"className\": \"token function\"\n  }, \"render\"), mdx(\"span\", {\n    parentName: \"code\",\n    \"className\": \"token punctuation\"\n  }, \"(\"), mdx(\"span\", {\n    parentName: \"code\",\n    \"className\": \"token punctuation\"\n  }, \"(\"), mdx(\"span\", {\n    parentName: \"code\",\n    \"className\": \"token punctuation\"\n  }, \")\"), \" \", mdx(\"span\", {\n    parentName: \"code\",\n    \"className\": \"token operator\"\n  }, \"=>\"), \" \", mdx(\"span\", {\n    parentName: \"code\",\n    \"className\": \"token punctuation\"\n  }, \"{\"), \"\\n  \", mdx(\"span\", {\n    parentName: \"code\",\n    \"className\": \"token keyword\"\n  }, \"return\"), \" \", mdx(\"span\", {\n    parentName: \"code\",\n    \"className\": \"token template-string\"\n  }, mdx(\"span\", {\n    parentName: \"span\",\n    \"className\": \"token template-punctuation string\"\n  }, \"`\"), mdx(\"span\", {\n    parentName: \"span\",\n    \"className\": \"token string\"\n  }, \"Running <progress score=\\\"20\\\"/>\"), mdx(\"span\", {\n    parentName: \"span\",\n    \"className\": \"token template-punctuation string\"\n  }, \"`\")), mdx(\"span\", {\n    parentName: \"code\",\n    \"className\": \"token punctuation\"\n  }, \";\"), \"\\n\", mdx(\"span\", {\n    parentName: \"code\",\n    \"className\": \"token punctuation\"\n  }, \"}\"), mdx(\"span\", {\n    parentName: \"code\",\n    \"className\": \"token punctuation\"\n  }, \")\"), mdx(\"span\", {\n    parentName: \"code\",\n    \"className\": \"token punctuation\"\n  }, \";\")))), mdx(\"h3\", {\n    \"id\": \"div\",\n    \"style\": {\n      \"position\": \"relative\"\n    }\n  }, mdx(\"a\", {\n    parentName: \"h3\",\n    \"href\": \"#div\",\n    \"aria-label\": \"div permalink\",\n    \"className\": \"anchor before\"\n  }, mdx(\"svg\", {\n    parentName: \"a\",\n    \"aria-hidden\": \"true\",\n    \"focusable\": \"false\",\n    \"height\": \"16\",\n    \"version\": \"1.1\",\n    \"viewBox\": \"0 0 16 16\",\n    \"width\": \"16\"\n  }, mdx(\"path\", {\n    parentName: \"svg\",\n    \"fillRule\": \"evenodd\",\n    \"d\": \"M4 9h1v1H4c-1.5 0-3-1.69-3-3.5S2.55 3 4 3h4c1.45 0 3 1.69 3 3.5 0 1.41-.91 2.72-2 3.25V8.59c.58-.45 1-1.27 1-2.09C10 5.22 8.98 4 8 4H4c-.98 0-2 1.22-2 2.5S3 9 4 9zm9-3h-1v1h1c1 0 2 1.22 2 2.5S13.98 12 13 12H9c-.98 0-2-1.22-2-2.5 0-.83.42-1.64 1-2.09V6.25c-1.09.53-2 1.84-2 3.25C6 11.31 7.55 13 9 13h4c1.45 0 3-1.69 3-3.5S14.5 6 13 6z\"\n  }))), \"Div\"), mdx(\"p\", null, \"For a block line (new line break in the end), use \", mdx(\"code\", {\n    parentName: \"p\",\n    \"className\": \"language-text\"\n  }, \"<div/>\")), mdx(\"div\", {\n    \"className\": \"gatsby-highlight\",\n    \"data-language\": \"js\"\n  }, mdx(\"pre\", {\n    parentName: \"div\",\n    \"className\": \"language-js\"\n  }, mdx(\"code\", {\n    parentName: \"pre\",\n    \"className\": \"language-js\"\n  }, mdx(\"span\", {\n    parentName: \"code\",\n    \"className\": \"token keyword\"\n  }, \"import\"), \" Artist \", mdx(\"span\", {\n    parentName: \"code\",\n    \"className\": \"token keyword\"\n  }, \"from\"), \" \", mdx(\"span\", {\n    parentName: \"code\",\n    \"className\": \"token string\"\n  }, \"\\\"@lesy/artist\\\"\"), mdx(\"span\", {\n    parentName: \"code\",\n    \"className\": \"token punctuation\"\n  }, \";\"), \"\\n\", mdx(\"span\", {\n    parentName: \"code\",\n    \"className\": \"token keyword\"\n  }, \"const\"), \" \", mdx(\"span\", {\n    parentName: \"code\",\n    \"className\": \"token constant\"\n  }, \"UI\"), \" \", mdx(\"span\", {\n    parentName: \"code\",\n    \"className\": \"token operator\"\n  }, \"=\"), \" \", mdx(\"span\", {\n    parentName: \"code\",\n    \"className\": \"token keyword\"\n  }, \"new\"), \" \", mdx(\"span\", {\n    parentName: \"code\",\n    \"className\": \"token class-name\"\n  }, \"Artist\"), mdx(\"span\", {\n    parentName: \"code\",\n    \"className\": \"token punctuation\"\n  }, \"(\"), mdx(\"span\", {\n    parentName: \"code\",\n    \"className\": \"token punctuation\"\n  }, \")\"), mdx(\"span\", {\n    parentName: \"code\",\n    \"className\": \"token punctuation\"\n  }, \";\"), \"\\n\\n\", mdx(\"span\", {\n    parentName: \"code\",\n    \"className\": \"token constant\"\n  }, \"UI\"), mdx(\"span\", {\n    parentName: \"code\",\n    \"className\": \"token punctuation\"\n  }, \".\"), mdx(\"span\", {\n    parentName: \"code\",\n    \"className\": \"token function\"\n  }, \"render\"), mdx(\"span\", {\n    parentName: \"code\",\n    \"className\": \"token punctuation\"\n  }, \"(\"), mdx(\"span\", {\n    parentName: \"code\",\n    \"className\": \"token punctuation\"\n  }, \"(\"), mdx(\"span\", {\n    parentName: \"code\",\n    \"className\": \"token punctuation\"\n  }, \")\"), \" \", mdx(\"span\", {\n    parentName: \"code\",\n    \"className\": \"token operator\"\n  }, \"=>\"), \" \", mdx(\"span\", {\n    parentName: \"code\",\n    \"className\": \"token punctuation\"\n  }, \"{\"), \"\\n  \", mdx(\"span\", {\n    parentName: \"code\",\n    \"className\": \"token keyword\"\n  }, \"return\"), \" \", mdx(\"span\", {\n    parentName: \"code\",\n    \"className\": \"token template-string\"\n  }, mdx(\"span\", {\n    parentName: \"span\",\n    \"className\": \"token template-punctuation string\"\n  }, \"`\"), mdx(\"span\", {\n    parentName: \"span\",\n    \"className\": \"token string\"\n  }, \"<div>Line one</div><div>next line</div>\"), mdx(\"span\", {\n    parentName: \"span\",\n    \"className\": \"token template-punctuation string\"\n  }, \"`\")), mdx(\"span\", {\n    parentName: \"code\",\n    \"className\": \"token punctuation\"\n  }, \";\"), \"\\n\", mdx(\"span\", {\n    parentName: \"code\",\n    \"className\": \"token punctuation\"\n  }, \"}\"), mdx(\"span\", {\n    parentName: \"code\",\n    \"className\": \"token punctuation\"\n  }, \")\"), mdx(\"span\", {\n    parentName: \"code\",\n    \"className\": \"token punctuation\"\n  }, \";\")))), mdx(\"h3\", {\n    \"id\": \"span\",\n    \"style\": {\n      \"position\": \"relative\"\n    }\n  }, mdx(\"a\", {\n    parentName: \"h3\",\n    \"href\": \"#span\",\n    \"aria-label\": \"span permalink\",\n    \"className\": \"anchor before\"\n  }, mdx(\"svg\", {\n    parentName: \"a\",\n    \"aria-hidden\": \"true\",\n    \"focusable\": \"false\",\n    \"height\": \"16\",\n    \"version\": \"1.1\",\n    \"viewBox\": \"0 0 16 16\",\n    \"width\": \"16\"\n  }, mdx(\"path\", {\n    parentName: \"svg\",\n    \"fillRule\": \"evenodd\",\n    \"d\": \"M4 9h1v1H4c-1.5 0-3-1.69-3-3.5S2.55 3 4 3h4c1.45 0 3 1.69 3 3.5 0 1.41-.91 2.72-2 3.25V8.59c.58-.45 1-1.27 1-2.09C10 5.22 8.98 4 8 4H4c-.98 0-2 1.22-2 2.5S3 9 4 9zm9-3h-1v1h1c1 0 2 1.22 2 2.5S13.98 12 13 12H9c-.98 0-2-1.22-2-2.5 0-.83.42-1.64 1-2.09V6.25c-1.09.53-2 1.84-2 3.25C6 11.31 7.55 13 9 13h4c1.45 0 3-1.69 3-3.5S14.5 6 13 6z\"\n  }))), \"Span\"), mdx(\"p\", null, \"For inline content use \", mdx(\"code\", {\n    parentName: \"p\",\n    \"className\": \"language-text\"\n  }, \"<span/>\"), \".\"), mdx(\"div\", {\n    \"className\": \"gatsby-highlight\",\n    \"data-language\": \"js\"\n  }, mdx(\"pre\", {\n    parentName: \"div\",\n    \"className\": \"language-js\"\n  }, mdx(\"code\", {\n    parentName: \"pre\",\n    \"className\": \"language-js\"\n  }, mdx(\"span\", {\n    parentName: \"code\",\n    \"className\": \"token keyword\"\n  }, \"import\"), \" Artist \", mdx(\"span\", {\n    parentName: \"code\",\n    \"className\": \"token keyword\"\n  }, \"from\"), \" \", mdx(\"span\", {\n    parentName: \"code\",\n    \"className\": \"token string\"\n  }, \"\\\"@lesy/artist\\\"\"), mdx(\"span\", {\n    parentName: \"code\",\n    \"className\": \"token punctuation\"\n  }, \";\"), \"\\n\", mdx(\"span\", {\n    parentName: \"code\",\n    \"className\": \"token keyword\"\n  }, \"const\"), \" \", mdx(\"span\", {\n    parentName: \"code\",\n    \"className\": \"token constant\"\n  }, \"UI\"), \" \", mdx(\"span\", {\n    parentName: \"code\",\n    \"className\": \"token operator\"\n  }, \"=\"), \" \", mdx(\"span\", {\n    parentName: \"code\",\n    \"className\": \"token keyword\"\n  }, \"new\"), \" \", mdx(\"span\", {\n    parentName: \"code\",\n    \"className\": \"token class-name\"\n  }, \"Artist\"), mdx(\"span\", {\n    parentName: \"code\",\n    \"className\": \"token punctuation\"\n  }, \"(\"), mdx(\"span\", {\n    parentName: \"code\",\n    \"className\": \"token punctuation\"\n  }, \")\"), mdx(\"span\", {\n    parentName: \"code\",\n    \"className\": \"token punctuation\"\n  }, \";\"), \"\\n\\n\", mdx(\"span\", {\n    parentName: \"code\",\n    \"className\": \"token constant\"\n  }, \"UI\"), mdx(\"span\", {\n    parentName: \"code\",\n    \"className\": \"token punctuation\"\n  }, \".\"), mdx(\"span\", {\n    parentName: \"code\",\n    \"className\": \"token function\"\n  }, \"render\"), mdx(\"span\", {\n    parentName: \"code\",\n    \"className\": \"token punctuation\"\n  }, \"(\"), mdx(\"span\", {\n    parentName: \"code\",\n    \"className\": \"token punctuation\"\n  }, \"(\"), mdx(\"span\", {\n    parentName: \"code\",\n    \"className\": \"token punctuation\"\n  }, \")\"), \" \", mdx(\"span\", {\n    parentName: \"code\",\n    \"className\": \"token operator\"\n  }, \"=>\"), \" \", mdx(\"span\", {\n    parentName: \"code\",\n    \"className\": \"token punctuation\"\n  }, \"{\"), \"\\n  \", mdx(\"span\", {\n    parentName: \"code\",\n    \"className\": \"token keyword\"\n  }, \"return\"), \" \", mdx(\"span\", {\n    parentName: \"code\",\n    \"className\": \"token template-string\"\n  }, mdx(\"span\", {\n    parentName: \"span\",\n    \"className\": \"token template-punctuation string\"\n  }, \"`\"), mdx(\"span\", {\n    parentName: \"span\",\n    \"className\": \"token string\"\n  }, \"<span>Line one</span><span>same line</span>\"), mdx(\"span\", {\n    parentName: \"span\",\n    \"className\": \"token template-punctuation string\"\n  }, \"`\")), mdx(\"span\", {\n    parentName: \"code\",\n    \"className\": \"token punctuation\"\n  }, \";\"), \"\\n\", mdx(\"span\", {\n    parentName: \"code\",\n    \"className\": \"token punctuation\"\n  }, \"}\"), mdx(\"span\", {\n    parentName: \"code\",\n    \"className\": \"token punctuation\"\n  }, \")\"), mdx(\"span\", {\n    parentName: \"code\",\n    \"className\": \"token punctuation\"\n  }, \";\")))), mdx(\"h3\", {\n    \"id\": \"newline\",\n    \"style\": {\n      \"position\": \"relative\"\n    }\n  }, mdx(\"a\", {\n    parentName: \"h3\",\n    \"href\": \"#newline\",\n    \"aria-label\": \"newline permalink\",\n    \"className\": \"anchor before\"\n  }, mdx(\"svg\", {\n    parentName: \"a\",\n    \"aria-hidden\": \"true\",\n    \"focusable\": \"false\",\n    \"height\": \"16\",\n    \"version\": \"1.1\",\n    \"viewBox\": \"0 0 16 16\",\n    \"width\": \"16\"\n  }, mdx(\"path\", {\n    parentName: \"svg\",\n    \"fillRule\": \"evenodd\",\n    \"d\": \"M4 9h1v1H4c-1.5 0-3-1.69-3-3.5S2.55 3 4 3h4c1.45 0 3 1.69 3 3.5 0 1.41-.91 2.72-2 3.25V8.59c.58-.45 1-1.27 1-2.09C10 5.22 8.98 4 8 4H4c-.98 0-2 1.22-2 2.5S3 9 4 9zm9-3h-1v1h1c1 0 2 1.22 2 2.5S13.98 12 13 12H9c-.98 0-2-1.22-2-2.5 0-.83.42-1.64 1-2.09V6.25c-1.09.53-2 1.84-2 3.25C6 11.31 7.55 13 9 13h4c1.45 0 3-1.69 3-3.5S14.5 6 13 6z\"\n  }))), \"Newline\"), mdx(\"p\", null, \"To add a new line break use \", mdx(\"code\", {\n    parentName: \"p\",\n    \"className\": \"language-text\"\n  }, \"<newline/>\")), mdx(\"div\", {\n    \"className\": \"gatsby-highlight\",\n    \"data-language\": \"js\"\n  }, mdx(\"pre\", {\n    parentName: \"div\",\n    \"className\": \"language-js\"\n  }, mdx(\"code\", {\n    parentName: \"pre\",\n    \"className\": \"language-js\"\n  }, mdx(\"span\", {\n    parentName: \"code\",\n    \"className\": \"token keyword\"\n  }, \"const\"), \" \", mdx(\"span\", {\n    parentName: \"code\",\n    \"className\": \"token constant\"\n  }, \"UI\"), \" \", mdx(\"span\", {\n    parentName: \"code\",\n    \"className\": \"token operator\"\n  }, \"=\"), \" \", mdx(\"span\", {\n    parentName: \"code\",\n    \"className\": \"token keyword\"\n  }, \"new\"), \" \", mdx(\"span\", {\n    parentName: \"code\",\n    \"className\": \"token class-name\"\n  }, \"Artist\"), mdx(\"span\", {\n    parentName: \"code\",\n    \"className\": \"token punctuation\"\n  }, \"(\"), mdx(\"span\", {\n    parentName: \"code\",\n    \"className\": \"token punctuation\"\n  }, \")\"), mdx(\"span\", {\n    parentName: \"code\",\n    \"className\": \"token punctuation\"\n  }, \";\"), \"\\n\\n\", mdx(\"span\", {\n    parentName: \"code\",\n    \"className\": \"token constant\"\n  }, \"UI\"), mdx(\"span\", {\n    parentName: \"code\",\n    \"className\": \"token punctuation\"\n  }, \".\"), mdx(\"span\", {\n    parentName: \"code\",\n    \"className\": \"token function\"\n  }, \"render\"), mdx(\"span\", {\n    parentName: \"code\",\n    \"className\": \"token punctuation\"\n  }, \"(\"), mdx(\"span\", {\n    parentName: \"code\",\n    \"className\": \"token punctuation\"\n  }, \"(\"), mdx(\"span\", {\n    parentName: \"code\",\n    \"className\": \"token punctuation\"\n  }, \")\"), \" \", mdx(\"span\", {\n    parentName: \"code\",\n    \"className\": \"token operator\"\n  }, \"=>\"), \" \", mdx(\"span\", {\n    parentName: \"code\",\n    \"className\": \"token punctuation\"\n  }, \"{\"), \"\\n  \", mdx(\"span\", {\n    parentName: \"code\",\n    \"className\": \"token keyword\"\n  }, \"return\"), \" \", mdx(\"span\", {\n    parentName: \"code\",\n    \"className\": \"token template-string\"\n  }, mdx(\"span\", {\n    parentName: \"span\",\n    \"className\": \"token template-punctuation string\"\n  }, \"`\"), mdx(\"span\", {\n    parentName: \"span\",\n    \"className\": \"token string\"\n  }, \"<text>hello!</text>\\n  <newline/>\\n  <text>Welcome</text>\"), mdx(\"span\", {\n    parentName: \"span\",\n    \"className\": \"token template-punctuation string\"\n  }, \"`\")), mdx(\"span\", {\n    parentName: \"code\",\n    \"className\": \"token punctuation\"\n  }, \";\"), \"\\n\", mdx(\"span\", {\n    parentName: \"code\",\n    \"className\": \"token punctuation\"\n  }, \"}\"), mdx(\"span\", {\n    parentName: \"code\",\n    \"className\": \"token punctuation\"\n  }, \")\"), mdx(\"span\", {\n    parentName: \"code\",\n    \"className\": \"token punctuation\"\n  }, \";\")))), mdx(\"h3\", {\n    \"id\": \"space\",\n    \"style\": {\n      \"position\": \"relative\"\n    }\n  }, mdx(\"a\", {\n    parentName: \"h3\",\n    \"href\": \"#space\",\n    \"aria-label\": \"space permalink\",\n    \"className\": \"anchor before\"\n  }, mdx(\"svg\", {\n    parentName: \"a\",\n    \"aria-hidden\": \"true\",\n    \"focusable\": \"false\",\n    \"height\": \"16\",\n    \"version\": \"1.1\",\n    \"viewBox\": \"0 0 16 16\",\n    \"width\": \"16\"\n  }, mdx(\"path\", {\n    parentName: \"svg\",\n    \"fillRule\": \"evenodd\",\n    \"d\": \"M4 9h1v1H4c-1.5 0-3-1.69-3-3.5S2.55 3 4 3h4c1.45 0 3 1.69 3 3.5 0 1.41-.91 2.72-2 3.25V8.59c.58-.45 1-1.27 1-2.09C10 5.22 8.98 4 8 4H4c-.98 0-2 1.22-2 2.5S3 9 4 9zm9-3h-1v1h1c1 0 2 1.22 2 2.5S13.98 12 13 12H9c-.98 0-2-1.22-2-2.5 0-.83.42-1.64 1-2.09V6.25c-1.09.53-2 1.84-2 3.25C6 11.31 7.55 13 9 13h4c1.45 0 3-1.69 3-3.5S14.5 6 13 6z\"\n  }))), \"Space\"), mdx(\"p\", null, \"In somecases you might wanted a set a space explicitely. In those cases use \", mdx(\"code\", {\n    parentName: \"p\",\n    \"className\": \"language-text\"\n  }, \"<space/>\"), \" with \", mdx(\"code\", {\n    parentName: \"p\",\n    \"className\": \"language-text\"\n  }, \"length\"), \" prop.\"), mdx(\"div\", {\n    \"className\": \"gatsby-highlight\",\n    \"data-language\": \"js\"\n  }, mdx(\"pre\", {\n    parentName: \"div\",\n    \"className\": \"language-js\"\n  }, mdx(\"code\", {\n    parentName: \"pre\",\n    \"className\": \"language-js\"\n  }, mdx(\"span\", {\n    parentName: \"code\",\n    \"className\": \"token keyword\"\n  }, \"import\"), \" Artist \", mdx(\"span\", {\n    parentName: \"code\",\n    \"className\": \"token keyword\"\n  }, \"from\"), \" \", mdx(\"span\", {\n    parentName: \"code\",\n    \"className\": \"token string\"\n  }, \"\\\"@lesy/artist\\\"\"), mdx(\"span\", {\n    parentName: \"code\",\n    \"className\": \"token punctuation\"\n  }, \";\"), \"\\n\", mdx(\"span\", {\n    parentName: \"code\",\n    \"className\": \"token keyword\"\n  }, \"const\"), \" \", mdx(\"span\", {\n    parentName: \"code\",\n    \"className\": \"token constant\"\n  }, \"UI\"), \" \", mdx(\"span\", {\n    parentName: \"code\",\n    \"className\": \"token operator\"\n  }, \"=\"), \" \", mdx(\"span\", {\n    parentName: \"code\",\n    \"className\": \"token keyword\"\n  }, \"new\"), \" \", mdx(\"span\", {\n    parentName: \"code\",\n    \"className\": \"token class-name\"\n  }, \"Artist\"), mdx(\"span\", {\n    parentName: \"code\",\n    \"className\": \"token punctuation\"\n  }, \"(\"), mdx(\"span\", {\n    parentName: \"code\",\n    \"className\": \"token punctuation\"\n  }, \")\"), mdx(\"span\", {\n    parentName: \"code\",\n    \"className\": \"token punctuation\"\n  }, \";\"), \"\\n\\n\", mdx(\"span\", {\n    parentName: \"code\",\n    \"className\": \"token constant\"\n  }, \"UI\"), mdx(\"span\", {\n    parentName: \"code\",\n    \"className\": \"token punctuation\"\n  }, \".\"), mdx(\"span\", {\n    parentName: \"code\",\n    \"className\": \"token function\"\n  }, \"render\"), mdx(\"span\", {\n    parentName: \"code\",\n    \"className\": \"token punctuation\"\n  }, \"(\"), mdx(\"span\", {\n    parentName: \"code\",\n    \"className\": \"token punctuation\"\n  }, \"(\"), mdx(\"span\", {\n    parentName: \"code\",\n    \"className\": \"token punctuation\"\n  }, \")\"), \" \", mdx(\"span\", {\n    parentName: \"code\",\n    \"className\": \"token operator\"\n  }, \"=>\"), \" \", mdx(\"span\", {\n    parentName: \"code\",\n    \"className\": \"token punctuation\"\n  }, \"{\"), \"\\n  \", mdx(\"span\", {\n    parentName: \"code\",\n    \"className\": \"token keyword\"\n  }, \"return\"), \" \", mdx(\"span\", {\n    parentName: \"code\",\n    \"className\": \"token template-string\"\n  }, mdx(\"span\", {\n    parentName: \"span\",\n    \"className\": \"token template-punctuation string\"\n  }, \"`\"), mdx(\"span\", {\n    parentName: \"span\",\n    \"className\": \"token string\"\n  }, \"<text>hello!</text>\\n  <space length=\\\"2\\\"/>\\n  <text>Welcome</text>\"), mdx(\"span\", {\n    parentName: \"span\",\n    \"className\": \"token template-punctuation string\"\n  }, \"`\")), mdx(\"span\", {\n    parentName: \"code\",\n    \"className\": \"token punctuation\"\n  }, \";\"), \"\\n\", mdx(\"span\", {\n    parentName: \"code\",\n    \"className\": \"token punctuation\"\n  }, \"}\"), mdx(\"span\", {\n    parentName: \"code\",\n    \"className\": \"token punctuation\"\n  }, \")\"), mdx(\"span\", {\n    parentName: \"code\",\n    \"className\": \"token punctuation\"\n  }, \";\")))), mdx(\"h2\", {\n    \"id\": \"custom-elements\",\n    \"style\": {\n      \"position\": \"relative\"\n    }\n  }, mdx(\"a\", {\n    parentName: \"h2\",\n    \"href\": \"#custom-elements\",\n    \"aria-label\": \"custom elements permalink\",\n    \"className\": \"anchor before\"\n  }, mdx(\"svg\", {\n    parentName: \"a\",\n    \"aria-hidden\": \"true\",\n    \"focusable\": \"false\",\n    \"height\": \"16\",\n    \"version\": \"1.1\",\n    \"viewBox\": \"0 0 16 16\",\n    \"width\": \"16\"\n  }, mdx(\"path\", {\n    parentName: \"svg\",\n    \"fillRule\": \"evenodd\",\n    \"d\": \"M4 9h1v1H4c-1.5 0-3-1.69-3-3.5S2.55 3 4 3h4c1.45 0 3 1.69 3 3.5 0 1.41-.91 2.72-2 3.25V8.59c.58-.45 1-1.27 1-2.09C10 5.22 8.98 4 8 4H4c-.98 0-2 1.22-2 2.5S3 9 4 9zm9-3h-1v1h1c1 0 2 1.22 2 2.5S13.98 12 13 12H9c-.98 0-2-1.22-2-2.5 0-.83.42-1.64 1-2.09V6.25c-1.09.53-2 1.84-2 3.25C6 11.31 7.55 13 9 13h4c1.45 0 3-1.69 3-3.5S14.5 6 13 6z\"\n  }))), \"Custom elements\"), mdx(\"p\", null, \"For most terminal apps the built-in elements should be suffice. But if you like to create a completly new element or a composed block with existin elements, you can create one and register. Once the new element is regsitered it will be available across the app including the plugins.\"), mdx(\"h3\", {\n    \"id\": \"register-new-element\",\n    \"style\": {\n      \"position\": \"relative\"\n    }\n  }, mdx(\"a\", {\n    parentName: \"h3\",\n    \"href\": \"#register-new-element\",\n    \"aria-label\": \"register new element permalink\",\n    \"className\": \"anchor before\"\n  }, mdx(\"svg\", {\n    parentName: \"a\",\n    \"aria-hidden\": \"true\",\n    \"focusable\": \"false\",\n    \"height\": \"16\",\n    \"version\": \"1.1\",\n    \"viewBox\": \"0 0 16 16\",\n    \"width\": \"16\"\n  }, mdx(\"path\", {\n    parentName: \"svg\",\n    \"fillRule\": \"evenodd\",\n    \"d\": \"M4 9h1v1H4c-1.5 0-3-1.69-3-3.5S2.55 3 4 3h4c1.45 0 3 1.69 3 3.5 0 1.41-.91 2.72-2 3.25V8.59c.58-.45 1-1.27 1-2.09C10 5.22 8.98 4 8 4H4c-.98 0-2 1.22-2 2.5S3 9 4 9zm9-3h-1v1h1c1 0 2 1.22 2 2.5S13.98 12 13 12H9c-.98 0-2-1.22-2-2.5 0-.83.42-1.64 1-2.09V6.25c-1.09.53-2 1.84-2 3.25C6 11.31 7.55 13 9 13h4c1.45 0 3-1.69 3-3.5S14.5 6 13 6z\"\n  }))), \"Register new element\"), mdx(\"p\", null, \"An element is a simple object with \", mdx(\"code\", {\n    parentName: \"p\",\n    \"className\": \"language-text\"\n  }, \"name\"), \", \", mdx(\"code\", {\n    parentName: \"p\",\n    \"className\": \"language-text\"\n  }, \"render\"), \" and \", mdx(\"code\", {\n    parentName: \"p\",\n    \"className\": \"language-text\"\n  }, \"init\"), \" props. \", mdx(\"code\", {\n    parentName: \"p\",\n    \"className\": \"language-text\"\n  }, \"init\"), \" is optional.\"), mdx(\"ul\", null, mdx(\"li\", {\n    parentName: \"ul\"\n  }, mdx(\"strong\", {\n    parentName: \"li\"\n  }, \"name:\", mdx(\"code\", {\n    parentName: \"strong\",\n    \"className\": \"language-text\"\n  }, \"string\")), \" - tag name\"), mdx(\"li\", {\n    parentName: \"ul\"\n  }, mdx(\"strong\", {\n    parentName: \"li\"\n  }, \"render:\", mdx(\"code\", {\n    parentName: \"strong\",\n    \"className\": \"language-text\"\n  }, \"(ctx)=>void\")), \" - same as main \", mdx(\"code\", {\n    parentName: \"li\",\n    \"className\": \"language-text\"\n  }, \"render\"), \" method.\"), mdx(\"li\", {\n    parentName: \"ul\"\n  }, mdx(\"strong\", {\n    parentName: \"li\"\n  }, \"init:\", mdx(\"code\", {\n    parentName: \"strong\",\n    \"className\": \"language-text\"\n  }, \"(ctx)=>void\")), \" - function that will be called before \", mdx(\"code\", {\n    parentName: \"li\",\n    \"className\": \"language-text\"\n  }, \"render\"), \".\")), mdx(\"p\", null, \"Once created a elements pass that to \", mdx(\"code\", {\n    parentName: \"p\",\n    \"className\": \"language-text\"\n  }, \"registerEls\"), \" method.\"), mdx(\"div\", {\n    \"className\": \"gatsby-highlight\",\n    \"data-language\": \"js\"\n  }, mdx(\"pre\", {\n    parentName: \"div\",\n    \"className\": \"language-js\"\n  }, mdx(\"code\", {\n    parentName: \"pre\",\n    \"className\": \"language-js\"\n  }, mdx(\"span\", {\n    parentName: \"code\",\n    \"className\": \"token keyword\"\n  }, \"import\"), \" Artist \", mdx(\"span\", {\n    parentName: \"code\",\n    \"className\": \"token keyword\"\n  }, \"from\"), \" \", mdx(\"span\", {\n    parentName: \"code\",\n    \"className\": \"token string\"\n  }, \"\\\"@lesy/artist\\\"\"), mdx(\"span\", {\n    parentName: \"code\",\n    \"className\": \"token punctuation\"\n  }, \";\"), \"\\n\", mdx(\"span\", {\n    parentName: \"code\",\n    \"className\": \"token keyword\"\n  }, \"const\"), \" \", mdx(\"span\", {\n    parentName: \"code\",\n    \"className\": \"token constant\"\n  }, \"UI\"), \" \", mdx(\"span\", {\n    parentName: \"code\",\n    \"className\": \"token operator\"\n  }, \"=\"), \" \", mdx(\"span\", {\n    parentName: \"code\",\n    \"className\": \"token keyword\"\n  }, \"new\"), \" \", mdx(\"span\", {\n    parentName: \"code\",\n    \"className\": \"token class-name\"\n  }, \"Artist\"), mdx(\"span\", {\n    parentName: \"code\",\n    \"className\": \"token punctuation\"\n  }, \"(\"), mdx(\"span\", {\n    parentName: \"code\",\n    \"className\": \"token punctuation\"\n  }, \")\"), mdx(\"span\", {\n    parentName: \"code\",\n    \"className\": \"token punctuation\"\n  }, \";\"), \"\\n\\n\", mdx(\"span\", {\n    parentName: \"code\",\n    \"className\": \"token keyword\"\n  }, \"const\"), \" Warning \", mdx(\"span\", {\n    parentName: \"code\",\n    \"className\": \"token operator\"\n  }, \"=\"), \" \", mdx(\"span\", {\n    parentName: \"code\",\n    \"className\": \"token punctuation\"\n  }, \"{\"), \"\\n  name\", mdx(\"span\", {\n    parentName: \"code\",\n    \"className\": \"token operator\"\n  }, \":\"), \" \", mdx(\"span\", {\n    parentName: \"code\",\n    \"className\": \"token string\"\n  }, \"\\\"warn\\\"\"), mdx(\"span\", {\n    parentName: \"code\",\n    \"className\": \"token punctuation\"\n  }, \",\"), \"\\n  \", mdx(\"span\", {\n    parentName: \"code\",\n    \"className\": \"token function-variable function\"\n  }, \"render\"), mdx(\"span\", {\n    parentName: \"code\",\n    \"className\": \"token operator\"\n  }, \":\"), \" \", mdx(\"span\", {\n    parentName: \"code\",\n    \"className\": \"token parameter\"\n  }, \"ctx\"), \" \", mdx(\"span\", {\n    parentName: \"code\",\n    \"className\": \"token operator\"\n  }, \"=>\"), \" \", mdx(\"span\", {\n    parentName: \"code\",\n    \"className\": \"token template-string\"\n  }, mdx(\"span\", {\n    parentName: \"span\",\n    \"className\": \"token template-punctuation string\"\n  }, \"`\"), mdx(\"span\", {\n    parentName: \"span\",\n    \"className\": \"token string\"\n  }, \"<text bg=\\\"red\\\" color=\\\"white\\\">\"), mdx(\"span\", {\n    parentName: \"span\",\n    \"className\": \"token interpolation\"\n  }, mdx(\"span\", {\n    parentName: \"span\",\n    \"className\": \"token interpolation-punctuation punctuation\"\n  }, \"${\"), \"ctx\", mdx(\"span\", {\n    parentName: \"span\",\n    \"className\": \"token punctuation\"\n  }, \".\"), \"props\", mdx(\"span\", {\n    parentName: \"span\",\n    \"className\": \"token punctuation\"\n  }, \".\"), \"label\", mdx(\"span\", {\n    parentName: \"span\",\n    \"className\": \"token interpolation-punctuation punctuation\"\n  }, \"}\")), mdx(\"span\", {\n    parentName: \"span\",\n    \"className\": \"token string\"\n  }, \"</text>\"), mdx(\"span\", {\n    parentName: \"span\",\n    \"className\": \"token template-punctuation string\"\n  }, \"`\")), mdx(\"span\", {\n    parentName: \"code\",\n    \"className\": \"token punctuation\"\n  }, \",\"), \"\\n\", mdx(\"span\", {\n    parentName: \"code\",\n    \"className\": \"token punctuation\"\n  }, \"}\"), mdx(\"span\", {\n    parentName: \"code\",\n    \"className\": \"token punctuation\"\n  }, \";\"), \"\\n\", mdx(\"span\", {\n    parentName: \"code\",\n    \"className\": \"token constant\"\n  }, \"UI\"), mdx(\"span\", {\n    parentName: \"code\",\n    \"className\": \"token punctuation\"\n  }, \".\"), mdx(\"span\", {\n    parentName: \"code\",\n    \"className\": \"token function\"\n  }, \"registerEls\"), mdx(\"span\", {\n    parentName: \"code\",\n    \"className\": \"token punctuation\"\n  }, \"(\"), mdx(\"span\", {\n    parentName: \"code\",\n    \"className\": \"token punctuation\"\n  }, \"{\"), \" Warning \", mdx(\"span\", {\n    parentName: \"code\",\n    \"className\": \"token punctuation\"\n  }, \"}\"), mdx(\"span\", {\n    parentName: \"code\",\n    \"className\": \"token punctuation\"\n  }, \")\"), mdx(\"span\", {\n    parentName: \"code\",\n    \"className\": \"token punctuation\"\n  }, \";\"), \"\\n\\n\", mdx(\"span\", {\n    parentName: \"code\",\n    \"className\": \"token constant\"\n  }, \"UI\"), mdx(\"span\", {\n    parentName: \"code\",\n    \"className\": \"token punctuation\"\n  }, \".\"), mdx(\"span\", {\n    parentName: \"code\",\n    \"className\": \"token function\"\n  }, \"render\"), mdx(\"span\", {\n    parentName: \"code\",\n    \"className\": \"token punctuation\"\n  }, \"(\"), mdx(\"span\", {\n    parentName: \"code\",\n    \"className\": \"token punctuation\"\n  }, \"(\"), mdx(\"span\", {\n    parentName: \"code\",\n    \"className\": \"token punctuation\"\n  }, \")\"), \" \", mdx(\"span\", {\n    parentName: \"code\",\n    \"className\": \"token operator\"\n  }, \"=>\"), \" \", mdx(\"span\", {\n    parentName: \"code\",\n    \"className\": \"token punctuation\"\n  }, \"{\"), \"\\n  \", mdx(\"span\", {\n    parentName: \"code\",\n    \"className\": \"token keyword\"\n  }, \"return\"), \" \", mdx(\"span\", {\n    parentName: \"code\",\n    \"className\": \"token template-string\"\n  }, mdx(\"span\", {\n    parentName: \"span\",\n    \"className\": \"token template-punctuation string\"\n  }, \"`\"), mdx(\"span\", {\n    parentName: \"span\",\n    \"className\": \"token string\"\n  }, \"<warn label=\\\"ALERT!\\\"/> - this is a alert\"), mdx(\"span\", {\n    parentName: \"span\",\n    \"className\": \"token template-punctuation string\"\n  }, \"`\")), mdx(\"span\", {\n    parentName: \"code\",\n    \"className\": \"token punctuation\"\n  }, \";\"), \"\\n\", mdx(\"span\", {\n    parentName: \"code\",\n    \"className\": \"token punctuation\"\n  }, \"}\"), mdx(\"span\", {\n    parentName: \"code\",\n    \"className\": \"token punctuation\"\n  }, \")\"), mdx(\"span\", {\n    parentName: \"code\",\n    \"className\": \"token punctuation\"\n  }, \";\")))), mdx(\"h3\", {\n    \"id\": \"async-timer\",\n    \"style\": {\n      \"position\": \"relative\"\n    }\n  }, mdx(\"a\", {\n    parentName: \"h3\",\n    \"href\": \"#async-timer\",\n    \"aria-label\": \"async timer permalink\",\n    \"className\": \"anchor before\"\n  }, mdx(\"svg\", {\n    parentName: \"a\",\n    \"aria-hidden\": \"true\",\n    \"focusable\": \"false\",\n    \"height\": \"16\",\n    \"version\": \"1.1\",\n    \"viewBox\": \"0 0 16 16\",\n    \"width\": \"16\"\n  }, mdx(\"path\", {\n    parentName: \"svg\",\n    \"fillRule\": \"evenodd\",\n    \"d\": \"M4 9h1v1H4c-1.5 0-3-1.69-3-3.5S2.55 3 4 3h4c1.45 0 3 1.69 3 3.5 0 1.41-.91 2.72-2 3.25V8.59c.58-.45 1-1.27 1-2.09C10 5.22 8.98 4 8 4H4c-.98 0-2 1.22-2 2.5S3 9 4 9zm9-3h-1v1h1c1 0 2 1.22 2 2.5S13.98 12 13 12H9c-.98 0-2-1.22-2-2.5 0-.83.42-1.64 1-2.09V6.25c-1.09.53-2 1.84-2 3.25C6 11.31 7.55 13 9 13h4c1.45 0 3-1.69 3-3.5S14.5 6 13 6z\"\n  }))), \"Async Timer\"), mdx(\"p\", null, \"If you wanted to run a timer, you can do it in the \", mdx(\"code\", {\n    parentName: \"p\",\n    \"className\": \"language-text\"\n  }, \"init\"), \" function. \", mdx(\"strong\", {\n    parentName: \"p\"\n  }, \"init\"), \" function context will have,\"), mdx(\"ul\", null, mdx(\"li\", {\n    parentName: \"ul\"\n  }, mdx(\"strong\", {\n    parentName: \"li\"\n  }, \"store\"), \" - app level store object\"), mdx(\"li\", {\n    parentName: \"ul\"\n  }, mdx(\"strong\", {\n    parentName: \"li\"\n  }, \"props\"), \" - element attributes\"), mdx(\"li\", {\n    parentName: \"ul\"\n  }, mdx(\"strong\", {\n    parentName: \"li\"\n  }, \"timer\"), \" - \", mdx(\"code\", {\n    parentName: \"li\",\n    \"className\": \"language-text\"\n  }, \"setInterval\"), \" function\")), mdx(\"div\", {\n    \"className\": \"gatsby-highlight\",\n    \"data-language\": \"js\"\n  }, mdx(\"pre\", {\n    parentName: \"div\",\n    \"className\": \"language-js\"\n  }, mdx(\"code\", {\n    parentName: \"pre\",\n    \"className\": \"language-js\"\n  }, mdx(\"span\", {\n    parentName: \"code\",\n    \"className\": \"token keyword\"\n  }, \"import\"), \" Artist \", mdx(\"span\", {\n    parentName: \"code\",\n    \"className\": \"token keyword\"\n  }, \"from\"), \" \", mdx(\"span\", {\n    parentName: \"code\",\n    \"className\": \"token string\"\n  }, \"\\\"@lesy/artist\\\"\"), mdx(\"span\", {\n    parentName: \"code\",\n    \"className\": \"token punctuation\"\n  }, \";\"), \"\\n\", mdx(\"span\", {\n    parentName: \"code\",\n    \"className\": \"token keyword\"\n  }, \"const\"), \" \", mdx(\"span\", {\n    parentName: \"code\",\n    \"className\": \"token constant\"\n  }, \"UI\"), \" \", mdx(\"span\", {\n    parentName: \"code\",\n    \"className\": \"token operator\"\n  }, \"=\"), \" \", mdx(\"span\", {\n    parentName: \"code\",\n    \"className\": \"token keyword\"\n  }, \"new\"), \" \", mdx(\"span\", {\n    parentName: \"code\",\n    \"className\": \"token class-name\"\n  }, \"Artist\"), mdx(\"span\", {\n    parentName: \"code\",\n    \"className\": \"token punctuation\"\n  }, \"(\"), mdx(\"span\", {\n    parentName: \"code\",\n    \"className\": \"token punctuation\"\n  }, \")\"), mdx(\"span\", {\n    parentName: \"code\",\n    \"className\": \"token punctuation\"\n  }, \";\"), \"\\n\\n\", mdx(\"span\", {\n    parentName: \"code\",\n    \"className\": \"token keyword\"\n  }, \"const\"), \" Blink \", mdx(\"span\", {\n    parentName: \"code\",\n    \"className\": \"token operator\"\n  }, \"=\"), \" \", mdx(\"span\", {\n    parentName: \"code\",\n    \"className\": \"token punctuation\"\n  }, \"{\"), \"\\n  name\", mdx(\"span\", {\n    parentName: \"code\",\n    \"className\": \"token operator\"\n  }, \":\"), \" \", mdx(\"span\", {\n    parentName: \"code\",\n    \"className\": \"token string\"\n  }, \"\\\"blink\\\"\"), mdx(\"span\", {\n    parentName: \"code\",\n    \"className\": \"token punctuation\"\n  }, \",\"), \"\\n  \", mdx(\"span\", {\n    parentName: \"code\",\n    \"className\": \"token function-variable function\"\n  }, \"init\"), mdx(\"span\", {\n    parentName: \"code\",\n    \"className\": \"token operator\"\n  }, \":\"), \" \", mdx(\"span\", {\n    parentName: \"code\",\n    \"className\": \"token punctuation\"\n  }, \"(\"), mdx(\"span\", {\n    parentName: \"code\",\n    \"className\": \"token parameter\"\n  }, mdx(\"span\", {\n    parentName: \"span\",\n    \"className\": \"token punctuation\"\n  }, \"{\"), \" store\", mdx(\"span\", {\n    parentName: \"span\",\n    \"className\": \"token punctuation\"\n  }, \",\"), \" props\", mdx(\"span\", {\n    parentName: \"span\",\n    \"className\": \"token punctuation\"\n  }, \",\"), \" timer \", mdx(\"span\", {\n    parentName: \"span\",\n    \"className\": \"token punctuation\"\n  }, \"}\")), mdx(\"span\", {\n    parentName: \"code\",\n    \"className\": \"token punctuation\"\n  }, \")\"), \" \", mdx(\"span\", {\n    parentName: \"code\",\n    \"className\": \"token operator\"\n  }, \"=>\"), \" \", mdx(\"span\", {\n    parentName: \"code\",\n    \"className\": \"token punctuation\"\n  }, \"{\"), \"\\n    \", mdx(\"span\", {\n    parentName: \"code\",\n    \"className\": \"token keyword\"\n  }, \"if\"), \" \", mdx(\"span\", {\n    parentName: \"code\",\n    \"className\": \"token punctuation\"\n  }, \"(\"), mdx(\"span\", {\n    parentName: \"code\",\n    \"className\": \"token operator\"\n  }, \"!\"), \"store\", mdx(\"span\", {\n    parentName: \"code\",\n    \"className\": \"token punctuation\"\n  }, \".\"), \"active\", mdx(\"span\", {\n    parentName: \"code\",\n    \"className\": \"token punctuation\"\n  }, \")\"), \" store\", mdx(\"span\", {\n    parentName: \"code\",\n    \"className\": \"token punctuation\"\n  }, \".\"), \"active \", mdx(\"span\", {\n    parentName: \"code\",\n    \"className\": \"token operator\"\n  }, \"=\"), \" \", mdx(\"span\", {\n    parentName: \"code\",\n    \"className\": \"token boolean\"\n  }, \"false\"), mdx(\"span\", {\n    parentName: \"code\",\n    \"className\": \"token punctuation\"\n  }, \";\"), \"\\n    \", mdx(\"span\", {\n    parentName: \"code\",\n    \"className\": \"token function\"\n  }, \"timer\"), mdx(\"span\", {\n    parentName: \"code\",\n    \"className\": \"token punctuation\"\n  }, \"(\"), mdx(\"span\", {\n    parentName: \"code\",\n    \"className\": \"token punctuation\"\n  }, \"(\"), mdx(\"span\", {\n    parentName: \"code\",\n    \"className\": \"token punctuation\"\n  }, \")\"), \" \", mdx(\"span\", {\n    parentName: \"code\",\n    \"className\": \"token operator\"\n  }, \"=>\"), \" \", mdx(\"span\", {\n    parentName: \"code\",\n    \"className\": \"token punctuation\"\n  }, \"(\"), \"store\", mdx(\"span\", {\n    parentName: \"code\",\n    \"className\": \"token punctuation\"\n  }, \".\"), \"active \", mdx(\"span\", {\n    parentName: \"code\",\n    \"className\": \"token operator\"\n  }, \"=\"), \" \", mdx(\"span\", {\n    parentName: \"code\",\n    \"className\": \"token operator\"\n  }, \"!\"), \"store\", mdx(\"span\", {\n    parentName: \"code\",\n    \"className\": \"token punctuation\"\n  }, \".\"), \"active\", mdx(\"span\", {\n    parentName: \"code\",\n    \"className\": \"token punctuation\"\n  }, \")\"), mdx(\"span\", {\n    parentName: \"code\",\n    \"className\": \"token punctuation\"\n  }, \",\"), \" \", mdx(\"span\", {\n    parentName: \"code\",\n    \"className\": \"token number\"\n  }, \"1000\"), mdx(\"span\", {\n    parentName: \"code\",\n    \"className\": \"token punctuation\"\n  }, \",\"), \" \", mdx(\"span\", {\n    parentName: \"code\",\n    \"className\": \"token string\"\n  }, \"\\\"unique-key\\\"\"), mdx(\"span\", {\n    parentName: \"code\",\n    \"className\": \"token punctuation\"\n  }, \")\"), mdx(\"span\", {\n    parentName: \"code\",\n    \"className\": \"token punctuation\"\n  }, \";\"), \"\\n  \", mdx(\"span\", {\n    parentName: \"code\",\n    \"className\": \"token punctuation\"\n  }, \"}\"), mdx(\"span\", {\n    parentName: \"code\",\n    \"className\": \"token punctuation\"\n  }, \",\"), \"\\n  \", mdx(\"span\", {\n    parentName: \"code\",\n    \"className\": \"token function-variable function\"\n  }, \"render\"), mdx(\"span\", {\n    parentName: \"code\",\n    \"className\": \"token operator\"\n  }, \":\"), \" \", mdx(\"span\", {\n    parentName: \"code\",\n    \"className\": \"token parameter\"\n  }, \"ctx\"), \" \", mdx(\"span\", {\n    parentName: \"code\",\n    \"className\": \"token operator\"\n  }, \"=>\"), \" \", mdx(\"span\", {\n    parentName: \"code\",\n    \"className\": \"token template-string\"\n  }, mdx(\"span\", {\n    parentName: \"span\",\n    \"className\": \"token template-punctuation string\"\n  }, \"`\"), mdx(\"span\", {\n    parentName: \"span\",\n    \"className\": \"token interpolation\"\n  }, mdx(\"span\", {\n    parentName: \"span\",\n    \"className\": \"token interpolation-punctuation punctuation\"\n  }, \"${\"), \"ctx\", mdx(\"span\", {\n    parentName: \"span\",\n    \"className\": \"token punctuation\"\n  }, \".\"), \"store\", mdx(\"span\", {\n    parentName: \"span\",\n    \"className\": \"token punctuation\"\n  }, \".\"), \"active \", mdx(\"span\", {\n    parentName: \"span\",\n    \"className\": \"token operator\"\n  }, \"?\"), \" \", mdx(\"span\", {\n    parentName: \"span\",\n    \"className\": \"token string\"\n  }, \"\\\"+\\\"\"), \" \", mdx(\"span\", {\n    parentName: \"span\",\n    \"className\": \"token operator\"\n  }, \":\"), \" \", mdx(\"span\", {\n    parentName: \"span\",\n    \"className\": \"token string\"\n  }, \"\\\"-\\\"\"), mdx(\"span\", {\n    parentName: \"span\",\n    \"className\": \"token interpolation-punctuation punctuation\"\n  }, \"}\")), mdx(\"span\", {\n    parentName: \"span\",\n    \"className\": \"token template-punctuation string\"\n  }, \"`\")), mdx(\"span\", {\n    parentName: \"code\",\n    \"className\": \"token punctuation\"\n  }, \",\"), \"\\n\", mdx(\"span\", {\n    parentName: \"code\",\n    \"className\": \"token punctuation\"\n  }, \"}\"), mdx(\"span\", {\n    parentName: \"code\",\n    \"className\": \"token punctuation\"\n  }, \";\"), \"\\n\\n\", mdx(\"span\", {\n    parentName: \"code\",\n    \"className\": \"token constant\"\n  }, \"UI\"), mdx(\"span\", {\n    parentName: \"code\",\n    \"className\": \"token punctuation\"\n  }, \".\"), mdx(\"span\", {\n    parentName: \"code\",\n    \"className\": \"token function\"\n  }, \"registerEls\"), mdx(\"span\", {\n    parentName: \"code\",\n    \"className\": \"token punctuation\"\n  }, \"(\"), mdx(\"span\", {\n    parentName: \"code\",\n    \"className\": \"token punctuation\"\n  }, \"{\"), \" Blink \", mdx(\"span\", {\n    parentName: \"code\",\n    \"className\": \"token punctuation\"\n  }, \"}\"), mdx(\"span\", {\n    parentName: \"code\",\n    \"className\": \"token punctuation\"\n  }, \")\"), mdx(\"span\", {\n    parentName: \"code\",\n    \"className\": \"token punctuation\"\n  }, \";\"), \"\\n\\n\", mdx(\"span\", {\n    parentName: \"code\",\n    \"className\": \"token constant\"\n  }, \"UI\"), mdx(\"span\", {\n    parentName: \"code\",\n    \"className\": \"token punctuation\"\n  }, \".\"), mdx(\"span\", {\n    parentName: \"code\",\n    \"className\": \"token function\"\n  }, \"render\"), mdx(\"span\", {\n    parentName: \"code\",\n    \"className\": \"token punctuation\"\n  }, \"(\"), mdx(\"span\", {\n    parentName: \"code\",\n    \"className\": \"token punctuation\"\n  }, \"(\"), mdx(\"span\", {\n    parentName: \"code\",\n    \"className\": \"token punctuation\"\n  }, \")\"), \" \", mdx(\"span\", {\n    parentName: \"code\",\n    \"className\": \"token operator\"\n  }, \"=>\"), \" \", mdx(\"span\", {\n    parentName: \"code\",\n    \"className\": \"token punctuation\"\n  }, \"{\"), \"\\n  \", mdx(\"span\", {\n    parentName: \"code\",\n    \"className\": \"token keyword\"\n  }, \"return\"), \" \", mdx(\"span\", {\n    parentName: \"code\",\n    \"className\": \"token template-string\"\n  }, mdx(\"span\", {\n    parentName: \"span\",\n    \"className\": \"token template-punctuation string\"\n  }, \"`\"), mdx(\"span\", {\n    parentName: \"span\",\n    \"className\": \"token string\"\n  }, \"<blink/> - is blinking\"), mdx(\"span\", {\n    parentName: \"span\",\n    \"className\": \"token template-punctuation string\"\n  }, \"`\")), mdx(\"span\", {\n    parentName: \"code\",\n    \"className\": \"token punctuation\"\n  }, \";\"), \"\\n\", mdx(\"span\", {\n    parentName: \"code\",\n    \"className\": \"token punctuation\"\n  }, \"}\"), mdx(\"span\", {\n    parentName: \"code\",\n    \"className\": \"token punctuation\"\n  }, \")\"), mdx(\"span\", {\n    parentName: \"code\",\n    \"className\": \"token punctuation\"\n  }, \";\")))), mdx(\"h3\", {\n    \"id\": \"context-and-props\",\n    \"style\": {\n      \"position\": \"relative\"\n    }\n  }, mdx(\"a\", {\n    parentName: \"h3\",\n    \"href\": \"#context-and-props\",\n    \"aria-label\": \"context and props permalink\",\n    \"className\": \"anchor before\"\n  }, mdx(\"svg\", {\n    parentName: \"a\",\n    \"aria-hidden\": \"true\",\n    \"focusable\": \"false\",\n    \"height\": \"16\",\n    \"version\": \"1.1\",\n    \"viewBox\": \"0 0 16 16\",\n    \"width\": \"16\"\n  }, mdx(\"path\", {\n    parentName: \"svg\",\n    \"fillRule\": \"evenodd\",\n    \"d\": \"M4 9h1v1H4c-1.5 0-3-1.69-3-3.5S2.55 3 4 3h4c1.45 0 3 1.69 3 3.5 0 1.41-.91 2.72-2 3.25V8.59c.58-.45 1-1.27 1-2.09C10 5.22 8.98 4 8 4H4c-.98 0-2 1.22-2 2.5S3 9 4 9zm9-3h-1v1h1c1 0 2 1.22 2 2.5S13.98 12 13 12H9c-.98 0-2-1.22-2-2.5 0-.83.42-1.64 1-2.09V6.25c-1.09.53-2 1.84-2 3.25C6 11.31 7.55 13 9 13h4c1.45 0 3-1.69 3-3.5S14.5 6 13 6z\"\n  }))), \"Context and props\"), mdx(\"div\", {\n    \"className\": \"gatsby-highlight\",\n    \"data-language\": \"js\"\n  }, mdx(\"pre\", {\n    parentName: \"div\",\n    \"className\": \"language-js\"\n  }, mdx(\"code\", {\n    parentName: \"pre\",\n    \"className\": \"language-js\"\n  }, mdx(\"span\", {\n    parentName: \"code\",\n    \"className\": \"token keyword\"\n  }, \"import\"), \" Artist \", mdx(\"span\", {\n    parentName: \"code\",\n    \"className\": \"token keyword\"\n  }, \"from\"), \" \", mdx(\"span\", {\n    parentName: \"code\",\n    \"className\": \"token string\"\n  }, \"\\\"@lesy/artist\\\"\"), mdx(\"span\", {\n    parentName: \"code\",\n    \"className\": \"token punctuation\"\n  }, \";\"), \"\\n\", mdx(\"span\", {\n    parentName: \"code\",\n    \"className\": \"token keyword\"\n  }, \"const\"), \" \", mdx(\"span\", {\n    parentName: \"code\",\n    \"className\": \"token constant\"\n  }, \"UI\"), \" \", mdx(\"span\", {\n    parentName: \"code\",\n    \"className\": \"token operator\"\n  }, \"=\"), \" \", mdx(\"span\", {\n    parentName: \"code\",\n    \"className\": \"token keyword\"\n  }, \"new\"), \" \", mdx(\"span\", {\n    parentName: \"code\",\n    \"className\": \"token class-name\"\n  }, \"Artist\"), mdx(\"span\", {\n    parentName: \"code\",\n    \"className\": \"token punctuation\"\n  }, \"(\"), mdx(\"span\", {\n    parentName: \"code\",\n    \"className\": \"token punctuation\"\n  }, \")\"), mdx(\"span\", {\n    parentName: \"code\",\n    \"className\": \"token punctuation\"\n  }, \";\"), \"\\n\\n\", mdx(\"span\", {\n    parentName: \"code\",\n    \"className\": \"token keyword\"\n  }, \"const\"), \" Alert \", mdx(\"span\", {\n    parentName: \"code\",\n    \"className\": \"token operator\"\n  }, \"=\"), \" \", mdx(\"span\", {\n    parentName: \"code\",\n    \"className\": \"token punctuation\"\n  }, \"{\"), \"\\n  name\", mdx(\"span\", {\n    parentName: \"code\",\n    \"className\": \"token operator\"\n  }, \":\"), \" \", mdx(\"span\", {\n    parentName: \"code\",\n    \"className\": \"token string\"\n  }, \"\\\"alert\\\"\"), mdx(\"span\", {\n    parentName: \"code\",\n    \"className\": \"token punctuation\"\n  }, \",\"), \"\\n  \", mdx(\"span\", {\n    parentName: \"code\",\n    \"className\": \"token function-variable function\"\n  }, \"render\"), mdx(\"span\", {\n    parentName: \"code\",\n    \"className\": \"token operator\"\n  }, \":\"), \" \", mdx(\"span\", {\n    parentName: \"code\",\n    \"className\": \"token parameter\"\n  }, \"ctx\"), \" \", mdx(\"span\", {\n    parentName: \"code\",\n    \"className\": \"token operator\"\n  }, \"=>\"), \" \", mdx(\"span\", {\n    parentName: \"code\",\n    \"className\": \"token template-string\"\n  }, mdx(\"span\", {\n    parentName: \"span\",\n    \"className\": \"token template-punctuation string\"\n  }, \"`\"), mdx(\"span\", {\n    parentName: \"span\",\n    \"className\": \"token string\"\n  }, \"<text>\"), mdx(\"span\", {\n    parentName: \"span\",\n    \"className\": \"token interpolation\"\n  }, mdx(\"span\", {\n    parentName: \"span\",\n    \"className\": \"token interpolation-punctuation punctuation\"\n  }, \"${\"), \"ctx\", mdx(\"span\", {\n    parentName: \"span\",\n    \"className\": \"token punctuation\"\n  }, \".\"), \"props\", mdx(\"span\", {\n    parentName: \"span\",\n    \"className\": \"token punctuation\"\n  }, \".\"), \"message\", mdx(\"span\", {\n    parentName: \"span\",\n    \"className\": \"token interpolation-punctuation punctuation\"\n  }, \"}\")), mdx(\"span\", {\n    parentName: \"span\",\n    \"className\": \"token string\"\n  }, \"</text>\"), mdx(\"span\", {\n    parentName: \"span\",\n    \"className\": \"token template-punctuation string\"\n  }, \"`\")), mdx(\"span\", {\n    parentName: \"code\",\n    \"className\": \"token punctuation\"\n  }, \",\"), \"\\n\", mdx(\"span\", {\n    parentName: \"code\",\n    \"className\": \"token punctuation\"\n  }, \"}\"), mdx(\"span\", {\n    parentName: \"code\",\n    \"className\": \"token punctuation\"\n  }, \";\"), \"\\n\", mdx(\"span\", {\n    parentName: \"code\",\n    \"className\": \"token keyword\"\n  }, \"const\"), \" Info \", mdx(\"span\", {\n    parentName: \"code\",\n    \"className\": \"token operator\"\n  }, \"=\"), \" \", mdx(\"span\", {\n    parentName: \"code\",\n    \"className\": \"token punctuation\"\n  }, \"{\"), \"\\n  name\", mdx(\"span\", {\n    parentName: \"code\",\n    \"className\": \"token operator\"\n  }, \":\"), \" \", mdx(\"span\", {\n    parentName: \"code\",\n    \"className\": \"token string\"\n  }, \"\\\"info\\\"\"), mdx(\"span\", {\n    parentName: \"code\",\n    \"className\": \"token punctuation\"\n  }, \",\"), \"\\n  \", mdx(\"span\", {\n    parentName: \"code\",\n    \"className\": \"token function-variable function\"\n  }, \"render\"), mdx(\"span\", {\n    parentName: \"code\",\n    \"className\": \"token operator\"\n  }, \":\"), \" \", mdx(\"span\", {\n    parentName: \"code\",\n    \"className\": \"token punctuation\"\n  }, \"(\"), mdx(\"span\", {\n    parentName: \"code\",\n    \"className\": \"token parameter\"\n  }, \"ctx\", mdx(\"span\", {\n    parentName: \"span\",\n    \"className\": \"token punctuation\"\n  }, \",\"), \" data\"), mdx(\"span\", {\n    parentName: \"code\",\n    \"className\": \"token punctuation\"\n  }, \")\"), \" \", mdx(\"span\", {\n    parentName: \"code\",\n    \"className\": \"token operator\"\n  }, \"=>\"), \" \", mdx(\"span\", {\n    parentName: \"code\",\n    \"className\": \"token punctuation\"\n  }, \"{\"), \"\\n    \", mdx(\"span\", {\n    parentName: \"code\",\n    \"className\": \"token keyword\"\n  }, \"return\"), \" ctx\", mdx(\"span\", {\n    parentName: \"code\",\n    \"className\": \"token punctuation\"\n  }, \".\"), mdx(\"span\", {\n    parentName: \"code\",\n    \"className\": \"token function\"\n  }, \"renderEl\"), mdx(\"span\", {\n    parentName: \"code\",\n    \"className\": \"token punctuation\"\n  }, \"(\"), \"data\", mdx(\"span\", {\n    parentName: \"code\",\n    \"className\": \"token punctuation\"\n  }, \".\"), \"children\", mdx(\"span\", {\n    parentName: \"code\",\n    \"className\": \"token punctuation\"\n  }, \")\"), mdx(\"span\", {\n    parentName: \"code\",\n    \"className\": \"token punctuation\"\n  }, \";\"), \"\\n  \", mdx(\"span\", {\n    parentName: \"code\",\n    \"className\": \"token punctuation\"\n  }, \"}\"), mdx(\"span\", {\n    parentName: \"code\",\n    \"className\": \"token punctuation\"\n  }, \",\"), \"\\n\", mdx(\"span\", {\n    parentName: \"code\",\n    \"className\": \"token punctuation\"\n  }, \"}\"), mdx(\"span\", {\n    parentName: \"code\",\n    \"className\": \"token punctuation\"\n  }, \";\"), \"\\n\", mdx(\"span\", {\n    parentName: \"code\",\n    \"className\": \"token constant\"\n  }, \"UI\"), mdx(\"span\", {\n    parentName: \"code\",\n    \"className\": \"token punctuation\"\n  }, \".\"), mdx(\"span\", {\n    parentName: \"code\",\n    \"className\": \"token function\"\n  }, \"registerEls\"), mdx(\"span\", {\n    parentName: \"code\",\n    \"className\": \"token punctuation\"\n  }, \"(\"), mdx(\"span\", {\n    parentName: \"code\",\n    \"className\": \"token punctuation\"\n  }, \"{\"), \" Alert\", mdx(\"span\", {\n    parentName: \"code\",\n    \"className\": \"token punctuation\"\n  }, \",\"), \" Info \", mdx(\"span\", {\n    parentName: \"code\",\n    \"className\": \"token punctuation\"\n  }, \"}\"), mdx(\"span\", {\n    parentName: \"code\",\n    \"className\": \"token punctuation\"\n  }, \")\"), mdx(\"span\", {\n    parentName: \"code\",\n    \"className\": \"token punctuation\"\n  }, \";\"), \"\\n\\n\", mdx(\"span\", {\n    parentName: \"code\",\n    \"className\": \"token constant\"\n  }, \"UI\"), mdx(\"span\", {\n    parentName: \"code\",\n    \"className\": \"token punctuation\"\n  }, \".\"), mdx(\"span\", {\n    parentName: \"code\",\n    \"className\": \"token function\"\n  }, \"render\"), mdx(\"span\", {\n    parentName: \"code\",\n    \"className\": \"token punctuation\"\n  }, \"(\"), mdx(\"span\", {\n    parentName: \"code\",\n    \"className\": \"token punctuation\"\n  }, \"(\"), mdx(\"span\", {\n    parentName: \"code\",\n    \"className\": \"token punctuation\"\n  }, \")\"), \" \", mdx(\"span\", {\n    parentName: \"code\",\n    \"className\": \"token operator\"\n  }, \"=>\"), \" \", mdx(\"span\", {\n    parentName: \"code\",\n    \"className\": \"token punctuation\"\n  }, \"{\"), \"\\n  \", mdx(\"span\", {\n    parentName: \"code\",\n    \"className\": \"token keyword\"\n  }, \"return\"), \" \", mdx(\"span\", {\n    parentName: \"code\",\n    \"className\": \"token template-string\"\n  }, mdx(\"span\", {\n    parentName: \"span\",\n    \"className\": \"token template-punctuation string\"\n  }, \"`\"), mdx(\"span\", {\n    parentName: \"span\",\n    \"className\": \"token string\"\n  }, \"<div>\\n    <alert message=\\\"This is a alert\\\"/>\\n    <info>This is an info</info>\\n    <info>\\n        <text color=\\\"blue\\\">This is an info</text>\\n    </info>\\n</div>\"), mdx(\"span\", {\n    parentName: \"span\",\n    \"className\": \"token template-punctuation string\"\n  }, \"`\")), mdx(\"span\", {\n    parentName: \"code\",\n    \"className\": \"token punctuation\"\n  }, \";\"), \"\\n\", mdx(\"span\", {\n    parentName: \"code\",\n    \"className\": \"token punctuation\"\n  }, \"}\"), mdx(\"span\", {\n    parentName: \"code\",\n    \"className\": \"token punctuation\"\n  }, \")\"), mdx(\"span\", {\n    parentName: \"code\",\n    \"className\": \"token punctuation\"\n  }, \";\")))), mdx(\"h2\", {\n    \"id\": \"config\",\n    \"style\": {\n      \"position\": \"relative\"\n    }\n  }, mdx(\"a\", {\n    parentName: \"h2\",\n    \"href\": \"#config\",\n    \"aria-label\": \"config permalink\",\n    \"className\": \"anchor before\"\n  }, mdx(\"svg\", {\n    parentName: \"a\",\n    \"aria-hidden\": \"true\",\n    \"focusable\": \"false\",\n    \"height\": \"16\",\n    \"version\": \"1.1\",\n    \"viewBox\": \"0 0 16 16\",\n    \"width\": \"16\"\n  }, mdx(\"path\", {\n    parentName: \"svg\",\n    \"fillRule\": \"evenodd\",\n    \"d\": \"M4 9h1v1H4c-1.5 0-3-1.69-3-3.5S2.55 3 4 3h4c1.45 0 3 1.69 3 3.5 0 1.41-.91 2.72-2 3.25V8.59c.58-.45 1-1.27 1-2.09C10 5.22 8.98 4 8 4H4c-.98 0-2 1.22-2 2.5S3 9 4 9zm9-3h-1v1h1c1 0 2 1.22 2 2.5S13.98 12 13 12H9c-.98 0-2-1.22-2-2.5 0-.83.42-1.64 1-2.09V6.25c-1.09.53-2 1.84-2 3.25C6 11.31 7.55 13 9 13h4c1.45 0 3-1.69 3-3.5S14.5 6 13 6z\"\n  }))), \"Config\"), mdx(\"div\", {\n    \"className\": \"gatsby-highlight\",\n    \"data-language\": \"js\"\n  }, mdx(\"pre\", {\n    parentName: \"div\",\n    \"className\": \"language-js\"\n  }, mdx(\"code\", {\n    parentName: \"pre\",\n    \"className\": \"language-js\"\n  }, mdx(\"span\", {\n    parentName: \"code\",\n    \"className\": \"token keyword\"\n  }, \"import\"), \" Artist \", mdx(\"span\", {\n    parentName: \"code\",\n    \"className\": \"token keyword\"\n  }, \"from\"), \" \", mdx(\"span\", {\n    parentName: \"code\",\n    \"className\": \"token string\"\n  }, \"\\\"@lesy/artist\\\"\"), mdx(\"span\", {\n    parentName: \"code\",\n    \"className\": \"token punctuation\"\n  }, \";\"), \"\\n\\n\", mdx(\"span\", {\n    parentName: \"code\",\n    \"className\": \"token keyword\"\n  }, \"const\"), \" \", mdx(\"span\", {\n    parentName: \"code\",\n    \"className\": \"token constant\"\n  }, \"UI\"), \" \", mdx(\"span\", {\n    parentName: \"code\",\n    \"className\": \"token operator\"\n  }, \"=\"), \" \", mdx(\"span\", {\n    parentName: \"code\",\n    \"className\": \"token keyword\"\n  }, \"new\"), \" \", mdx(\"span\", {\n    parentName: \"code\",\n    \"className\": \"token class-name\"\n  }, \"Artist\"), mdx(\"span\", {\n    parentName: \"code\",\n    \"className\": \"token punctuation\"\n  }, \"(\"), mdx(\"span\", {\n    parentName: \"code\",\n    \"className\": \"token punctuation\"\n  }, \"{\"), \"\\n  collapseWhitespace\", mdx(\"span\", {\n    parentName: \"code\",\n    \"className\": \"token operator\"\n  }, \":\"), \" \", mdx(\"span\", {\n    parentName: \"code\",\n    \"className\": \"token boolean\"\n  }, \"false\"), mdx(\"span\", {\n    parentName: \"code\",\n    \"className\": \"token punctuation\"\n  }, \",\"), \"\\n  keepClosingSlash\", mdx(\"span\", {\n    parentName: \"code\",\n    \"className\": \"token operator\"\n  }, \":\"), \" \", mdx(\"span\", {\n    parentName: \"code\",\n    \"className\": \"token boolean\"\n  }, \"true\"), mdx(\"span\", {\n    parentName: \"code\",\n    \"className\": \"token punctuation\"\n  }, \",\"), \"\\n  preserveLineBreaks\", mdx(\"span\", {\n    parentName: \"code\",\n    \"className\": \"token operator\"\n  }, \":\"), \" \", mdx(\"span\", {\n    parentName: \"code\",\n    \"className\": \"token boolean\"\n  }, \"false\"), mdx(\"span\", {\n    parentName: \"code\",\n    \"className\": \"token punctuation\"\n  }, \",\"), \"\\n\", mdx(\"span\", {\n    parentName: \"code\",\n    \"className\": \"token punctuation\"\n  }, \"}\"), mdx(\"span\", {\n    parentName: \"code\",\n    \"className\": \"token punctuation\"\n  }, \")\"), mdx(\"span\", {\n    parentName: \"code\",\n    \"className\": \"token punctuation\"\n  }, \";\"), \"\\n\\n\", mdx(\"span\", {\n    parentName: \"code\",\n    \"className\": \"token constant\"\n  }, \"UI\"), mdx(\"span\", {\n    parentName: \"code\",\n    \"className\": \"token punctuation\"\n  }, \".\"), mdx(\"span\", {\n    parentName: \"code\",\n    \"className\": \"token function\"\n  }, \"render\"), mdx(\"span\", {\n    parentName: \"code\",\n    \"className\": \"token punctuation\"\n  }, \"(\"), mdx(\"span\", {\n    parentName: \"code\",\n    \"className\": \"token punctuation\"\n  }, \"(\"), mdx(\"span\", {\n    parentName: \"code\",\n    \"className\": \"token punctuation\"\n  }, \")\"), \" \", mdx(\"span\", {\n    parentName: \"code\",\n    \"className\": \"token operator\"\n  }, \"=>\"), \" \", mdx(\"span\", {\n    parentName: \"code\",\n    \"className\": \"token punctuation\"\n  }, \"{\"), \"\\n  \", mdx(\"span\", {\n    parentName: \"code\",\n    \"className\": \"token keyword\"\n  }, \"return\"), \" \", mdx(\"span\", {\n    parentName: \"code\",\n    \"className\": \"token template-string\"\n  }, mdx(\"span\", {\n    parentName: \"span\",\n    \"className\": \"token template-punctuation string\"\n  }, \"`\"), mdx(\"span\", {\n    parentName: \"span\",\n    \"className\": \"token string\"\n  }, \"<div>\\n    <span>Name:</span>\\n    <span>Artist</span>\\n  </div>\"), mdx(\"span\", {\n    parentName: \"span\",\n    \"className\": \"token template-punctuation string\"\n  }, \"`\")), mdx(\"span\", {\n    parentName: \"code\",\n    \"className\": \"token punctuation\"\n  }, \";\"), \"\\n\", mdx(\"span\", {\n    parentName: \"code\",\n    \"className\": \"token punctuation\"\n  }, \"}\"), mdx(\"span\", {\n    parentName: \"code\",\n    \"className\": \"token punctuation\"\n  }, \")\"), mdx(\"span\", {\n    parentName: \"code\",\n    \"className\": \"token punctuation\"\n  }, \";\")))), mdx(\"h2\", {\n    \"id\": \"templating\",\n    \"style\": {\n      \"position\": \"relative\"\n    }\n  }, mdx(\"a\", {\n    parentName: \"h2\",\n    \"href\": \"#templating\",\n    \"aria-label\": \"templating permalink\",\n    \"className\": \"anchor before\"\n  }, mdx(\"svg\", {\n    parentName: \"a\",\n    \"aria-hidden\": \"true\",\n    \"focusable\": \"false\",\n    \"height\": \"16\",\n    \"version\": \"1.1\",\n    \"viewBox\": \"0 0 16 16\",\n    \"width\": \"16\"\n  }, mdx(\"path\", {\n    parentName: \"svg\",\n    \"fillRule\": \"evenodd\",\n    \"d\": \"M4 9h1v1H4c-1.5 0-3-1.69-3-3.5S2.55 3 4 3h4c1.45 0 3 1.69 3 3.5 0 1.41-.91 2.72-2 3.25V8.59c.58-.45 1-1.27 1-2.09C10 5.22 8.98 4 8 4H4c-.98 0-2 1.22-2 2.5S3 9 4 9zm9-3h-1v1h1c1 0 2 1.22 2 2.5S13.98 12 13 12H9c-.98 0-2-1.22-2-2.5 0-.83.42-1.64 1-2.09V6.25c-1.09.53-2 1.84-2 3.25C6 11.31 7.55 13 9 13h4c1.45 0 3-1.69 3-3.5S14.5 6 13 6z\"\n  }))), \"Templating\"), mdx(\"div\", {\n    \"className\": \"gatsby-highlight\",\n    \"data-language\": \"js\"\n  }, mdx(\"pre\", {\n    parentName: \"div\",\n    \"className\": \"language-js\"\n  }, mdx(\"code\", {\n    parentName: \"pre\",\n    \"className\": \"language-js\"\n  }, mdx(\"span\", {\n    parentName: \"code\",\n    \"className\": \"token keyword\"\n  }, \"import\"), \" Artist \", mdx(\"span\", {\n    parentName: \"code\",\n    \"className\": \"token keyword\"\n  }, \"from\"), \" \", mdx(\"span\", {\n    parentName: \"code\",\n    \"className\": \"token string\"\n  }, \"\\\"@lesy/artist\\\"\"), mdx(\"span\", {\n    parentName: \"code\",\n    \"className\": \"token punctuation\"\n  }, \";\"), \"\\n\", mdx(\"span\", {\n    parentName: \"code\",\n    \"className\": \"token keyword\"\n  }, \"const\"), \" \", mdx(\"span\", {\n    parentName: \"code\",\n    \"className\": \"token constant\"\n  }, \"UI\"), \" \", mdx(\"span\", {\n    parentName: \"code\",\n    \"className\": \"token operator\"\n  }, \"=\"), \" \", mdx(\"span\", {\n    parentName: \"code\",\n    \"className\": \"token keyword\"\n  }, \"new\"), \" \", mdx(\"span\", {\n    parentName: \"code\",\n    \"className\": \"token class-name\"\n  }, \"Artist\"), mdx(\"span\", {\n    parentName: \"code\",\n    \"className\": \"token punctuation\"\n  }, \"(\"), mdx(\"span\", {\n    parentName: \"code\",\n    \"className\": \"token punctuation\"\n  }, \")\"), mdx(\"span\", {\n    parentName: \"code\",\n    \"className\": \"token punctuation\"\n  }, \";\"), \"\\n\\n\", mdx(\"span\", {\n    parentName: \"code\",\n    \"className\": \"token constant\"\n  }, \"UI\"), mdx(\"span\", {\n    parentName: \"code\",\n    \"className\": \"token punctuation\"\n  }, \".\"), mdx(\"span\", {\n    parentName: \"code\",\n    \"className\": \"token function\"\n  }, \"render\"), mdx(\"span\", {\n    parentName: \"code\",\n    \"className\": \"token punctuation\"\n  }, \"(\"), mdx(\"span\", {\n    parentName: \"code\",\n    \"className\": \"token punctuation\"\n  }, \"(\"), mdx(\"span\", {\n    parentName: \"code\",\n    \"className\": \"token punctuation\"\n  }, \")\"), \" \", mdx(\"span\", {\n    parentName: \"code\",\n    \"className\": \"token operator\"\n  }, \"=>\"), \" \", mdx(\"span\", {\n    parentName: \"code\",\n    \"className\": \"token punctuation\"\n  }, \"{\"), \"\\n  \", mdx(\"span\", {\n    parentName: \"code\",\n    \"className\": \"token keyword\"\n  }, \"const\"), \" person \", mdx(\"span\", {\n    parentName: \"code\",\n    \"className\": \"token operator\"\n  }, \"=\"), \" \", mdx(\"span\", {\n    parentName: \"code\",\n    \"className\": \"token punctuation\"\n  }, \"{\"), \"\\n    name\", mdx(\"span\", {\n    parentName: \"code\",\n    \"className\": \"token operator\"\n  }, \":\"), \" \", mdx(\"span\", {\n    parentName: \"code\",\n    \"className\": \"token string\"\n  }, \"\\\"Monica\\\"\"), mdx(\"span\", {\n    parentName: \"code\",\n    \"className\": \"token punctuation\"\n  }, \",\"), \"\\n    work\", mdx(\"span\", {\n    parentName: \"code\",\n    \"className\": \"token operator\"\n  }, \":\"), \" \", mdx(\"span\", {\n    parentName: \"code\",\n    \"className\": \"token string\"\n  }, \"\\\"Pilot\\\"\"), mdx(\"span\", {\n    parentName: \"code\",\n    \"className\": \"token punctuation\"\n  }, \",\"), \"\\n  \", mdx(\"span\", {\n    parentName: \"code\",\n    \"className\": \"token punctuation\"\n  }, \"}\"), mdx(\"span\", {\n    parentName: \"code\",\n    \"className\": \"token punctuation\"\n  }, \";\"), \"\\n  \", mdx(\"span\", {\n    parentName: \"code\",\n    \"className\": \"token keyword\"\n  }, \"const\"), \" labelEl \", mdx(\"span\", {\n    parentName: \"code\",\n    \"className\": \"token operator\"\n  }, \"=\"), \" \", mdx(\"span\", {\n    parentName: \"code\",\n    \"className\": \"token template-string\"\n  }, mdx(\"span\", {\n    parentName: \"span\",\n    \"className\": \"token template-punctuation string\"\n  }, \"`\"), mdx(\"span\", {\n    parentName: \"span\",\n    \"className\": \"token string\"\n  }, \"<text>Label</text>\"), mdx(\"span\", {\n    parentName: \"span\",\n    \"className\": \"token template-punctuation string\"\n  }, \"`\")), mdx(\"span\", {\n    parentName: \"code\",\n    \"className\": \"token punctuation\"\n  }, \";\"), \"\\n  \", mdx(\"span\", {\n    parentName: \"code\",\n    \"className\": \"token keyword\"\n  }, \"return\"), \" \", mdx(\"span\", {\n    parentName: \"code\",\n    \"className\": \"token template-string\"\n  }, mdx(\"span\", {\n    parentName: \"span\",\n    \"className\": \"token template-punctuation string\"\n  }, \"`\"), mdx(\"span\", {\n    parentName: \"span\",\n    \"className\": \"token string\"\n  }, \"<div>\"), mdx(\"span\", {\n    parentName: \"span\",\n    \"className\": \"token interpolation\"\n  }, mdx(\"span\", {\n    parentName: \"span\",\n    \"className\": \"token interpolation-punctuation punctuation\"\n  }, \"${\"), \"labelEl\", mdx(\"span\", {\n    parentName: \"span\",\n    \"className\": \"token interpolation-punctuation punctuation\"\n  }, \"}\")), mdx(\"span\", {\n    parentName: \"span\",\n    \"className\": \"token string\"\n  }, \": \"), mdx(\"span\", {\n    parentName: \"span\",\n    \"className\": \"token interpolation\"\n  }, mdx(\"span\", {\n    parentName: \"span\",\n    \"className\": \"token interpolation-punctuation punctuation\"\n  }, \"${\"), \"person\", mdx(\"span\", {\n    parentName: \"span\",\n    \"className\": \"token punctuation\"\n  }, \".\"), \"name\", mdx(\"span\", {\n    parentName: \"span\",\n    \"className\": \"token interpolation-punctuation punctuation\"\n  }, \"}\")), mdx(\"span\", {\n    parentName: \"span\",\n    \"className\": \"token string\"\n  }, \"</div>\"), mdx(\"span\", {\n    parentName: \"span\",\n    \"className\": \"token template-punctuation string\"\n  }, \"`\")), mdx(\"span\", {\n    parentName: \"code\",\n    \"className\": \"token punctuation\"\n  }, \";\"), \"\\n\", mdx(\"span\", {\n    parentName: \"code\",\n    \"className\": \"token punctuation\"\n  }, \"}\"), mdx(\"span\", {\n    parentName: \"code\",\n    \"className\": \"token punctuation\"\n  }, \")\"), mdx(\"span\", {\n    parentName: \"code\",\n    \"className\": \"token punctuation\"\n  }, \";\")))), mdx(\"ul\", null, mdx(\"li\", {\n    parentName: \"ul\"\n  }, \"Commenting is same as html \", mdx(\"code\", {\n    parentName: \"li\",\n    \"className\": \"language-text\"\n  }, \"<!-- ->\")), mdx(\"li\", {\n    parentName: \"ul\"\n  }, \"Template strings\"), mdx(\"li\", {\n    parentName: \"ul\"\n  }, \"White space control\"), mdx(\"li\", {\n    parentName: \"ul\"\n  }, \"Invalid element tags leads to unknown tag\")), mdx(\"h2\", {\n    \"id\": \"clear-timers\",\n    \"style\": {\n      \"position\": \"relative\"\n    }\n  }, mdx(\"a\", {\n    parentName: \"h2\",\n    \"href\": \"#clear-timers\",\n    \"aria-label\": \"clear timers permalink\",\n    \"className\": \"anchor before\"\n  }, mdx(\"svg\", {\n    parentName: \"a\",\n    \"aria-hidden\": \"true\",\n    \"focusable\": \"false\",\n    \"height\": \"16\",\n    \"version\": \"1.1\",\n    \"viewBox\": \"0 0 16 16\",\n    \"width\": \"16\"\n  }, mdx(\"path\", {\n    parentName: \"svg\",\n    \"fillRule\": \"evenodd\",\n    \"d\": \"M4 9h1v1H4c-1.5 0-3-1.69-3-3.5S2.55 3 4 3h4c1.45 0 3 1.69 3 3.5 0 1.41-.91 2.72-2 3.25V8.59c.58-.45 1-1.27 1-2.09C10 5.22 8.98 4 8 4H4c-.98 0-2 1.22-2 2.5S3 9 4 9zm9-3h-1v1h1c1 0 2 1.22 2 2.5S13.98 12 13 12H9c-.98 0-2-1.22-2-2.5 0-.83.42-1.64 1-2.09V6.25c-1.09.53-2 1.84-2 3.25C6 11.31 7.55 13 9 13h4c1.45 0 3-1.69 3-3.5S14.5 6 13 6z\"\n  }))), \"Clear timers\"), mdx(\"div\", {\n    \"className\": \"gatsby-highlight\",\n    \"data-language\": \"js\"\n  }, mdx(\"pre\", {\n    parentName: \"div\",\n    \"className\": \"language-js\"\n  }, mdx(\"code\", {\n    parentName: \"pre\",\n    \"className\": \"language-js\"\n  }, mdx(\"span\", {\n    parentName: \"code\",\n    \"className\": \"token keyword\"\n  }, \"import\"), \" Artist \", mdx(\"span\", {\n    parentName: \"code\",\n    \"className\": \"token keyword\"\n  }, \"from\"), \" \", mdx(\"span\", {\n    parentName: \"code\",\n    \"className\": \"token string\"\n  }, \"\\\"@lesy/artist\\\"\"), mdx(\"span\", {\n    parentName: \"code\",\n    \"className\": \"token punctuation\"\n  }, \";\"), \"\\n\", mdx(\"span\", {\n    parentName: \"code\",\n    \"className\": \"token keyword\"\n  }, \"const\"), \" \", mdx(\"span\", {\n    parentName: \"code\",\n    \"className\": \"token constant\"\n  }, \"UI\"), \" \", mdx(\"span\", {\n    parentName: \"code\",\n    \"className\": \"token operator\"\n  }, \"=\"), \" \", mdx(\"span\", {\n    parentName: \"code\",\n    \"className\": \"token keyword\"\n  }, \"new\"), \" \", mdx(\"span\", {\n    parentName: \"code\",\n    \"className\": \"token class-name\"\n  }, \"Artist\"), mdx(\"span\", {\n    parentName: \"code\",\n    \"className\": \"token punctuation\"\n  }, \"(\"), mdx(\"span\", {\n    parentName: \"code\",\n    \"className\": \"token punctuation\"\n  }, \")\"), mdx(\"span\", {\n    parentName: \"code\",\n    \"className\": \"token punctuation\"\n  }, \";\"), \"\\n\\n\", mdx(\"span\", {\n    parentName: \"code\",\n    \"className\": \"token constant\"\n  }, \"UI\"), mdx(\"span\", {\n    parentName: \"code\",\n    \"className\": \"token punctuation\"\n  }, \".\"), mdx(\"span\", {\n    parentName: \"code\",\n    \"className\": \"token function\"\n  }, \"onInit\"), mdx(\"span\", {\n    parentName: \"code\",\n    \"className\": \"token punctuation\"\n  }, \"(\"), mdx(\"span\", {\n    parentName: \"code\",\n    \"className\": \"token punctuation\"\n  }, \"(\"), mdx(\"span\", {\n    parentName: \"code\",\n    \"className\": \"token parameter\"\n  }, \"store\", mdx(\"span\", {\n    parentName: \"span\",\n    \"className\": \"token punctuation\"\n  }, \",\"), \" props\", mdx(\"span\", {\n    parentName: \"span\",\n    \"className\": \"token punctuation\"\n  }, \",\"), \" timer\"), mdx(\"span\", {\n    parentName: \"code\",\n    \"className\": \"token punctuation\"\n  }, \")\"), \" \", mdx(\"span\", {\n    parentName: \"code\",\n    \"className\": \"token operator\"\n  }, \"=>\"), \" \", mdx(\"span\", {\n    parentName: \"code\",\n    \"className\": \"token punctuation\"\n  }, \"{\"), \"\\n  \", mdx(\"span\", {\n    parentName: \"code\",\n    \"className\": \"token function\"\n  }, \"timer\"), mdx(\"span\", {\n    parentName: \"code\",\n    \"className\": \"token punctuation\"\n  }, \"(\"), mdx(\"span\", {\n    parentName: \"code\",\n    \"className\": \"token punctuation\"\n  }, \"(\"), mdx(\"span\", {\n    parentName: \"code\",\n    \"className\": \"token punctuation\"\n  }, \")\"), \" \", mdx(\"span\", {\n    parentName: \"code\",\n    \"className\": \"token operator\"\n  }, \"=>\"), \" \", mdx(\"span\", {\n    parentName: \"code\",\n    \"className\": \"token punctuation\"\n  }, \"(\"), \"store\", mdx(\"span\", {\n    parentName: \"code\",\n    \"className\": \"token punctuation\"\n  }, \".\"), \"count \", mdx(\"span\", {\n    parentName: \"code\",\n    \"className\": \"token operator\"\n  }, \"+=\"), \" \", mdx(\"span\", {\n    parentName: \"code\",\n    \"className\": \"token number\"\n  }, \"1\"), mdx(\"span\", {\n    parentName: \"code\",\n    \"className\": \"token punctuation\"\n  }, \")\"), mdx(\"span\", {\n    parentName: \"code\",\n    \"className\": \"token punctuation\"\n  }, \",\"), \" \", mdx(\"span\", {\n    parentName: \"code\",\n    \"className\": \"token number\"\n  }, \"1000\"), mdx(\"span\", {\n    parentName: \"code\",\n    \"className\": \"token punctuation\"\n  }, \",\"), \" \", mdx(\"span\", {\n    parentName: \"code\",\n    \"className\": \"token string\"\n  }, \"\\\"my-key\\\"\"), mdx(\"span\", {\n    parentName: \"code\",\n    \"className\": \"token punctuation\"\n  }, \")\"), mdx(\"span\", {\n    parentName: \"code\",\n    \"className\": \"token punctuation\"\n  }, \";\"), \"\\n\", mdx(\"span\", {\n    parentName: \"code\",\n    \"className\": \"token punctuation\"\n  }, \"}\"), mdx(\"span\", {\n    parentName: \"code\",\n    \"className\": \"token punctuation\"\n  }, \")\"), mdx(\"span\", {\n    parentName: \"code\",\n    \"className\": \"token punctuation\"\n  }, \";\"), \"\\n\\n\", mdx(\"span\", {\n    parentName: \"code\",\n    \"className\": \"token constant\"\n  }, \"UI\"), mdx(\"span\", {\n    parentName: \"code\",\n    \"className\": \"token punctuation\"\n  }, \".\"), mdx(\"span\", {\n    parentName: \"code\",\n    \"className\": \"token function\"\n  }, \"render\"), mdx(\"span\", {\n    parentName: \"code\",\n    \"className\": \"token punctuation\"\n  }, \"(\"), mdx(\"span\", {\n    parentName: \"code\",\n    \"className\": \"token parameter\"\n  }, \"store\"), \" \", mdx(\"span\", {\n    parentName: \"code\",\n    \"className\": \"token operator\"\n  }, \"=>\"), \" \", mdx(\"span\", {\n    parentName: \"code\",\n    \"className\": \"token punctuation\"\n  }, \"{\"), \"\\n  \", mdx(\"span\", {\n    parentName: \"code\",\n    \"className\": \"token keyword\"\n  }, \"return\"), \" \", mdx(\"span\", {\n    parentName: \"code\",\n    \"className\": \"token template-string\"\n  }, mdx(\"span\", {\n    parentName: \"span\",\n    \"className\": \"token template-punctuation string\"\n  }, \"`\"), mdx(\"span\", {\n    parentName: \"span\",\n    \"className\": \"token string\"\n  }, \"<spinner/> - counter \"), mdx(\"span\", {\n    parentName: \"span\",\n    \"className\": \"token interpolation\"\n  }, mdx(\"span\", {\n    parentName: \"span\",\n    \"className\": \"token interpolation-punctuation punctuation\"\n  }, \"${\"), \"store\", mdx(\"span\", {\n    parentName: \"span\",\n    \"className\": \"token punctuation\"\n  }, \".\"), \"counter\", mdx(\"span\", {\n    parentName: \"span\",\n    \"className\": \"token interpolation-punctuation punctuation\"\n  }, \"}\")), mdx(\"span\", {\n    parentName: \"span\",\n    \"className\": \"token template-punctuation string\"\n  }, \"`\")), mdx(\"span\", {\n    parentName: \"code\",\n    \"className\": \"token punctuation\"\n  }, \";\"), \"\\n\", mdx(\"span\", {\n    parentName: \"code\",\n    \"className\": \"token punctuation\"\n  }, \"}\"), mdx(\"span\", {\n    parentName: \"code\",\n    \"className\": \"token punctuation\"\n  }, \")\"), mdx(\"span\", {\n    parentName: \"code\",\n    \"className\": \"token punctuation\"\n  }, \";\"), \"\\n\\n\", mdx(\"span\", {\n    parentName: \"code\",\n    \"className\": \"token function\"\n  }, \"setTimeout\"), mdx(\"span\", {\n    parentName: \"code\",\n    \"className\": \"token punctuation\"\n  }, \"(\"), mdx(\"span\", {\n    parentName: \"code\",\n    \"className\": \"token punctuation\"\n  }, \"(\"), mdx(\"span\", {\n    parentName: \"code\",\n    \"className\": \"token punctuation\"\n  }, \")\"), \" \", mdx(\"span\", {\n    parentName: \"code\",\n    \"className\": \"token operator\"\n  }, \"=>\"), \" \", mdx(\"span\", {\n    parentName: \"code\",\n    \"className\": \"token punctuation\"\n  }, \"{\"), \"\\n  \", mdx(\"span\", {\n    parentName: \"code\",\n    \"className\": \"token constant\"\n  }, \"UI\"), mdx(\"span\", {\n    parentName: \"code\",\n    \"className\": \"token punctuation\"\n  }, \".\"), mdx(\"span\", {\n    parentName: \"code\",\n    \"className\": \"token function\"\n  }, \"clearAllTimers\"), mdx(\"span\", {\n    parentName: \"code\",\n    \"className\": \"token punctuation\"\n  }, \"(\"), mdx(\"span\", {\n    parentName: \"code\",\n    \"className\": \"token punctuation\"\n  }, \")\"), mdx(\"span\", {\n    parentName: \"code\",\n    \"className\": \"token punctuation\"\n  }, \";\"), \"\\n\", mdx(\"span\", {\n    parentName: \"code\",\n    \"className\": \"token punctuation\"\n  }, \"}\"), mdx(\"span\", {\n    parentName: \"code\",\n    \"className\": \"token punctuation\"\n  }, \",\"), \" \", mdx(\"span\", {\n    parentName: \"code\",\n    \"className\": \"token number\"\n  }, \"2000\"), mdx(\"span\", {\n    parentName: \"code\",\n    \"className\": \"token punctuation\"\n  }, \")\"), mdx(\"span\", {\n    parentName: \"code\",\n    \"className\": \"token punctuation\"\n  }, \";\")))), mdx(\"h2\", {\n    \"id\": \"performance\",\n    \"style\": {\n      \"position\": \"relative\"\n    }\n  }, mdx(\"a\", {\n    parentName: \"h2\",\n    \"href\": \"#performance\",\n    \"aria-label\": \"performance permalink\",\n    \"className\": \"anchor before\"\n  }, mdx(\"svg\", {\n    parentName: \"a\",\n    \"aria-hidden\": \"true\",\n    \"focusable\": \"false\",\n    \"height\": \"16\",\n    \"version\": \"1.1\",\n    \"viewBox\": \"0 0 16 16\",\n    \"width\": \"16\"\n  }, mdx(\"path\", {\n    parentName: \"svg\",\n    \"fillRule\": \"evenodd\",\n    \"d\": \"M4 9h1v1H4c-1.5 0-3-1.69-3-3.5S2.55 3 4 3h4c1.45 0 3 1.69 3 3.5 0 1.41-.91 2.72-2 3.25V8.59c.58-.45 1-1.27 1-2.09C10 5.22 8.98 4 8 4H4c-.98 0-2 1.22-2 2.5S3 9 4 9zm9-3h-1v1h1c1 0 2 1.22 2 2.5S13.98 12 13 12H9c-.98 0-2-1.22-2-2.5 0-.83.42-1.64 1-2.09V6.25c-1.09.53-2 1.84-2 3.25C6 11.31 7.55 13 9 13h4c1.45 0 3-1.69 3-3.5S14.5 6 13 6z\"\n  }))), \"Performance\"), mdx(\"h3\", {\n    \"id\": \"donts\",\n    \"style\": {\n      \"position\": \"relative\"\n    }\n  }, mdx(\"a\", {\n    parentName: \"h3\",\n    \"href\": \"#donts\",\n    \"aria-label\": \"donts permalink\",\n    \"className\": \"anchor before\"\n  }, mdx(\"svg\", {\n    parentName: \"a\",\n    \"aria-hidden\": \"true\",\n    \"focusable\": \"false\",\n    \"height\": \"16\",\n    \"version\": \"1.1\",\n    \"viewBox\": \"0 0 16 16\",\n    \"width\": \"16\"\n  }, mdx(\"path\", {\n    parentName: \"svg\",\n    \"fillRule\": \"evenodd\",\n    \"d\": \"M4 9h1v1H4c-1.5 0-3-1.69-3-3.5S2.55 3 4 3h4c1.45 0 3 1.69 3 3.5 0 1.41-.91 2.72-2 3.25V8.59c.58-.45 1-1.27 1-2.09C10 5.22 8.98 4 8 4H4c-.98 0-2 1.22-2 2.5S3 9 4 9zm9-3h-1v1h1c1 0 2 1.22 2 2.5S13.98 12 13 12H9c-.98 0-2-1.22-2-2.5 0-.83.42-1.64 1-2.09V6.25c-1.09.53-2 1.84-2 3.25C6 11.31 7.55 13 9 13h4c1.45 0 3-1.69 3-3.5S14.5 6 13 6z\"\n  }))), \"Dont's\"), mdx(\"div\", {\n    \"className\": \"gatsby-highlight\",\n    \"data-language\": \"js\"\n  }, mdx(\"pre\", {\n    parentName: \"div\",\n    \"className\": \"language-js\"\n  }, mdx(\"code\", {\n    parentName: \"pre\",\n    \"className\": \"language-js\"\n  }, mdx(\"span\", {\n    parentName: \"code\",\n    \"className\": \"token keyword\"\n  }, \"import\"), \" Artist \", mdx(\"span\", {\n    parentName: \"code\",\n    \"className\": \"token keyword\"\n  }, \"from\"), \" \", mdx(\"span\", {\n    parentName: \"code\",\n    \"className\": \"token string\"\n  }, \"\\\"@lesy/artist\\\"\"), mdx(\"span\", {\n    parentName: \"code\",\n    \"className\": \"token punctuation\"\n  }, \";\"), \"\\n\", mdx(\"span\", {\n    parentName: \"code\",\n    \"className\": \"token keyword\"\n  }, \"const\"), \" \", mdx(\"span\", {\n    parentName: \"code\",\n    \"className\": \"token constant\"\n  }, \"UI\"), \" \", mdx(\"span\", {\n    parentName: \"code\",\n    \"className\": \"token operator\"\n  }, \"=\"), \" \", mdx(\"span\", {\n    parentName: \"code\",\n    \"className\": \"token keyword\"\n  }, \"new\"), \" \", mdx(\"span\", {\n    parentName: \"code\",\n    \"className\": \"token class-name\"\n  }, \"Artist\"), mdx(\"span\", {\n    parentName: \"code\",\n    \"className\": \"token punctuation\"\n  }, \"(\"), mdx(\"span\", {\n    parentName: \"code\",\n    \"className\": \"token punctuation\"\n  }, \")\"), mdx(\"span\", {\n    parentName: \"code\",\n    \"className\": \"token punctuation\"\n  }, \";\"), \"\\n\\n\", mdx(\"span\", {\n    parentName: \"code\",\n    \"className\": \"token constant\"\n  }, \"UI\"), mdx(\"span\", {\n    parentName: \"code\",\n    \"className\": \"token punctuation\"\n  }, \".\"), mdx(\"span\", {\n    parentName: \"code\",\n    \"className\": \"token function\"\n  }, \"render\"), mdx(\"span\", {\n    parentName: \"code\",\n    \"className\": \"token punctuation\"\n  }, \"(\"), mdx(\"span\", {\n    parentName: \"code\",\n    \"className\": \"token parameter\"\n  }, \"store\"), \" \", mdx(\"span\", {\n    parentName: \"code\",\n    \"className\": \"token operator\"\n  }, \"=>\"), \" \", mdx(\"span\", {\n    parentName: \"code\",\n    \"className\": \"token punctuation\"\n  }, \"{\"), \"\\n  \", mdx(\"span\", {\n    parentName: \"code\",\n    \"className\": \"token function\"\n  }, \"setInterval\"), mdx(\"span\", {\n    parentName: \"code\",\n    \"className\": \"token punctuation\"\n  }, \"(\"), mdx(\"span\", {\n    parentName: \"code\",\n    \"className\": \"token punctuation\"\n  }, \"(\"), mdx(\"span\", {\n    parentName: \"code\",\n    \"className\": \"token punctuation\"\n  }, \")\"), \" \", mdx(\"span\", {\n    parentName: \"code\",\n    \"className\": \"token operator\"\n  }, \"=>\"), \" \", mdx(\"span\", {\n    parentName: \"code\",\n    \"className\": \"token punctuation\"\n  }, \"{\"), \"\\n    store\", mdx(\"span\", {\n    parentName: \"code\",\n    \"className\": \"token punctuation\"\n  }, \".\"), \"count \", mdx(\"span\", {\n    parentName: \"code\",\n    \"className\": \"token operator\"\n  }, \"+=\"), \" \", mdx(\"span\", {\n    parentName: \"code\",\n    \"className\": \"token number\"\n  }, \"1\"), mdx(\"span\", {\n    parentName: \"code\",\n    \"className\": \"token punctuation\"\n  }, \";\"), \"\\n  \", mdx(\"span\", {\n    parentName: \"code\",\n    \"className\": \"token punctuation\"\n  }, \"}\"), mdx(\"span\", {\n    parentName: \"code\",\n    \"className\": \"token punctuation\"\n  }, \",\"), \" \", mdx(\"span\", {\n    parentName: \"code\",\n    \"className\": \"token number\"\n  }, \"1000\"), mdx(\"span\", {\n    parentName: \"code\",\n    \"className\": \"token punctuation\"\n  }, \")\"), mdx(\"span\", {\n    parentName: \"code\",\n    \"className\": \"token punctuation\"\n  }, \";\"), \"\\n  \", mdx(\"span\", {\n    parentName: \"code\",\n    \"className\": \"token keyword\"\n  }, \"return\"), \" \", mdx(\"span\", {\n    parentName: \"code\",\n    \"className\": \"token string\"\n  }, \"\\\"<span>${store.count}</store>\\\"\"), mdx(\"span\", {\n    parentName: \"code\",\n    \"className\": \"token punctuation\"\n  }, \";\"), \"\\n\", mdx(\"span\", {\n    parentName: \"code\",\n    \"className\": \"token punctuation\"\n  }, \"}\"), mdx(\"span\", {\n    parentName: \"code\",\n    \"className\": \"token punctuation\"\n  }, \")\"), mdx(\"span\", {\n    parentName: \"code\",\n    \"className\": \"token punctuation\"\n  }, \";\")))), mdx(\"div\", {\n    \"className\": \"gatsby-highlight\",\n    \"data-language\": \"js\"\n  }, mdx(\"pre\", {\n    parentName: \"div\",\n    \"className\": \"language-js\"\n  }, mdx(\"code\", {\n    parentName: \"pre\",\n    \"className\": \"language-js\"\n  }, mdx(\"span\", {\n    parentName: \"code\",\n    \"className\": \"token keyword\"\n  }, \"import\"), \" Artist \", mdx(\"span\", {\n    parentName: \"code\",\n    \"className\": \"token keyword\"\n  }, \"from\"), \" \", mdx(\"span\", {\n    parentName: \"code\",\n    \"className\": \"token string\"\n  }, \"\\\"@lesy/artist\\\"\"), mdx(\"span\", {\n    parentName: \"code\",\n    \"className\": \"token punctuation\"\n  }, \";\"), \"\\n\", mdx(\"span\", {\n    parentName: \"code\",\n    \"className\": \"token keyword\"\n  }, \"import\"), \" Case \", mdx(\"span\", {\n    parentName: \"code\",\n    \"className\": \"token keyword\"\n  }, \"from\"), \" \", mdx(\"span\", {\n    parentName: \"code\",\n    \"className\": \"token string\"\n  }, \"\\\"case\\\"\"), mdx(\"span\", {\n    parentName: \"code\",\n    \"className\": \"token punctuation\"\n  }, \";\"), \"\\n\", mdx(\"span\", {\n    parentName: \"code\",\n    \"className\": \"token keyword\"\n  }, \"const\"), \" \", mdx(\"span\", {\n    parentName: \"code\",\n    \"className\": \"token constant\"\n  }, \"UI\"), \" \", mdx(\"span\", {\n    parentName: \"code\",\n    \"className\": \"token operator\"\n  }, \"=\"), \" \", mdx(\"span\", {\n    parentName: \"code\",\n    \"className\": \"token keyword\"\n  }, \"new\"), \" \", mdx(\"span\", {\n    parentName: \"code\",\n    \"className\": \"token class-name\"\n  }, \"Artist\"), mdx(\"span\", {\n    parentName: \"code\",\n    \"className\": \"token punctuation\"\n  }, \"(\"), mdx(\"span\", {\n    parentName: \"code\",\n    \"className\": \"token punctuation\"\n  }, \")\"), mdx(\"span\", {\n    parentName: \"code\",\n    \"className\": \"token punctuation\"\n  }, \";\"), \"\\n\\n\", mdx(\"span\", {\n    parentName: \"code\",\n    \"className\": \"token keyword\"\n  }, \"const\"), \" Warning \", mdx(\"span\", {\n    parentName: \"code\",\n    \"className\": \"token operator\"\n  }, \"=\"), \" \", mdx(\"span\", {\n    parentName: \"code\",\n    \"className\": \"token punctuation\"\n  }, \"{\"), \"\\n  name\", mdx(\"span\", {\n    parentName: \"code\",\n    \"className\": \"token operator\"\n  }, \":\"), \" \", mdx(\"span\", {\n    parentName: \"code\",\n    \"className\": \"token string\"\n  }, \"\\\"warn\\\"\"), mdx(\"span\", {\n    parentName: \"code\",\n    \"className\": \"token punctuation\"\n  }, \",\"), \"\\n  \", mdx(\"span\", {\n    parentName: \"code\",\n    \"className\": \"token function-variable function\"\n  }, \"render\"), mdx(\"span\", {\n    parentName: \"code\",\n    \"className\": \"token operator\"\n  }, \":\"), \" \", mdx(\"span\", {\n    parentName: \"code\",\n    \"className\": \"token punctuation\"\n  }, \"(\"), mdx(\"span\", {\n    parentName: \"code\",\n    \"className\": \"token punctuation\"\n  }, \")\"), \" \", mdx(\"span\", {\n    parentName: \"code\",\n    \"className\": \"token operator\"\n  }, \"=>\"), \" \", mdx(\"span\", {\n    parentName: \"code\",\n    \"className\": \"token template-string\"\n  }, mdx(\"span\", {\n    parentName: \"span\",\n    \"className\": \"token template-punctuation string\"\n  }, \"`\"), mdx(\"span\", {\n    parentName: \"span\",\n    \"className\": \"token string\"\n  }, \"<text>\"), mdx(\"span\", {\n    parentName: \"span\",\n    \"className\": \"token interpolation\"\n  }, mdx(\"span\", {\n    parentName: \"span\",\n    \"className\": \"token interpolation-punctuation punctuation\"\n  }, \"${\"), \"Case\", mdx(\"span\", {\n    parentName: \"span\",\n    \"className\": \"token punctuation\"\n  }, \".\"), mdx(\"span\", {\n    parentName: \"span\",\n    \"className\": \"token function\"\n  }, \"upper\"), mdx(\"span\", {\n    parentName: \"span\",\n    \"className\": \"token punctuation\"\n  }, \"(\"), mdx(\"span\", {\n    parentName: \"span\",\n    \"className\": \"token string\"\n  }, \"\\\"warning\\\"\"), mdx(\"span\", {\n    parentName: \"span\",\n    \"className\": \"token punctuation\"\n  }, \")\"), mdx(\"span\", {\n    parentName: \"span\",\n    \"className\": \"token interpolation-punctuation punctuation\"\n  }, \"}\")), mdx(\"span\", {\n    parentName: \"span\",\n    \"className\": \"token string\"\n  }, \"</text>\"), mdx(\"span\", {\n    parentName: \"span\",\n    \"className\": \"token template-punctuation string\"\n  }, \"`\")), mdx(\"span\", {\n    parentName: \"code\",\n    \"className\": \"token punctuation\"\n  }, \",\"), \"\\n\", mdx(\"span\", {\n    parentName: \"code\",\n    \"className\": \"token punctuation\"\n  }, \"}\"), mdx(\"span\", {\n    parentName: \"code\",\n    \"className\": \"token punctuation\"\n  }, \";\"), \"\\n\", mdx(\"span\", {\n    parentName: \"code\",\n    \"className\": \"token constant\"\n  }, \"UI\"), mdx(\"span\", {\n    parentName: \"code\",\n    \"className\": \"token punctuation\"\n  }, \".\"), mdx(\"span\", {\n    parentName: \"code\",\n    \"className\": \"token function\"\n  }, \"registerEls\"), mdx(\"span\", {\n    parentName: \"code\",\n    \"className\": \"token punctuation\"\n  }, \"(\"), mdx(\"span\", {\n    parentName: \"code\",\n    \"className\": \"token punctuation\"\n  }, \"{\"), \" Warning \", mdx(\"span\", {\n    parentName: \"code\",\n    \"className\": \"token punctuation\"\n  }, \"}\"), mdx(\"span\", {\n    parentName: \"code\",\n    \"className\": \"token punctuation\"\n  }, \")\"), mdx(\"span\", {\n    parentName: \"code\",\n    \"className\": \"token punctuation\"\n  }, \";\"), \"\\n\\n\", mdx(\"span\", {\n    parentName: \"code\",\n    \"className\": \"token constant\"\n  }, \"UI\"), mdx(\"span\", {\n    parentName: \"code\",\n    \"className\": \"token punctuation\"\n  }, \".\"), mdx(\"span\", {\n    parentName: \"code\",\n    \"className\": \"token function\"\n  }, \"render\"), mdx(\"span\", {\n    parentName: \"code\",\n    \"className\": \"token punctuation\"\n  }, \"(\"), mdx(\"span\", {\n    parentName: \"code\",\n    \"className\": \"token punctuation\"\n  }, \"(\"), mdx(\"span\", {\n    parentName: \"code\",\n    \"className\": \"token punctuation\"\n  }, \")\"), \" \", mdx(\"span\", {\n    parentName: \"code\",\n    \"className\": \"token operator\"\n  }, \"=>\"), \" \", mdx(\"span\", {\n    parentName: \"code\",\n    \"className\": \"token punctuation\"\n  }, \"{\"), \"\\n  \", mdx(\"span\", {\n    parentName: \"code\",\n    \"className\": \"token keyword\"\n  }, \"return\"), \" \", mdx(\"span\", {\n    parentName: \"code\",\n    \"className\": \"token template-string\"\n  }, mdx(\"span\", {\n    parentName: \"span\",\n    \"className\": \"token template-punctuation string\"\n  }, \"`\"), mdx(\"span\", {\n    parentName: \"span\",\n    \"className\": \"token string\"\n  }, \"<warn/> - this is a warning\"), mdx(\"span\", {\n    parentName: \"span\",\n    \"className\": \"token template-punctuation string\"\n  }, \"`\")), mdx(\"span\", {\n    parentName: \"code\",\n    \"className\": \"token punctuation\"\n  }, \";\"), \"\\n\", mdx(\"span\", {\n    parentName: \"code\",\n    \"className\": \"token punctuation\"\n  }, \"}\"), mdx(\"span\", {\n    parentName: \"code\",\n    \"className\": \"token punctuation\"\n  }, \")\"), mdx(\"span\", {\n    parentName: \"code\",\n    \"className\": \"token punctuation\"\n  }, \";\")))), mdx(\"div\", {\n    \"className\": \"gatsby-highlight\",\n    \"data-language\": \"js\"\n  }, mdx(\"pre\", {\n    parentName: \"div\",\n    \"className\": \"language-js\"\n  }, mdx(\"code\", {\n    parentName: \"pre\",\n    \"className\": \"language-js\"\n  }, mdx(\"span\", {\n    parentName: \"code\",\n    \"className\": \"token keyword\"\n  }, \"const\"), \" Warning \", mdx(\"span\", {\n    parentName: \"code\",\n    \"className\": \"token operator\"\n  }, \"=\"), \" \", mdx(\"span\", {\n    parentName: \"code\",\n    \"className\": \"token punctuation\"\n  }, \"{\"), \"\\n  name\", mdx(\"span\", {\n    parentName: \"code\",\n    \"className\": \"token operator\"\n  }, \":\"), \" \", mdx(\"span\", {\n    parentName: \"code\",\n    \"className\": \"token string\"\n  }, \"\\\"warn\\\"\"), mdx(\"span\", {\n    parentName: \"code\",\n    \"className\": \"token punctuation\"\n  }, \",\"), \"\\n  \", mdx(\"span\", {\n    parentName: \"code\",\n    \"className\": \"token function-variable function\"\n  }, \"render\"), mdx(\"span\", {\n    parentName: \"code\",\n    \"className\": \"token operator\"\n  }, \":\"), \" \", mdx(\"span\", {\n    parentName: \"code\",\n    \"className\": \"token punctuation\"\n  }, \"(\"), mdx(\"span\", {\n    parentName: \"code\",\n    \"className\": \"token punctuation\"\n  }, \")\"), \" \", mdx(\"span\", {\n    parentName: \"code\",\n    \"className\": \"token operator\"\n  }, \"=>\"), \" \", mdx(\"span\", {\n    parentName: \"code\",\n    \"className\": \"token punctuation\"\n  }, \"{\"), \"\\n    \", mdx(\"span\", {\n    parentName: \"code\",\n    \"className\": \"token keyword\"\n  }, \"const\"), \" Case \", mdx(\"span\", {\n    parentName: \"code\",\n    \"className\": \"token operator\"\n  }, \"=\"), \" \", mdx(\"span\", {\n    parentName: \"code\",\n    \"className\": \"token function\"\n  }, \"require\"), mdx(\"span\", {\n    parentName: \"code\",\n    \"className\": \"token punctuation\"\n  }, \"(\"), mdx(\"span\", {\n    parentName: \"code\",\n    \"className\": \"token string\"\n  }, \"\\\"case\\\"\"), mdx(\"span\", {\n    parentName: \"code\",\n    \"className\": \"token punctuation\"\n  }, \")\"), mdx(\"span\", {\n    parentName: \"code\",\n    \"className\": \"token punctuation\"\n  }, \";\"), \"\\n    \", mdx(\"span\", {\n    parentName: \"code\",\n    \"className\": \"token keyword\"\n  }, \"return\"), \" \", mdx(\"span\", {\n    parentName: \"code\",\n    \"className\": \"token template-string\"\n  }, mdx(\"span\", {\n    parentName: \"span\",\n    \"className\": \"token template-punctuation string\"\n  }, \"`\"), mdx(\"span\", {\n    parentName: \"span\",\n    \"className\": \"token string\"\n  }, \"<text>\"), mdx(\"span\", {\n    parentName: \"span\",\n    \"className\": \"token interpolation\"\n  }, mdx(\"span\", {\n    parentName: \"span\",\n    \"className\": \"token interpolation-punctuation punctuation\"\n  }, \"${\"), \"Case\", mdx(\"span\", {\n    parentName: \"span\",\n    \"className\": \"token punctuation\"\n  }, \".\"), mdx(\"span\", {\n    parentName: \"span\",\n    \"className\": \"token function\"\n  }, \"upper\"), mdx(\"span\", {\n    parentName: \"span\",\n    \"className\": \"token punctuation\"\n  }, \"(\"), mdx(\"span\", {\n    parentName: \"span\",\n    \"className\": \"token string\"\n  }, \"\\\"warning\\\"\"), mdx(\"span\", {\n    parentName: \"span\",\n    \"className\": \"token punctuation\"\n  }, \")\"), mdx(\"span\", {\n    parentName: \"span\",\n    \"className\": \"token interpolation-punctuation punctuation\"\n  }, \"}\")), mdx(\"span\", {\n    parentName: \"span\",\n    \"className\": \"token string\"\n  }, \"</text>\"), mdx(\"span\", {\n    parentName: \"span\",\n    \"className\": \"token template-punctuation string\"\n  }, \"`\")), mdx(\"span\", {\n    parentName: \"code\",\n    \"className\": \"token punctuation\"\n  }, \";\"), \"\\n  \", mdx(\"span\", {\n    parentName: \"code\",\n    \"className\": \"token punctuation\"\n  }, \"}\"), mdx(\"span\", {\n    parentName: \"code\",\n    \"className\": \"token punctuation\"\n  }, \",\"), \"\\n\", mdx(\"span\", {\n    parentName: \"code\",\n    \"className\": \"token punctuation\"\n  }, \"}\"), mdx(\"span\", {\n    parentName: \"code\",\n    \"className\": \"token punctuation\"\n  }, \";\")))), mdx(\"h2\", {\n    \"id\": \"know-more\",\n    \"style\": {\n      \"position\": \"relative\"\n    }\n  }, mdx(\"a\", {\n    parentName: \"h2\",\n    \"href\": \"#know-more\",\n    \"aria-label\": \"know more permalink\",\n    \"className\": \"anchor before\"\n  }, mdx(\"svg\", {\n    parentName: \"a\",\n    \"aria-hidden\": \"true\",\n    \"focusable\": \"false\",\n    \"height\": \"16\",\n    \"version\": \"1.1\",\n    \"viewBox\": \"0 0 16 16\",\n    \"width\": \"16\"\n  }, mdx(\"path\", {\n    parentName: \"svg\",\n    \"fillRule\": \"evenodd\",\n    \"d\": \"M4 9h1v1H4c-1.5 0-3-1.69-3-3.5S2.55 3 4 3h4c1.45 0 3 1.69 3 3.5 0 1.41-.91 2.72-2 3.25V8.59c.58-.45 1-1.27 1-2.09C10 5.22 8.98 4 8 4H4c-.98 0-2 1.22-2 2.5S3 9 4 9zm9-3h-1v1h1c1 0 2 1.22 2 2.5S13.98 12 13 12H9c-.98 0-2-1.22-2-2.5 0-.83.42-1.64 1-2.09V6.25c-1.09.53-2 1.84-2 3.25C6 11.31 7.55 13 9 13h4c1.45 0 3-1.69 3-3.5S14.5 6 13 6z\"\n  }))), \"Know more\"), mdx(\"ul\", null, mdx(\"li\", {\n    parentName: \"ul\"\n  }, \"Artist plugin\"), mdx(\"li\", {\n    parentName: \"ul\"\n  }, \"Github repo\"), mdx(\"li\", {\n    parentName: \"ul\"\n  }, \"npm plugin\")));\n}\n;\nMDXContent.isMDXComponent = true;"},"githubData":{"github":{"repository":{"releases":{"edges":[{"node":{"descriptionHTML":"<h1><a href=\"https://github.com/lokesh-coder/lesyjs/compare/v1.0.0-beta.16...v1.0.0-beta.17\">1.0.0-beta.17</a> (2021-04-29)</h1>\n<p><strong>Note:</strong> Version bump only for package lesyjs</p>"}},{"node":{"descriptionHTML":"<h1><a href=\"https://github.com/lokesh-coder/lesyjs/compare/v1.0.0-beta.15...v1.0.0-beta.16\">1.0.0-beta.16</a> (2021-04-27)</h1>\n<h3>Bug Fixes</h3>\n<ul>\n<li><strong>artist:</strong> clear unused timers (<a href=\"https://github.com/lokesh-coder/lesyjs/commit/4a4ef55760ad536f8d97e424cbf2870375d3eb0a\">4a4ef55</a>)</li>\n<li><strong>artist:</strong> setInterval clear on re-render and add elements (<a href=\"https://github.com/lokesh-coder/lesyjs/commit/bc48a8d7259d1c1d1fdd109de73491ad305ea70a\">bc48a8d</a>)</li>\n<li><strong>lesy:</strong> remove unused code (<a href=\"https://github.com/lokesh-coder/lesyjs/commit/986864bddf80ce3518541b693700b038e4052e89\">986864b</a>)</li>\n<li><strong>lesy-pilot-ui:</strong> update log for dynamic change (<a href=\"https://github.com/lokesh-coder/lesyjs/commit/c0ef6ea1eb9877a97575331e364ace8c3e88f461\">c0ef6ea</a>)</li>\n<li><strong>lesy-plugin-artist:</strong> attach clear timers func and enable plugins support (<a href=\"https://github.com/lokesh-coder/lesyjs/commit/790231308e01cabb0d800961ddb4c4e2575c5c17\">7902313</a>)</li>\n<li><strong>lesy-plugin-pilot:</strong> enable dynamic rewrite logs (<a href=\"https://github.com/lokesh-coder/lesyjs/commit/9d2d2bd28c23d79c699cbcc81fcb9b4183ecdb6f\">9d2d2bd</a>)</li>\n</ul>\n<h3>Features</h3>\n<ul>\n<li><strong>captain:</strong> pilot desktop version (<a href=\"https://github.com/lokesh-coder/lesyjs/commit/5ca0339f047d46d8580d30b3c904a876f04962a0\">5ca0339</a>)</li>\n<li><strong>core:</strong> add support for plugins plugin in config (<a href=\"https://github.com/lokesh-coder/lesyjs/commit/5cea5f11bd29d49890117bdd2575173e9f7890c7\">5cea5f1</a>)</li>\n</ul>"}},{"node":{"descriptionHTML":"<h1><a href=\"https://github.com/lokesh-coder/lesyjs/compare/v1.0.0-beta.14...v1.0.0-beta.15\">1.0.0-beta.15</a> (2020-12-11)</h1>\n<h3>Bug Fixes</h3>\n<ul>\n<li><strong>lesy-pilot-ui:</strong> template binding fixes (<a href=\"https://github.com/lokesh-coder/lesyjs/commit/031eb1954c1411e65213e4f5142c88f5494bfb34\">031eb19</a>)</li>\n<li><strong>lesy-pilot-ui:</strong> update help screen content (<a href=\"https://github.com/lokesh-coder/lesyjs/commit/e67a2f78c7eb126208c67a01b9c82b73f4613ba0\">e67a2f7</a>)</li>\n</ul>\n<h3>Features</h3>\n<ul>\n<li><strong>artist:</strong> add new artist library (<a href=\"https://github.com/lokesh-coder/lesyjs/commit/8eec4bd312bfd059150051a7a1816bd6430f8d5e\">8eec4bd</a>)</li>\n<li><strong>core:</strong> add middleware data in request object (<a href=\"https://github.com/lokesh-coder/lesyjs/commit/cf62dbaf39d1e1cc02f243ccec0b6e15b8b472b0\">cf62dba</a>)</li>\n<li><strong>lesy-pilot-ui:</strong> add middlewares panel (<a href=\"https://github.com/lokesh-coder/lesyjs/commit/8a8309707b8318a1f3de8d2fd548540d7c8bf856\">8a83097</a>)</li>\n<li><strong>lesy-plugin-artist:</strong> add artist plugin library (<a href=\"https://github.com/lokesh-coder/lesyjs/commit/28bb3c9ceb52bc4bda33bcba720f75c4b0e595ba\">28bb3c9</a>)</li>\n<li><strong>lesy-plugin-demo:</strong> add input command (<a href=\"https://github.com/lokesh-coder/lesyjs/commit/829d658d915d23bdffca90b91990bf74f7ff5e3e\">829d658</a>)</li>\n<li><strong>lesy-plugin-pilot:</strong> enable middlewares in request (<a href=\"https://github.com/lokesh-coder/lesyjs/commit/2f874ec8f49d7f622876d89b32bbc089a6c9b4a3\">2f874ec</a>)</li>\n</ul>"}},{"node":{"descriptionHTML":"<h1><a href=\"https://github.com/lokesh-coder/lesyjs/compare/v1.0.0-beta.13...v1.0.0-beta.14\">1.0.0-beta.14</a> (2020-11-01)</h1>\n<p><strong>Note:</strong> Version bump only for package lesyjs</p>"}},{"node":{"descriptionHTML":"<h1><a href=\"https://github.com/lokesh-coder/lesyjs/compare/v1.0.0-beta.12...v1.0.0-beta.13\">1.0.0-beta.13</a> (2020-10-27)</h1>\n<h3>Bug Fixes</h3>\n<ul>\n<li><strong>lesy-pilot-ui:</strong> fix mobile view layout (<a href=\"https://github.com/lokesh-coder/lesyjs/commit/a130e65f3c361aefea19edbbfc67f7354bbe442b\">a130e65</a>)</li>\n</ul>"}},{"node":{"descriptionHTML":"<h1><a href=\"https://github.com/lokesh-coder/lesyjs/compare/v1.0.0-beta.11...v1.0.0-beta.12\">1.0.0-beta.12</a> (2020-10-25)</h1>\n<p><strong>Note:</strong> Version bump only for package lesy</p>"}},{"node":{"descriptionHTML":"<h1><a href=\"https://github.com/lokesh-coder/lesyjs/compare/v1.0.0-beta.10...v1.0.0-beta.11\">1.0.0-beta.11</a> (2020-10-14)</h1>\n<h3>Bug Fixes</h3>\n<ul>\n<li><strong>lesy-plugin-generator:</strong> windows path escaped in  handlebars (<a href=\"https://github.com/lokesh-coder/lesyjs/commit/a3c06aa2350b80afdfc1b11ea747bfb18a9599ce\">a3c06aa</a>)</li>\n</ul>"}},{"node":{"descriptionHTML":"<h1><a href=\"https://github.com/lokesh-coder/lesyjs/compare/v1.0.0-beta.9...v1.0.0-beta.10\">1.0.0-beta.10</a> (2020-09-27)</h1>\n<h3>Bug Fixes</h3>\n<ul>\n<li><strong>compiler:</strong> default props is mutating when workspace is loaded (<a href=\"https://github.com/lokesh-coder/lesyjs/commit/e625259874557c796adfe355557202cad47e863d\">e625259</a>)</li>\n<li><strong>compiler:</strong> merge user plugins with default plugins (<a href=\"https://github.com/lokesh-coder/lesyjs/commit/5849d0fa984fd2f5b1202a720bade4da10f09cf7\">5849d0f</a>)</li>\n<li><strong>core:</strong> when command prop value is boolean is ignore in command (<a href=\"https://github.com/lokesh-coder/lesyjs/commit/fa79825f07c3e93f987cb6f804edac7cbc666ad7\">fa79825</a>)</li>\n<li><strong>lesy-plugin-config:</strong> add missing setter function (<a href=\"https://github.com/lokesh-coder/lesyjs/commit/51624ddd9658061b186be1b1d5f07cb847b8bb76\">51624dd</a>)</li>\n<li><strong>lesy-plugin-pilot:</strong> isVisible prop typo (<a href=\"https://github.com/lokesh-coder/lesyjs/commit/1aef7118c73bc73712c51d4cdace62f206ac16e3\">1aef711</a>)</li>\n<li><strong>lesy-plugin-pilot:</strong> lookup for localstate instead of direct prop (<a href=\"https://github.com/lokesh-coder/lesyjs/commit/0fabc184df3e00d141f6316fe94ce05bfb315705\">0fabc18</a>)</li>\n</ul>\n<h3>Features</h3>\n<ul>\n<li><strong>lesy-pilot-ui:</strong> support to change console position (<a href=\"https://github.com/lokesh-coder/lesyjs/commit/8be7b369efcf1174b223ccebc8a81e3f850123ed\">8be7b36</a>)</li>\n</ul>\n<h3>Performance Improvements</h3>\n<ul>\n<li><strong>compiler:</strong> improve loading performance (<a href=\"https://github.com/lokesh-coder/lesyjs/commit/818163e80e7bbcec4705e0b60439743297614847\">818163e</a>)</li>\n<li><strong>core:</strong> refactor to improve performance (<a href=\"https://github.com/lokesh-coder/lesyjs/commit/830198f0ec2660512f9d1e5031934cf775f90378\">830198f</a>)</li>\n<li><strong>lesy:</strong> run with TS in dev mode (<a href=\"https://github.com/lokesh-coder/lesyjs/commit/f01ff2870c55ec12f2710d0eba13d160e8898231\">f01ff28</a>)</li>\n<li><strong>lesy-benchmark:</strong> update results (<a href=\"https://github.com/lokesh-coder/lesyjs/commit/9aaca95d2d0d730aa9df1b5c8f04e705c1307933\">9aaca95</a>)</li>\n</ul>"}},{"node":{"descriptionHTML":"<h1><a href=\"https://github.com/lokesh-coder/lesyjs/compare/v1.0.0-beta.8...v1.0.0-beta.9\">1.0.0-beta.9</a> (2020-09-16)</h1>\n<h3>Bug Fixes</h3>\n<ul>\n<li><strong>lesy-plugin-pilot:</strong> lookup for localState when loading workspace projects (<a href=\"https://github.com/lokesh-coder/lesyjs/commit/eb05fc92276f293bc7608ebadc79d8d0f459a94e\">eb05fc9</a>)</li>\n</ul>"}},{"node":{"descriptionHTML":"<h1><a href=\"https://github.com/lokesh-coder/lesyjs/compare/v1.0.0-beta.7...v1.0.0-beta.8\">1.0.0-beta.8</a> (2020-09-16)</h1>\n<h3>Performance Improvements</h3>\n<ul>\n<li>improve overall performance (<a href=\"https://github.com/lokesh-coder/lesyjs/commit/f2635870954e202ddcfffc252c9dac4387abe3f1\">f263587</a>)</li>\n</ul>"}},{"node":{"descriptionHTML":"<h1><a href=\"https://github.com/lokesh-coder/lesyjs/compare/v1.0.0-beta.6...v1.0.0-beta.7\">1.0.0-beta.7</a> (2020-08-24)</h1>\n<h3>Bug Fixes</h3>\n<ul>\n<li><strong>pilot-ui:</strong> workspacesuing same core module (<a href=\"https://github.com/lokesh-coder/lesyjs/commit/c7060947088c0e4819ad182609b90949473d28bd\">c706094</a>)</li>\n</ul>\n<h3>Performance Improvements</h3>\n<ul>\n<li>update benchmark results (<a href=\"https://github.com/lokesh-coder/lesyjs/commit/c5dcd6e7c8e6f8ae2f53b820e5f0178f377b29d3\">c5dcd6e</a>)</li>\n</ul>"}},{"node":{"descriptionHTML":"<h1><a href=\"https://github.com/lokesh-coder/lesyjs/compare/v1.0.0-beta.5...v1.0.0-beta.6\">1.0.0-beta.6</a> (2020-08-19)</h1>\n<h3>Bug Fixes</h3>\n<ul>\n<li><strong>compiler:</strong> return print data when workspace is not enabled (<a href=\"https://github.com/lokesh-coder/lesyjs/commit/c72ad1699381b230842cc98dee844dfe786d8ba0\">c72ad16</a>)</li>\n<li><strong>core:</strong> set default cmd and ignore files prefix with _ (<a href=\"https://github.com/lokesh-coder/lesyjs/commit/fe9f781ca6c3a04ebb77b63cbaad83b13c22c9b5\">fe9f781</a>)</li>\n<li><strong>docs:</strong> update typos and modify terms (<a href=\"https://github.com/lokesh-coder/lesyjs/commit/ee51225f47d09fd7feeb85ad3af0a858e36b6cec\">ee51225</a>)</li>\n<li><strong>lesy:</strong> refactor scaffold templates (<a href=\"https://github.com/lokesh-coder/lesyjs/commit/a2776cf9bb2e93ca8da3929fdf60265fa2dd4073\">a2776cf</a>)</li>\n<li><strong>lesy-plugin-sidekick:</strong> exit verison middleware gracefully (<a href=\"https://github.com/lokesh-coder/lesyjs/commit/d7127f1bbd2f68bef4e2cea9194d334860ee7e98\">d7127f1</a>)</li>\n</ul>\n<h3>Features</h3>\n<ul>\n<li><strong>compiler:</strong> add support for workspace (<a href=\"https://github.com/lokesh-coder/lesyjs/commit/add61aceda5c660e3635a5d61b4438c983bfb90f\">add61ac</a>)</li>\n<li><strong>core:</strong> add support to ignore files while providing dir (<a href=\"https://github.com/lokesh-coder/lesyjs/commit/ff6b17f610e4229db43ac1d0ea19f09674c01fba\">ff6b17f</a>)</li>\n<li><strong>lesy:</strong> update templates for workspace support (<a href=\"https://github.com/lokesh-coder/lesyjs/commit/49e2569d2791a97cf3f0ade39037f0a9acd396a2\">49e2569</a>)</li>\n<li><strong>lesy-pilot-ui:</strong> add workspace screen (<a href=\"https://github.com/lokesh-coder/lesyjs/commit/70989b0fa19ebdca00461d14b4bb9db2c92e92e0\">70989b0</a>)</li>\n<li><strong>lesy-plugin-pilot:</strong> support multiple projects (<a href=\"https://github.com/lokesh-coder/lesyjs/commit/4b756556f5572a8b3071aa1d28ca72f93b2fe26e\">4b75655</a>)</li>\n</ul>"}},{"node":{"descriptionHTML":"<h1><a href=\"https://github.com/lokesh-coder/lesyjs/compare/v1.0.0-beta.4...v1.0.0-beta.5\">1.0.0-beta.5</a> (2020-06-22)</h1>\n<p><strong>Note:</strong> Version bump only for package lesy</p>"}},{"node":{"descriptionHTML":"<h1><a href=\"https://github.com/lokesh-coder/lesyjs/compare/v1.0.0-beta.3...v1.0.0-beta.4\">1.0.0-beta.4</a> (2020-06-21)</h1>\n<p><strong>Note:</strong> Version bump only for package lesy</p>"}},{"node":{"descriptionHTML":"<h1><a href=\"https://github.com/lokesh-coder/lesyjs/compare/v1.0.0-beta.2...v1.0.0-beta.3\">1.0.0-beta.3</a> (2020-06-17)</h1>\n<h3>Bug Fixes</h3>\n<ul>\n<li><strong>lesy-pilot-ui:</strong> allow optional required args (<a href=\"https://github.com/lokesh-coder/lesyjs/commit/ca9952c37432939dc67c67693a72e52c0d61d1d1\">ca9952c</a>)</li>\n<li><strong>lesy-plugin-validator:</strong> return middleware data (<a href=\"https://github.com/lokesh-coder/lesyjs/commit/e462264e12331a92984579097175ef2dbeaa7d7a\">e462264</a>)</li>\n<li><strong>validator:</strong> required rule not working when set to false (<a href=\"https://github.com/lokesh-coder/lesyjs/commit/5f9ab1d134afb485b957e2625ea16fc6a1268c48\">5f9ab1d</a>)</li>\n</ul>"}},{"node":{"descriptionHTML":"<h1>1.0.0-beta.1 (2020-06-09)</h1>\n<h3>Features</h3>\n<ul>\n<li>initial commit (<a href=\"https://github.com/lokesh-coder/lesyjs/commit/589700ba0d0f738bbfd77c2f921b81c4098adec9\">589700b</a>)</li>\n</ul>"}}]}}}}},"pageContext":{"slug":"libraries/standalone/artist-UI","parent":{"path":"libraries"},"section":{"name":"Standalone libraries","data":{"icon":"ri-suitcase-3-line"}},"name":"Artist UI","prev":{"slug":"plugins/official/sidekick","parent":{"path":"plugins"},"section":{"name":"Official plugins","data":{"icon":"ri-plug-2-line"}},"name":"Sidekick"},"next":{"slug":"libraries/standalone/object-validator","parent":{"path":"libraries"},"section":{"name":"Standalone libraries","data":{"icon":"ri-suitcase-3-line"}},"name":"Object validator"},"sidebarItems":[{"slug":"libraries/standalone/artist-UI","parent":{"path":"libraries"},"section":{"name":"Standalone libraries","data":{"icon":"ri-suitcase-3-line"}},"name":"Artist UI","prev":{"slug":"plugins/official/sidekick","parent":{"path":"plugins"},"section":{"name":"Official plugins","data":{"icon":"ri-plug-2-line"}},"name":"Sidekick"},"next":{"slug":"libraries/standalone/object-validator","parent":{"path":"libraries"},"section":{"name":"Standalone libraries","data":{"icon":"ri-suitcase-3-line"}},"name":"Object validator"}},{"slug":"libraries/standalone/object-validator","parent":{"path":"libraries"},"section":{"name":"Standalone libraries","data":{"icon":"ri-suitcase-3-line"}},"name":"Object validator","prev":{"slug":"libraries/standalone/artist-UI","parent":{"path":"libraries"},"section":{"name":"Standalone libraries","data":{"icon":"ri-suitcase-3-line"}},"name":"Artist UI"}}]}},"staticQueryHashes":["63159454"]}